Author Name,Title,Year,Citations
Anas A. Hadi,Gaining-sharing knowledge based algorithm for solving optimization problems: a novel nature-inspired algorithm,2020,349
Anas A. Hadi,LSHADE with semi-parameter adaptation hybrid with CMA-ES for solving CEC 2017 benchmark problems,2017,334
Anas A. Hadi,Novel mutation strategy for enhancing SHADE and LSHADE algorithms for global numerical optimization,2019,199
Anas A. Hadi,Evaluating the performance of adaptive gainingsharing knowledge based algorithm on CEC 2020 benchmark problems,2020,161
Anas A. Hadi,LSHADE-SPA memetic framework for solving large-scale optimization problems,2019,80
Anas A. Hadi,Problem definitions and evaluation criteria for the CEC 2021 special session and competition on single objective bound constrained numerical optimization,2020,73
Anas A. Hadi,Single-objective real-parameter optimization: Enhanced LSHADE-SPACMA algorithm,2021,70
Anas A. Hadi,Diagnosis autism by fisher linear discriminant analysis FLDA via EEG,2012,60
Anas A. Hadi,Gaining-sharing knowledge based algorithm with adaptive parameters hybrid with IMODE algorithm for solving CEC 2021 benchmark problems,2021,59
Anas A. Hadi,"Differential evolution mutations: taxonomy, comparison and convergence analysis",2021,48
Anas A. Hadi,Gaining-sharing knowledge based algorithm with adaptive parameters for engineering optimization,2021,29
Anas A. Hadi,EEG based autism diagnosis using regularized Fisher Linear Discriminant Analysis,2012,20
Anas A. Hadi,P300 speller efficiency with common average reference,2012,14
Anas A. Hadi,Evaluating the performance of meta-heuristic algorithms on CEC 2021 benchmark problems,2023,13
Anas A. Hadi,Generalized adaptive differential evolution algorithm for solving CEC 2020 benchmark problems,2020,12
Anas A. Hadi,"Hybrid classifiers for spatio-temporal abnormal behavior detection, tracking, and recognition in massive Hajj crowds",2023,9
Anas A. Hadi,Improving P300 based speller by feature selection,2014,8
Anas A. Hadi,MACC Net: Multi-task attention crowd counting network,2023,7
Anas A. Hadi,Parametrized benchmarking: an outline of the idea and a feasibility study,2020,6
Anas A. Hadi,"Hybrid classifiers for spatio-temporal real-time abnormal behaviors detection, tracking, and recognition in massive hajj crowds",2022,3
Anas A. Hadi,Analytical model of enhancing traffic performance based on weighted nodes,2016,3
Anas A. Hadi,Detecting Failures in HPC Storage Nodes,2016,2
Anas A. Hadi,The Effect of Dietary Probiotics and Prebiotics on the Performance of Broiler Chickens in Kuwait,2018,1
Anas A. Hadi,Improved Recommender for Location Privacy Preferences.,2015,1
Anas A. Hadi,Discovering COVID-19 Death Patterns from Deceased Patients: A Case Study in Saudi Arabia,2023,0
Anas A. Hadi,FEATURE SELECTION & EXTRACTION ALGORITHMS FOR BRAIN COMPUTER INTERFACE,N/A,0
João Guerreiro,CaBot: Designing and Evaluating an Autonomous Navigation Robot for Blind People,2019,134
João Guerreiro,BBeep: A Sonic Collision Avoidance System for Blind Travellers and Nearby Pedestrians,2019,120
João Guerreiro,Virtual Navigation for Blind People: Building Sequential Representations of the Real-World,2017,109
João Guerreiro,Airport Accessibility and Navigation Assistance for People with Visual Impairments,2019,93
João Guerreiro,NavCog3 in the wild: Large-scale blind indoor navigation assistant with semantic features,2019,81
João Guerreiro,UbiBraille: designing and evaluating a vibrotactile Braille-reading device,2013,80
João Guerreiro,Virtual Navigation for Blind People: Transferring Route Knowledge to the Real-World,2020,63
João Guerreiro,Grand challenges in accessible maps,2019,63
João Guerreiro,The present and future of museum accessibility for people with visual impairments,2018,56
João Guerreiro,Text-to-speeches: evaluating the perception of concurrent speech by blind people,2014,52
João Guerreiro,Faster Text-to-Speeches: Enhancing Blind People’s Information Scanning with Faster Concurrent Speech,2015,49
João Guerreiro,Blind people interacting with large touch surfaces: Strategies for one-handed and two-handed exploration,2015,41
João Guerreiro,How Context and User Behavior Affect Indoor Navigation Assistance for Blind People,2018,39
João Guerreiro,B# chord-based correction for multitouch braille input,2014,37
João Guerreiro,An Independent and Interactive Museum Experience for Blind People,2019,36
João Guerreiro,Impact of expertise on interaction preferences for navigation assistance of visually impaired individuals,2019,34
João Guerreiro,TabLETS get physical: non-visual text entry on tablet devices,2015,33
João Guerreiro,Open challenges of blind people using smartphones,2020,29
João Guerreiro,From skeuomorphism to flat design: age-related differences in performance and aesthetic perceptions,2020,27
João Guerreiro,Audiofunctions. web: Multimodal exploration of mathematical function graphs,2019,26
João Guerreiro,Scanning for digital content: How blind and sighted people perceive concurrent speech,2016,26
João Guerreiro,The Today and Tomorrow of Braille Learning,2013,26
João Guerreiro,Modeling Expertise in Assistive Navigation Interfaces for Blind People,2018,25
João Guerreiro,Variability in reactions to instructional guidance during smartphone-based assisted navigation of blind users,2018,23
João Guerreiro,Sig: Making maps accessible and putting accessibility in maps,2018,20
João Guerreiro,Beyond Post-It: Structured Multimedia Annotations for Collaborative VEs,2014,19
João Guerreiro,In-context Q&A to Support Blind People Using Smartphones,2017,18
João Guerreiro,Blind People Interacting with Mobile Social Applications: Open Challenges,2013,17
João Guerreiro,The Design Space of Nonvisual Word Completion,2019,16
João Guerreiro,Using Simultaneous Audio Sources to Speed-Up Blind People’s Web Scanning,2013,15
João Guerreiro,Stressing the Boundaries of Mobile Accessibility,2013,14
João Guerreiro,My Zelda Cane: Strategies Used by Blind Players to Play Visual-Centric Digital Games,2023,12
João Guerreiro,Smartphone-based assistance for blind people to stand in lines,2020,11
João Guerreiro,Deep learning compensation of rotation errors during navigation assistance for people with visual impairments or blindness,2019,11
João Guerreiro,The design space of the auditory representation of objects and their behaviours in virtual reality for blind people,2023,10
João Guerreiro,Towards screen readers with concurrent speech: where to go next?,2016,9
João Guerreiro,Augmenting braille input through multitouch feedback,2013,9
João Guerreiro,Authoring accessible media content on social networks,2022,8
João Guerreiro,Collaborative tabletops for blind people: The effect of auditory design on workspace awareness,2020,8
João Guerreiro,Hacking Blind Navigation,2019,7
João Guerreiro,"Visualiz'em: "" show me more about him!""",2012,7
João Guerreiro,Evaluating Accessible Navigation for Blind People in Virtual Environments,2023,6
João Guerreiro,Multimodal exploration of mathematical function graphs with audiofunctions. web,2019,6
João Guerreiro,Towards a fair comparison between name disambiguation approaches.,2013,6
João Guerreiro,Nipping Inaccessibility in the Bud: Opportunities and Challenges of Accessible Media Content Authoring,2021,5
João Guerreiro,Towards Inviscid Text-Entry for Blind People through Non-Visual Word Prediction Interfaces,2016,4
João Guerreiro,Investigating the Opportunities for Technologies to Enhance QoL with Stroke Survivors and their Families,2020,3
João Guerreiro,""" Tell me what I want to know!"" the effect of relationship closeness on the relevance of profile attributes",2013,3
João Guerreiro,Inclusive Social Virtual Environments: Exploring the Acceptability of Different Navigation and Awareness Techniques,2023,2
João Guerreiro,Virtual Reality for Health and Wellbeing,2022,2
João Guerreiro,Suggesting text alternatives for images in social media,2021,2
João Guerreiro,Enhancing Blind People’s Information Scanning with Concurrent Speech,2016,2
João Guerreiro,Relating Personally Relevant Social Information from Heterogeneous Sources,2010,2
João Guerreiro,Coding Together: On Co-located and Remote Collaboration between Children with Mixed-Visual Abilities,2023,1
João Guerreiro,The Use of Concurrent Speech to Enhance Blind People's Scanning for Relevant Information,2015,1
João Guerreiro,""" Ten Things I Want to Know About You”: Unveiling Friends’ Attribute Relevance",2012,1
João Guerreiro,Surpassing farley files: opportunities and challenges on obtaining personally relevant information,2010,1
João Guerreiro,A Living Framework for Understanding Cooperative Games,2024,0
João Guerreiro,The Trick is to Stay Behind?: Defining and Exploring the Design Space of Player Balancing Mechanics,2024,0
João Guerreiro,Investigating Virtual Reality Locomotion Techniques with Blind People,2024,0
João Guerreiro,From Automation to User Empowerment: Investigating the Role of a Semi-automatic Tool in Social Media Accessibility,2024,0
João Guerreiro,Digital Therapeutics with Virtual Reality and Sensors,2023,0
João Guerreiro,Introduction to the Special Issue on ASSETS’21,2023,0
João Guerreiro,TACTOPI: Exploring Play with an Inclusive Multisensory Environment for Children with Mixed-Visual Abilities,2023,0
João Guerreiro,Using VR and Sensors for Anxiety with Children and Adolescents,2023,0
João Guerreiro,Technology to support independent navigation of people with visual impairments,2022,0
João Guerreiro,Proceedings of MUM 2022: the 21st International Conference on Mobile and Ubiquitous Multimedia,2022,0
João Guerreiro,Introduction to the Special Issue on Technology to Support Independent Orientation and Mobility of People with Visual Impairments,2020,0
João Guerreiro,Towards Understanding Interaction of Visually Impaired Navigators with Surrounding Pedestrians,2019,0
João Guerreiro,Anotações Multimédia Estruturadas para Ambientes Virtuais Colaborativos,2014,0
João Guerreiro,SocialVis: Aumentar o Conhecimento da Rede Social através de Visualizaç ao de Informaç ao,2013,0
João Guerreiro,Empowering the Search of One’s Social Directory,2013,0
João Guerreiro,PersonalWeb: an extensible framework to recommend web and personal information,2012,0
João Guerreiro,Extracting and Relating Relevant Personal Information from Heterogeneous Sources,2009,0
João Guerreiro,BBeep: Un sistema sónico de prevención de colisiones para viajeros ciegos y peatones cercanos,N/A,0
SeungJun Kim,Psycho-physiological measures for assessing cognitive load,2010,487
SeungJun Kim,Simulated augmented reality windshield display as a cognitive mapping aid for elder driver navigation,2009,327
SeungJun Kim,Sensors Know When to Interrupt You in the Car: Detecting Driver Interruptibility Through Monitoring of Peripheral Interactions,2015,75
SeungJun Kim,Assessing real-time cognitive load based on psycho-physiological measures for younger and older adults,2014,70
SeungJun Kim,Usability of car dashboard displays for elder drivers,2011,57
SeungJun Kim,Augmenting human senses to improve the user experience in cars: applying augmented reality and haptics approaches to reduce cognitive distances,2015,50
SeungJun Kim,Route guidance modality for elder driver navigation,2012,48
SeungJun Kim,Leukocyte segmentation in blood smear images using region-based active contours,2006,45
SeungJun Kim,A qualitative study of smartwatch usage and its usability,2018,37
SeungJun Kim,AR interfacing with prototype 3D applications based on user-centered interactivity,2010,33
SeungJun Kim,Toward Immersive Self-Driving Simulations: Reports from a User Study across Six Platforms,2020,32
SeungJun Kim,Performance evaluation gaps in a real-time strategy game between human and artificial intelligence players,2018,28
SeungJun Kim,A novel test-bed for immersive and interactive broadcasting production using augmented reality and haptics,2006,27
SeungJun Kim,Haptic interaction in realistic multimedia broadcasting,2005,22
SeungJun Kim,Evaluation of starcraft artificial intelligence competition bots by experienced human players,2016,16
SeungJun Kim,A Cascaded Multimodal Natural User Interface to Reduce Driver Distraction,2020,15
SeungJun Kim,A reliable new 2-stage distributed interactive TGS system based on GIS database and augmented reality,2006,15
SeungJun Kim,How to interact with a fully autonomous vehicle: Naturalistic ways for drivers to intervene in the vehicle system while performing non-driving related tasks,2021,14
SeungJun Kim,Making machine-learning applications for time-series sensor data graphical and interactive,2017,14
SeungJun Kim,A case study on iteratively assessing and enhancing wearable user interface prototypes,2017,14
SeungJun Kim,Cultural Heritage Design Element Labeling System With Gamification,2020,13
SeungJun Kim,Understanding expert-novice differences in geometry problem-solving tasks: a sensor-based approach,2014,11
SeungJun Kim,Take-over requests after waking in autonomous vehicles,2022,10
SeungJun Kim,Designing a Crowdsourcing System for the Elderly: A Gamified Approach to Speech Collection,2020,10
SeungJun Kim,MAXIM: Mixed-reality Automotive Driving XIMulation,2019,10
SeungJun Kim,Smooth haptic interaction in broadcasted augmented reality,2005,10
SeungJun Kim,A haptically enhanced broadcasting system,2005,8
SeungJun Kim,A hand-over notification system of vehicle driving control according to driver’s condition based on cognitive load in autonomous driving situation,2019,7
SeungJun Kim,Auditory and olfactory stimuli-based attractors to induce reorientation in virtual reality forward redirected walking,2022,6
SeungJun Kim,Gaze-head input: Examining potential interaction with immediate experience sampling in an autonomous vehicle,2020,6
SeungJun Kim,A Study on Driver's Attitude according to Combination of Modality and Message Type in Providing Driving Information in Autonomous Driving,2019,5
SeungJun Kim,What and When to Explain? On-road Evaluation of Explanations in Highly Automated Vehicles,2023,4
SeungJun Kim,Exploring the value of information delivered to drivers,2017,4
SeungJun Kim,Feasibility and infrastructural study of AR interfacing and intuitive simulation on 3D nonlinear systems,2008,4
SeungJun Kim,A New Approach to Studying Sleep in Autonomous Vehicles: Simulating the Waking Situation,2019,3
SeungJun Kim,"Large-Area Windshield Head-Up Display and In-Vehicle Multimodal NUI Interface: Touch Gesture, Voice Command",2019,3
SeungJun Kim,Multi-modal interruptions on primary task performance,2018,3
SeungJun Kim,"Integrated driving aware system in the real-world: Sensing, computing and feedback",2016,3
SeungJun Kim,"Electrical, vibrational, and cooling stimuli-based redirected walking: Comparison of various vestibular stimulation-based redirected walking systems",2023,2
SeungJun Kim,Assessing the Impact of AR HUDs and Risk Level on User Experience in Self-Driving Cars: Results from a Realistic Driving Simulation,2023,2
SeungJun Kim,Simulating Urban Element Design with Pedestrian Attention: Visual Saliency as Aid for More Visible Wayfinding Design,2023,2
SeungJun Kim,Reves: Redirection enhancement using four-pole vestibular electrode stimulation,2022,2
SeungJun Kim,Physiological Indices to Predict Driver Situation Awareness in VR,2023,1
SeungJun Kim,Designing virtual agent human–machine interfaces depending on the communication and anthropomorphism levels in augmented reality,2023,1
SeungJun Kim,Giant Finger: Visuo-proprioceptive congruent virtual legs for flying actions in virtual reality,2023,1
SeungJun Kim,Logogram VR: Treadmill-Coupled VR with Word Reflective Content for Embodied Logogram Learning,2023,1
SeungJun Kim,Seamless-walk: Novel natural virtual reality locomotion method with a high-resolution tactile sensor,2022,1
SeungJun Kim,저시력 보행자를 위한 모바일 길찾기 어플리케이션 사용자 경험 연구,2022,1
SeungJun Kim,MultiSenseBadminton: Wearable Sensor–Based Biomechanical Dataset for Evaluation of Badminton Performance,2024,0
SeungJun Kim,Engagnition: A multi-dimensional dataset for engagement recognition of children with autism spectrum disorder,2024,0
SeungJun Kim,"How Do Background and Remote User Representations Affect Social Telepresence in Remote Collaboration?: A Study with Portal Display, a Head Pose-Responsive Video …",2023,0
SeungJun Kim,Giant Finger: A Novel Visuo-Somatosensory Approach to Simulating Lower Body Movements in Virtual Reality,2023,0
SeungJun Kim,Team Badminseok at IJCAI CoachAI Badminton Challenge 2023: Multi-Layer Multi-Input Transformer Network (MuLMINet) with Weighted Loss,2023,0
SeungJun Kim,The Thousand Character Classic VR: 체화된 학습을 위한 콘텐츠 반영형 가상현실-트레드밀 한자 교육 플랫폼,2022,0
SeungJun Kim,발 제스처의 사용자 인식 설문 조사 및 적용 가능성 탐색,2022,0
SeungJun Kim,발달 장애 아동의 행동 및 생리적 정보를 통한 딥러닝 기반 참여도 분류,2022,0
SeungJun Kim,"Busy Hands, Busy Minds: How In-Vehicle Behaviors Affect Drivers' Choice of Interaction Input",2021,0
SeungJun Kim,"Future self-driving car innovation, and enhancement and virtual reality",2020,0
SeungJun Kim,of KIISE,2020,0
SeungJun Kim,Design and Usability Test of Web based Annotation System for Labeling of Cultural Heritage Formative Element,2019,0
SeungJun Kim,A Hand-Over Notification System of Vehicle Control Initiative according to Driver`s Cognitive Load in Autonomous Driving Situations,2019,0
SeungJun Kim,Sensor-based assessment of attention interruptibility,2018,0
SeungJun Kim,Sensor-based assessment of the in-situ quality of human computer interaction in the cars: final research report.,2016,0
SeungJun Kim,PC-based 3D Graphic Spacecraft Simulator Using OpenGL,2002,0
Mohammad Maifi Hasan Khan,Performance prediction for apache spark platform,2015,201
Mohammad Maifi Hasan Khan,Why do they do what they do?: A study of what motivates users to (not) follow computer security advice,2016,158
Mohammad Maifi Hasan Khan,Dustminer: troubleshooting interactive complexity bugs in sensor networks,2008,148
Mohammad Maifi Hasan Khan,An investigation into users’ considerations towards using password managers,2017,88
Mohammad Maifi Hasan Khan,A study of users’ experiences and beliefs about software update messages,2015,84
Mohammad Maifi Hasan Khan,SNTS: Sensor network troubleshooting suite,2007,66
Mohammad Maifi Hasan Khan,A study on designing video tutorials for promoting security features: A case study in the context of two-factor authentication (2fa),2017,54
Mohammad Maifi Hasan Khan,The user affective experience scale: A measure of emotions anticipated in response to pop-up computer warnings,2018,46
Mohammad Maifi Hasan Khan,Diagnostic powertracing for sensor node failure analysis,2010,45
Mohammad Maifi Hasan Khan,“... better to use a lock screen than to worry about saving a few seconds of {time”}: Effect of Fear Appeal in the Context of Smartphone Locking Behavior,2017,43
Mohammad Maifi Hasan Khan,Towards automatic tuning of apache spark configuration,2018,35
Mohammad Maifi Hasan Khan,Towards diagnostic simulation in sensor networks,2008,33
Mohammad Maifi Hasan Khan,Modeling interference for apache spark jobs,2016,31
Mohammad Maifi Hasan Khan,How does this message make you feel? A study of user perspectives on software update/warning message design,2015,30
Mohammad Maifi Hasan Khan,Anticipated emotions in initial trust evaluations of a drone system based on performance and process information,2020,28
Mohammad Maifi Hasan Khan,Understanding the influence of configuration settings: An execution model-driven framework for apache spark platform,2017,24
Mohammad Maifi Hasan Khan,The apple does fall far from the tree: user separation of a system from its developers in human-automation trust repair,2019,21
Mohammad Maifi Hasan Khan,Design and implementation of an analytical framework for interference aware job scheduling on apache spark platform,2019,21
Mohammad Maifi Hasan Khan,Designing challenge questions for location‐based authentication systems: a real‐life study,2015,21
Mohammad Maifi Hasan Khan,Context aware data acquisition framework for dynamic data driven applications systems (DDDAS),2013,21
Mohammad Maifi Hasan Khan,Investigating the effects of (empty) promises on human-automation interaction and trust repair,2020,20
Mohammad Maifi Hasan Khan,Initial trustworthiness perceptions of a drone system based on performance and process information,2018,20
Mohammad Maifi Hasan Khan,Evaluating smartphone-based dynamic security questions for fallback authentication: a field study,2016,20
Mohammad Maifi Hasan Khan,Troubleshooting interactive complexity bugs in wireless sensor networks using data mining techniques,2014,20
Mohammad Maifi Hasan Khan,Finding symbolic bug patterns in sensor networks,2009,18
Mohammad Maifi Hasan Khan,Trust and anthropomorphism in tandem: the interrelated nature of automated agent appearance and reliability in trustworthiness perceptions,2021,16
Mohammad Maifi Hasan Khan,Pronet: Network trust assessment based on incomplete provenance,2011,16
Mohammad Maifi Hasan Khan,A closed-loop context aware data acquisition and resource allocation framework for dynamic data driven applications systems (DDDAS) on the cloud,2015,15
Mohammad Maifi Hasan Khan,Do integral emotions affect trust? The mediating effect of emotions on trust in the context of human-agent interaction,2021,14
Mohammad Maifi Hasan Khan,The Effects of Risk and Role on Users’ Anticipated Emotions in Safety-Critical Systems,2018,14
Mohammad Maifi Hasan Khan,Evaluation of network trust using provenance based on distributed local intelligence,2011,14
Mohammad Maifi Hasan Khan,The role of behavioral anthropomorphism in human-automation trust calibration,2020,13
Mohammad Maifi Hasan Khan,To follow or not to follow: a study of user motivations around cybersecurity advice,2018,13
Mohammad Maifi Hasan Khan,A location-based authentication system leveraging smartphones,2014,13
Mohammad Maifi Hasan Khan,Power-based diagnosis of node silence in remote high-end sensing systems,2014,12
Mohammad Maifi Hasan Khan,"Investigating the effect of system reliability, risk, and role on users' emotions and attitudes toward a safety-critical drone system",2019,11
Mohammad Maifi Hasan Khan,Evaluating the effectiveness of using hints for autobiographical authentication: A field study,2015,10
Mohammad Maifi Hasan Khan,A model driven approach towards improving the performance of apache spark applications,2019,9
Mohammad Maifi Hasan Khan,Exposing complex bug-triggering conditions in distributed systems via graph mining,2011,9
Mohammad Maifi Hasan Khan,Dustdoctor: A self-healing sensor data collection system,2011,9
Mohammad Maifi Hasan Khan,Leveraging Cloud Infrastructure for Troubleshooting Edge Computing Systems,2012,7
Mohammad Maifi Hasan Khan,Understanding vicious cycles in server clusters,2011,7
Mohammad Maifi Hasan Khan,Fueoogle: a participatory sensing fuel-efficient maps application,2009,6
Mohammad Maifi Hasan Khan,Coding of excitation signals in a waveform interpolation speech coder,2001,6
Mohammad Maifi Hasan Khan,The Nuanced Nature of Trust and Privacy Control Adoption in the Context of Google,2023,5
Mohammad Maifi Hasan Khan,A dynamic resource allocation framework for apache spark applications,2020,5
Mohammad Maifi Hasan Khan,Performance analysis of a fault-tolerant exact motif mining algorithm on the cloud,2013,5
Mohammad Maifi Hasan Khan,The mediating effect of emotions on trust in the context of automated system usage,2021,4
Mohammad Maifi Hasan Khan,Effect of feedback on users’ immediate emotions: Analysis of facial expressions during a simulated target detection task,2019,4
Mohammad Maifi Hasan Khan,Leveraging computational grid technologies for building a secure and manageable power grid,2007,4
Mohammad Maifi Hasan Khan,Who Would Bob Blame? Factors in Blame Attribution in Cyberattacks Among the Non-adopting Population in the Context of 2FA,2020,3
Mohammad Maifi Hasan Khan,Csminer: An automated tool for analyzing changes in configuration settings across multiple versions of large scale cloud software,2016,3
Mohammad Maifi Hasan Khan,A novel approach to comprehensive economic evaluations: case study of an inherently sustainable technology using renewable energy sources,2011,3
Mohammad Maifi Hasan Khan,Troubleshooting interactive complexity bugs in wireless sensor networks using data mining techniques,2010,3
Mohammad Maifi Hasan Khan,Data mining for diagnostic debugging in sensor networks: Preliminary evidence and lessons learned,2008,3
Mohammad Maifi Hasan Khan,Power watermarking: Facilitating power-based diagnosis of node silence in remote high-end sensing systems,2011,2
Mohammad Maifi Hasan Khan,Towards a Layered Architecture for Object-Based Execution in Wide-Area Deeply Embedded Computing,2007,2
Mohammad Maifi Hasan Khan,I’m Only Human: The Effects of Trust Dampening by Anthropomorphic Agents,2022,1
Mohammad Maifi Hasan Khan,Arion: A Model-Driven Middleware for Minimizing Data Loss in Stream Data Storage,2017,1
Mohammad Maifi Hasan Khan,Role of effective communication in trust building: Application to human-computer interaction,2017,1
Mohammad Maifi Hasan Khan,Troubleshooting interactive complexity bugs,2012,1
Mohammad Maifi Hasan Khan,Divergences in Blame Attribution after a Security Breach based on Compliance Behavior: Implications for Post-breach Risk Communication,2023,0
Mohammad Maifi Hasan Khan,Effect of Device Risk Perceptions and Understandability of Data Management Features on Consumers' Willingness to Pay (WTP) for IoT Device Premium Data Management Plan,2023,0
Mohammad Maifi Hasan Khan,Human vs. Automation: Which One Will You Trust More If You Are About to Lose Money?,2023,0
