Author Name,Title,Year,Citations
Fabius Steinberger,Exploring boredom proneness as a predictor of mobile phone use in the car,2015,18
Fabius Steinberger,Engaged drivers–safe drivers: gathering real-time data from mobile and wearable devices for safe-driving apps,2017,16
Fabius Steinberger,Thinking like Disney: Supporting the Disney method using ambient feedback based on group performance,2015,8
Fabius Steinberger,Risky gadgets to the rescue: Reframing in-car technology use as task engagement,2018,5
Fabius Steinberger,From gearstick to joystick–Challenges in designing new interventions for the safety-critical driving context,2015,4
Fabius Steinberger,Workshop on Navigating Autonomous Cars: The Opportunities of HD Maps on User Experience,2017,0
Fabius Steinberger,AutoJammin’–designing progression in traffic and music,2016,0
Fabius Steinberger,Designing against boredom in automated driving,2016,0
Fabius Steinberger,Vote with your feet: hyperlocal public polling for urban screens,2014,0
Fabius Steinberger,Infrastructure provision,2011,0
Fabius Steinberger,Business trends (emerging business models),2011,0
Nina Boulus-Rødje,Dissenting in reflective conversations: Critical components of doing action research,2011,89
Nina Boulus-Rødje,The multiple intersecting sites of design in CSCW research,2015,63
Nina Boulus-Rødje,A cross-case analysis of technology-in-use practices: EPR-adaptation in Canada and Norway,2010,62
Nina Boulus-Rødje,Infrastructural inaccessibility: Tech entrepreneurs in occupied palestine,2018,39
Nina Boulus-Rødje,In search for the perfect pathway: Supporting knowledge work of welfare workers,2018,32
Nina Boulus-Rødje,Welfare-to-work Policies Meeting Complex Realities of Unemployed Citizens: Examining Assumptions in Welfare,2019,20
Nina Boulus-Rødje,“It’s About Business not Politics”: Software Development Between Palestinians and Israelis,2015,15
Nina Boulus-Rødje,Constructing technology-in-use practices: EPR-adaptation in Canada and Norway,2007,15
Nina Boulus-Rødje,"Mapping the Literature: socio-cultural, organizational and technological dimensions of e-voting technologies",2012,14
Nina Boulus-Rødje,Design challenges in supporting distributed knowledge: An examination of organizing elections,2015,13
Nina Boulus-Rødje,A Journey into the Hidden Lives of Electronic Medical Records (EMRs): Action Research in the Making,2010,13
Nina Boulus-Rødje,Sociotechnical changes brought about by electronic medical record,2009,13
Nina Boulus-Rødje,Action Research as a Network: Collective Production of Roles and Interventions,2012,11
Nina Boulus-Rødje,Stuck with my body at Qalandiya checkpoint: Reflections upon conducting fieldwork in an uncertain field site,2018,9
Nina Boulus-Rødje,Tech public of Erosion: the formation and transformation of the Palestinian tech entrepreneurial public,2021,8
Nina Boulus-Rødje,Studying Technologies in Practice: “Bounding Practices” When Investigating Socially Embedded Technologies,2015,8
Nina Boulus-Rødje,Managing normative criteria in action research: A reflexive analysis,2014,8
Nina Boulus-Rødje,Managing the Gradual Transition from Paper to Electronic Patient Record (EPR),2004,8
Nina Boulus-Rødje,Green IT Meaning in Energy Monitoring Practices: The Case of Danish Households,2023,5
Nina Boulus-Rødje,Work of the Future,2022,5
Nina Boulus-Rødje,"It’s about business, not politics”: an ethnographic study of an Israeli-Palestinian web start-up",2015,5
Nina Boulus-Rødje,Digital (Occupied) Palestine,2019,4
Nina Boulus-Rødje,Tactics for constructing visions about electronic health records (EHRs),2019,4
Nina Boulus-Rødje,"ECSCW 2015: Proceedings of the 14th European Conference on Computer Supported Cooperative Work, 19-23 September 2015, Oslo, Norway",2015,4
Nina Boulus-Rødje,"Coping with Messiness in Ethnography: Authority, Bias and Immersion in ethnographic Fieldwork in the non-Western World",2021,3
Nina Boulus-Rødje,Empirical sensibility in design workshops of healthcare infrastructures,2013,3
Nina Boulus-Rødje,"Messiness in Ethnography–Methods, Ethics and Participation in ethnographic Field Work in the non-Western World.(2020)",2020,2
Nina Boulus-Rødje,Discerning Designers' Intentions.,2017,2
Nina Boulus-Rødje,ICT-related change in complex organisations: The role of infrastructural and regulatory constraints,2004,2
Nina Boulus-Rødje,Planning for hybrid cooperation-a design driven exploration,2023,1
Nina Boulus-Rødje,"Media, Technologies, Cooperation–Rethinking Publics and Publicness in the MENA Region",2022,1
Nina Boulus-Rødje,"Book Review: Fieldwork for Healthcare: Case Studies Investigating Human Factors in Computing Systems, Dominic Furniss, Aisling O’Kane, Rebecca Randell …",2015,1
Nina Boulus-Rødje,Conflict IT: Technologies and collaborative practices in conflict areas,2015,1
Nina Boulus-Rødje,Imagined potentialities of technologies,2012,1
Nina Boulus-Rødje,Managing the Gradual Transition to Electronic Patient Record-EPR,2009,1
Nina Boulus-Rødje,Making things work: On being an academic researcher working with a community partner,2005,1
Nina Boulus-Rødje,Achieving Symmetry in Synchronous Interaction in Hybrid Work is Impossible,N/A,1
Nina Boulus-Rødje,Messy Tales from Fieldwork for Design,2023,0
Nina Boulus-Rødje,Doing Research in Complex Interwoven Research Engagements,2022,0
Nina Boulus-Rødje,FeedbackBox: Effektstudier,2021,0
Nina Boulus-Rødje,FeedbackBox: Co-creation workshops,2021,0
Nina Boulus-Rødje,"(Coping with) Messiness in Ethnography–Methods, Ethics and Participation in ethnographic Field Work in the non-Western World",2020,0
Nina Boulus-Rødje,"(Coping with) Messiness in Ethnography–Methods, Ethics and Participation in ethnographic Field Work in the non-Western World",2020,0
Nina Boulus-Rødje,Sage Research Methods Cases Part 2,2018,0
Nina Boulus-Rødje,Knight and Pawns in Public Welfare: Unpacking Myriad of Assumptions in Welfare Policies and Technologies,2017,0
Nina Boulus-Rødje,Elektroniske valg: Hvorfor er detså svært?,2014,0
Nina Boulus-Rødje,PhD Course on The art of writing and reviewing papers,2012,0
Nina Boulus-Rødje,Preliminary Research Notes: Reflections on Organizational Aspects on the 2011 Danish Parliamentary Election,2012,0
Nina Boulus-Rødje,Imagined Potentialities of Healthcare Technologies,2012,0
Nina Boulus-Rødje,Imagined Potentialities of Healthcare Technologies,2011,0
Nina Boulus-Rødje,Blackboxing democracy?: E-voting technologies ‘in the making’,2011,0
Nina Boulus-Rødje,Blackboxing democracy?: E-voting technologies ‘in the making’,2011,0
Nina Boulus-Rødje,Interventionist Research as a Network: Collective Production of Roles and Interventions,2010,0
Nina Boulus-Rødje,Interventionist Research as a Network: Centre for Research on Socio-Cultural Change (CRESC),2010,0
Nina Boulus-Rødje,Sociotechnical Changes Brought about by Electronic Medical Record,2009,0
Nina Boulus-Rødje,Foundation for the Future Research Project,2008,0
Nina Boulus-Rødje,Action Research ‘in the Making’: Reflections on Conversations with Action Researchers,2008,0
Nina Boulus-Rødje,Action Research'in the Making': Reflections on Conversations with Action Researchers,2008,0
Nina Boulus-Rødje,Technology Transforming Medical Practice: The emergence of changes brought along by the EMR,2007,0
Nina Boulus-Rødje,Exploring the Construction Process of Technical Knowledge in the Healthcare Sector,2007,0
Nina Boulus-Rødje,Epistemological Complexities Related to Action Research: Implications of community collaboration,2007,0
Nina Boulus-Rødje,Exploring the Construction Process of Technical Knowledge in the Healthcare Sector,2007,0
Nina Boulus-Rødje,The Art of Workarounds: Two case studies of documentation systems in the healthcare sector,2006,0
Nina Boulus-Rødje,Issues Discussed in EMR Meetings,2006,0
Nina Boulus-Rødje,Reconstructing constructivism: Moving away from the commitment to the social to the study of associations,2006,0
Nina Boulus-Rødje,The Art of Workarounds: Society for Social Studies of Science (4S),2006,0
Nina Boulus-Rødje,Reconstructing constructivism: Canadian Communication Association,2006,0
Nina Boulus-Rødje,Information about the Electronic Medical Record (EMR),2005,0
Nina Boulus-Rødje,The Travel to the Hidden Lives of Electronic Medical Records (EMRs),2005,0
Nina Boulus-Rødje,Inquiring into the conceptual framework of actor-network theory through the case of electronic medical records,2005,0
Nina Boulus-Rødje,The Travel to the Hidden Lives of the Electronic Medical Record (EMR): Society for Social Studies of Science,2005,0
Nina Boulus-Rødje,Inquiring into the conceptual framework of actor-network theory through the case of electronic medical records: Canadian Communication Association,2005,0
Nina Boulus-Rødje,Making Things Work: International Conference on Urban Health. Achieving Social Justice in Urban Communities,2005,0
Nina Boulus-Rødje,WE ARE MOVING WITH THE TIMES,2004,0
Nina Boulus-Rødje,"Organisational change constrained by complexity, infrastructure and regulation: ICT and reforms of health care organizations",2004,0
Nina Boulus-Rødje,"Sarah Rueller, Konstantin Aal, Marios Mouratidis, Dave Randall",N/A,0
Nina Boulus-Rødje,Infrastructural Inaccessibility,N/A,0
Nina Boulus-Rødje,Nina Boulus-Rødje· Gunnar Ellingsen Tone Bratteteig· Margunn Aanestad,N/A,0
Nina Boulus-Rødje,Internet Governance,N/A,0
Nina Boulus-Rødje,HUMTEK HUS B Gruppens medlemmer,N/A,0
Nina Boulus-Rødje,Supporting Election Work: Infrastructures for Knowledge Sharing,N/A,0
Nina Boulus-Rødje,Book Review (for Computer-Supported Cooperative Work),N/A,0
Nina Boulus-Rødje,Studying Technologies in Practice: Ethnographic Research into Socially Embedded Technologies,N/A,0
Nina Boulus-Rødje,Vorträge und Posterpräsentationen (ohne Tagungsband-Eintrag),N/A,0
Jutta Fortmann,Make me move at work! An ambient light display to increase physical activity,2013,64
Jutta Fortmann,Deriving design guidelines for ambient light systems,2015,56
Jutta Fortmann,Making lifelogging usable: Design guidelines for activity trackers,2015,55
Jutta Fortmann,WaterJewel: design and evaluation of a bracelet to promote a better drinking behaviour,2014,51
Jutta Fortmann,Tangible apps bracelet: Designing modular wrist-worn digital jewellery for multiple purposes,2016,48
Jutta Fortmann,User requirements for digital jewellery,2015,33
Jutta Fortmann,Illumee: aesthetic light bracelet as a wearable information display for everyday life,2013,33
Jutta Fortmann,AmbiX: Designing Ambient Light Information Displays,2012,33
Jutta Fortmann,AmbiGlasses-Information in the Periphery of the Visual Field.,2012,30
Jutta Fortmann,Towards new ambient light systems: A close look at existing encodings of ambient light systems,2015,25
Jutta Fortmann,PaceGuard: improving running cadence by real-time auditory feedback,2012,17
Jutta Fortmann,How to present information on wrist-worn point-light displays,2014,10
Jutta Fortmann,Proximity sensor: Privacy-aware location sharing,2013,8
Jutta Fortmann,IllumiMug: revealing imperceptible characteristics of drinks,2014,5
Jutta Fortmann,WaterJewel: be aware of your daily servings of water with an LED-illuminated bracelet,2014,4
Jutta Fortmann,Real-life experiences with an adaptive light bracelet,2015,3
Jutta Fortmann,Lightwatch: a wearable light display for personal exertion,2015,3
Jutta Fortmann,Illuminated Ring–A Wearable Display to Support Fluid Intake,2014,3
Jutta Fortmann,Designing Wearable Light Displays for Users and Observers,2014,3
Jutta Fortmann,Human-Centered Design in the Energy Turnaround Project Enera–It Pays to Go Off the Beaten Track!,2019,1
Jutta Fortmann,Lumicons: mapping light patterns to information classes,2015,1
Jutta Fortmann,Bewertung der Usability eines Fahrkartenautomaten mit Hilfe von Engineering-Techniken zur Quantifizierung von Benutzungsoberflächen,2008,1
Jutta Fortmann,Find your way in the UX process jungle: An introduction to UX process models and methods and a practical session on how to find a suitable process for your project,2023,0
Jutta Fortmann,Wrist-Worn Light-Based Smart Digital Jewellery,2017,0
Jutta Fortmann,Knowledge is power!–Woher Usability/UX Professionals ihr Wissen beziehen (UPA Arbeitskreis Qualitätssicherung),2017,0
Jutta Fortmann,Demo hour,2015,0
Jutta Fortmann,WaterJewel,2014,0
Jutta Fortmann,How to present physical activity feedback on a point light bracelet,2014,0
Jutta Fortmann,Interaktive Systeme für die persönliche Gesundheit,2014,0
Jutta Fortmann,Zeitanalyse als Aspekt der Usability-Bewertung im Kontext komplexer Aufgaben,2010,0
Jutta Fortmann,Timelight–Using Light to Keep Track of Time Dedicated to Children,N/A,0
Jutta Fortmann,Timelight–Using Light to Keep Track of Time with Children,N/A,0
Jennifer G. Kim,Designing a social network to support the independence of young adults with autism,2012,99
Jennifer G. Kim,Personalized academic research paper recommendation system,2013,77
Jennifer G. Kim,The power of collective endorsements: credibility factors in medical crowdfunding campaigns,2016,73
Jennifer G. Kim,Investigating the use of circles in social networks to support independence of individuals with autism,2013,36
Jennifer G. Kim,Skin Conductance as an In Situ Marker for Emotional Arousal in Children with Neurodevelopmental Communication Impairments: Methodological Considerations …,2017,33
Jennifer G. Kim,""" Not by Money Alone"" Social Support Opportunities in Medical Crowdfunding Campaigns",2017,31
Jennifer G. Kim,Personalized academic paper recommendation system,2015,19
Jennifer G. Kim,Person-centered transition planning for youth on the autism spectrum: What are we still missing?,2022,17
Jennifer G. Kim,BEDA: Visual analytics for behavioral and physiological data,2013,16
Jennifer G. Kim,Understanding identity presentation in medical crowdfunding,2018,15
Jennifer G. Kim,SocialMirror: motivating young adults with autism to practice life skills in a social world,2012,13
Jennifer G. Kim,Enriched social translucence in medical crowdfunding,2020,9
Jennifer G. Kim,Designing a Medical Crowdfunding Website from Sense of Community Theory,2022,7
Jennifer G. Kim,Visual analysis of relationships between behavioral and physiological sensor data,2015,7
Jennifer G. Kim,Developing scripts to teach social skills: can the crowd assist the author?,2011,7
Jennifer G. Kim,Vista: User-centered vr training system for effectively deriving characteristics of people with autism spectrum disorder,2022,6
Jennifer G. Kim,The Workplace Playbook VR: Exploring the Design Space of Virtual Reality to Foster Understanding of and Support for Autistic People,2022,6
Jennifer G. Kim,Labor saving and labor making of value in online congratulatory messages,2015,4
Jennifer G. Kim,Supporting the contact tracing process with WiFi location data: Opportunities and challenges,2022,3
Jennifer G. Kim,"The effects of a pressure vest on task engagement, challenging behavior, and a physiological measure of stress for a child with intellectual disability",2015,3
Jennifer G. Kim,V-DAT (Virtual Reality Data Analysis Tool): Supporting Self-Awareness for Autistic People from Multimodal VR Sensor Data,2023,2
Jennifer G. Kim,Building Causal Agency in Autistic Students through Iterative Reflection in Collaborative Transition Planning,2023,2
Jennifer G. Kim,Toward Inclusive Mindsets: Design Opportunities to Represent Neurodivergent Work Experiences to Neurotypical Co-Workers in Virtual Reality,2023,2
Jennifer G. Kim,Emotion-Behavior Interplay in Human Animal-Robot Interaction (HARI),2024,0
Jennifer G. Kim,Promoting Self-Efficacy of Individuals With Autism in Practicing Social Skills in the Workplace Using Virtual Reality and Physiological Sensors: Mixed Methods Study,2024,0
Jennifer G. Kim,It Takes Two to Avoid Pregnancy: Addressing Conflicting Perceptions of Birth Control Pill Responsibility in Romantic Relationships,2023,0
Jennifer G. Kim,Supporting Transition Planning to Prepare Individuals with Autism Find Opportunities for Employment: Technological Design Challenges and Recommendations,2021,0
Jennifer G. Kim,"The power of collective endorsements: Promoting credibility, belonging, and participation in medical support communitiesThe power of collective endorsements: Promoting …",2019,0
Jennifer G. Kim,Social (Media) Graces: Making Sense of Norms in Ritual Posts,2014,0
Chris M Connors,Breaking the fidelity barrier: an examination of our current characterization of prototypes and an example of a mixed-fidelity success,2006,287
Chris M Connors,Remote control of a presentation,2016,96
Chris M Connors,Method and apparatus for product comparison,2006,45
Chris M Connors,Method and apparatus for product comparison,N/A,45
Chris M Connors,Action representation during slide generation,2013,30
Chris M Connors,Method and apparatus for sorting products by features,2008,20
Chris M Connors,Method and apparatus for product comparison,2008,6
Chris M Connors,Method and apparatus for product comparison,2018,2
Chris M Connors,Remote control of a presentation,2018,1
Chris M Connors,Action representation during slide generation,2017,0
Jiming Huang,A compliant parallel XY micromotion stage with complete kinematic decoupling,2012,188
Jiming Huang,Real-time finite element structural analysis in augmented reality,2015,95
Jiming Huang,Visualization and interaction of finite element analysis in augmented reality,2017,73
Jiming Huang,Design and analysis of a dual-mode driven parallel XY micromanipulator for micro/nanomanipulations,2012,30
Jiming Huang,Structure design and analysis with integrated AR-FEA,2017,28
Jiming Huang,An approach for augmented learning of finite element analysis,2019,23
Jiming Huang,Design and assessment of a flexure-based 2-DOF micromanipulator for automatic cell micro-injection,2012,15
Jiming Huang,Design and analysis of a completely decoupled compliant parallel XY micro-motion stage,2010,15
Jiming Huang,Optimization of a completely decoupled flexure-based parallel XY micro-motion stage,2011,10
Jiming Huang,Analysis of a novel 2-DOF flexure hinge-based parallel micromanipulator in a polar coordinate system,2010,8
Jiming Huang,An Augmented Reality Platform for Interactive Finite Element Analysis,2023,1
Jiming Huang,Direct-write single-walled carbon nanotube serpentines using micro chemical vapor deposition,2012,1
Karl Fast,“I still like Google”: University student perceptions of searching OPACs and the web,2004,230
Karl Fast,"Panizzi, Lubetzky, and Google: How the modern web environment is reinventing the theory of cataloguing.",2004,42
Karl Fast,Academic libraries and the semantic web: What the future may hold for research-supporting library catalogues,2004,35
Karl Fast,From pace layering to resilience theory: the complex implications of tagging for information architecture,2006,31
Karl Fast,What is a controlled vocabulary,2002,24
Karl Fast,The INVENT framework: Examining the role of information visualization in the reconceptualization of digital libraries,2005,22
Karl Fast,Interaction and the epistemic potential of digital libraries,2011,18
Karl Fast,Using entropy-related measures in categorical data visualization,2014,17
Karl Fast,What is a controlled vocabulary,2002,14
Karl Fast,The confluence of research and practice in information architecture,2006,13
Karl Fast,Controlled vocabularies: a glosso-thesaurus,2003,12
Karl Fast,The Ontological Perspectives of the Semantic Web and the Metadata Harvesting Protocol: Applications of Metadata for Improving Web Search.,2001,12
Karl Fast,Human-Information Interaction for Digital Libraries: From Document Repositories to Knowledge Environments,2010,6
Karl Fast,Creating a Controlled Vocabulary,2003,6
Karl Fast,All About Facets & Controlled Vocabularies,2002,4
Karl Fast,The Ontological Frameworks of the Semantic Web and the Metadata Harvesting Protocol,2013,0
Karl Fast,Reconceptualizing Digital Libraries as Interactive Knowledge Environments,2006,0
Karl Fast,Interaction: Beyond Retrieval,2006,0
Karl Fast,Epistemic actions and the design of interactive knowledge environments,2005,0
Karl Fast,Reflections on size and structure in the design of mid-sized information systems,2004,0
Karl Fast,"Panizzi, Lubetzky et Google: comment l'environnement du web moderne réinvente la théorie",2004,0
Stefan Kreitmayer,Rethinking'multi-user' an in-the-wild study of how groups approach a walk-up-and-use tabletop interface,2011,238
Stefan Kreitmayer,How to nudge in Situ: designing lambent devices to deliver salient information in supermarkets,2011,114
Stefan Kreitmayer,UniPad: orchestrating collaborative activities through shared tablets and an integrated wall display,2013,42
Stefan Kreitmayer,What's in it for me? augmenting recommended learning resources with navigable annotations,2020,19
Stefan Kreitmayer,From participatory to contributory simulations: changing the game in the classroom,2012,19
Stefan Kreitmayer,Shazam for bats: Internet of Things for continuous real‐time biodiversity monitoring,2021,18
Stefan Kreitmayer,X5learn: A personalised learning companion at the intersection of AI and HCI,2021,15
Stefan Kreitmayer,Watch less and uncover more: Could navigation tools help users search and explore videos?,2022,6
Stefan Kreitmayer,Sharing bubbles: reflections on offline multi-surface scenarios,2013,5
Stefan Kreitmayer,Fast and frugal shopping challenge,2012,4
Stefan Kreitmayer,Designing activities for collaboration at classroom scale using shared technology,2015,3
Stefan Kreitmayer,Designing a large multi-player simulation game to encourage reflection and critical debate,2011,3
Stefan Kreitmayer,Watch less and uncover more: Could navigation tools help users search and explore videos?,2022,0
Stefan Kreitmayer,Grant Agreement Number: 761758 Project Acronym: X5GON,2018,0
Stefan Kreitmayer,Design in the Wild: Interfacing the OER learning journey,2018,0
Stefan Kreitmayer,Designing a large multi-player simulation game to encourage critical debate,2011,0
Jorge Wagner,The brWaC Corpus: A New Open Resource for Brazilian Portuguese,2018,129
Jorge Wagner,Evaluating an Immersive Space-Time Cube Geovisualization for Intuitive Trajectory Data Exploration,2019,101
Jorge Wagner,Immersive visualization of abstract information: An evaluation on dimensionally-reduced data scatterplots,2018,79
Jorge Wagner,VirtualDesk: A Comfortable and Efficient Immersive Information Visualization Approach,2018,64
Jorge Wagner,Comparing and combining virtual hand and virtual ray pointer interactions for data manipulation in immersive analytics,2021,36
Jorge Wagner,Comfortable immersive analytics with the virtualdesk metaphor,2019,34
Jorge Wagner,The effect of exploration mode and frame of reference in immersive analytics,2021,19
Jorge Wagner,Crawling by readability level,2016,13
Jorge Wagner,Automatic construction of large readability corpora,2016,7
Jorge Wagner,Immersive analytics of dimensionally-reduced data scatterplots,2017,2
Jorge Wagner,BrWaC,N/A,2
Jorge Wagner,Reimagining TaxiVis through an Immersive Space-Time Cube metaphor and reflecting on potential benefits of Immersive Analytics for urban data exploration,2024,0
Jorge Wagner,DeAR: Combining Desktop and Augmented Reality for Visual Data Analysis,2023,0
Jorge Wagner,Immersive Visualization Interface for Endoscopy Analytics and Debriefing,2023,0
Jorge Wagner,Immersive Data Analysis for Planning Military Operations: Design and Think-Aloud Study,2023,0
Jorge Wagner,Visualizing Movement Trajectories in an Immersive Space-Time Cube,2020,0
Jorge Wagner,Projetando Abordagens Analíticas Imersivas para a Exploração de Dados Espaço-Temporais,2020,0
Jorge Wagner,A Virtual Reality Approach for Exploring Spatio-Temporal Urban Data,2019,0
Jorge Wagner,Evaluating immersive approaches to multidimensional information visualization,2018,0
Jorge Wagner,Coleta automática de corpora Web classificados por grau de legibilidade para o português,2016,0
Jiawei Zhang,Manifold: A model-agnostic framework for interpretation and diagnosis of machine learning models,2018,246
Jiawei Zhang,Uncertainty-aware multidimensional ensemble data visualization and exploration,2015,80
Jiawei Zhang,Big data visualizations in organizational science,2018,29
Jiawei Zhang,A visual analytics framework for microblog data analysis at multiple scales of aggregation,2016,28
Jiawei Zhang,TopoGroups: Context-Preserving Visual Illustration of Multi-Scale Spatial Aggregates,2017,15
Jiawei Zhang,Topotext: Context-preserving text data exploration across multiple spatial scales,2018,13
Jiawei Zhang,Parallax: Visualizing and understanding the semantics of embedding spaces via algebraic formulae,2019,12
Jiawei Zhang,SMART: Social Media Analytics and Reporting Toolkit,2017,11
Jiawei Zhang,Social Media Visual Analytic Toolkits for Disaster Management: A Review of the Literature,2017,10
Jiawei Zhang,Visualizing large-scale graph based on line integral convolution,2013,8
Jiawei Zhang,Visual Analytics of User Influence and Location-Based Social Networks,2015,7
Jiawei Zhang,Dodeca-rings map: Interactively finding patterns and events in large geo-temporal data,2014,7
Jiawei Zhang,Metricsvis: A visual analytics framework for performance evaluation of law enforcement officers,2017,6
Jiawei Zhang,Real-time identification and monitoring of abnormal events based on microblog and emergency call data using SMART,2014,5
Jiawei Zhang,ParkAnalyzer: Characterizing the movement patterns of visitors VAST 2015 Mini-Challenge 1,2015,4
Jiawei Zhang,Classification and visualization of crime-related tweets,2015,2
Jiawei Zhang,Visual analytics for detecting communication patterns,2015,2
Jiawei Zhang,AnnotatedTimeTree: Visualization and annotation of news text and other heterogeneous document collections,2014,1
Jiawei Zhang,Context-Preserving Visual Analytics of Multi-Scale Spatial Aggregation,2018,0
Jiawei Zhang,Visual Analytics of Heterogeneous Data for Criminal Event Analysis,N/A,0
