Author Name,Title,Year,Citations
Geert de Haan,Rethinking Cognitive Ergonomics,2019,4
Geert de Haan,DevThis-Education in the age of the Internet of Things,2012,4
Geert de Haan,SuperAssist: Personal assistants for cooperative healthcare treatment,2005,4
Geert de Haan,SUPER ASSIST: PERSONAL ASSISTANTS FOR DIABETES HEALTHCARE TREATMENT AT HOME,2005,4
Geert de Haan,"The Role of Cognitive Ergonomics in Interaction Design, Addressing Advances in HCI",2016,3
Geert de Haan,Creating a context-aware mobile application to enlarge social cohesion: skating together,2011,3
Geert de Haan,Design for global access to cultural heritage,2003,3
Geert de Haan,Interacting with a personal wearable device,2000,3
Geert de Haan,Het ontwerpen en realiseren van Brainwave,2011,2
Geert de Haan,The design of I-mass as a tool for interacting with cultural heritage,2003,2
Geert de Haan,Agents and wearables—usability in the COMRIS system,2001,2
Geert de Haan,Presenting spoken advice: information pull or push?,2000,2
Geert de Haan,How to cook ETAG and related dishes: Uses of a notational language for user-interface design,1997,2
Geert de Haan,How to Cook ETAG and Related Dishes: Uses of a Notational Language for User Knowledge Representation for User Interface Design,1994,2
Geert de Haan,Co-designing a Vision for Educating Human-Centered Creative Technology,2014,1
Geert de Haan,Opening up Closed Systems with Sensible Data,2009,1
Geert de Haan,The Design and Evaluation of Intelligent Access to Mankind's Collective Memory,2002,1
Geert de Haan,Accommodating diverse users in ETAG and ETAG-based design: task knowledge and presentation.,2001,1
Geert de Haan,Formal representation of human-computer interaction,N/A,1
Geert de Haan,Cognitive Ergonomic Design as Exploratory Data-enabled Design.,2019,0
Geert de Haan,Ambient and Pervasive Design: HCI Education from UbiComp to Creative Design,2014,0
Geert de Haan,Modelling of recycling systems-applied to car recycling,2005,0
Geert de Haan,"The monitoring of recycling systems-The effect of comminution, thermodynamics, physics, statistics and design33",2005,0
Geert de Haan,The Monitoring of Recycling Systems,2005,0
Geert de Haan,SuperAssist: Personal Assistants for Distributed Supervision of Complex Task Environments,2004,0
Geert de Haan,ETAG,2000,0
Geert de Haan,The design of an information infrastructure to support system managers and business procedures,1999,0
Geert de Haan,"Usability issues in COMRIS, an intelligent personal information system",1999,0
Geert de Haan,COMRIS: Cohabited Mixed Reality Information Spaces Usability Evaluation Plan,1998,0
Geert de Haan,of the Document: Report on State of the Art Agent modelling in Human Interfaces,1995,0
Geert de Haan,Programming in Parallel,N/A,0
Geert de Haan,Research or positioning?,N/A,0
Geert de Haan,learning from a lightweight design domain,N/A,0
Geert de Haan,Low Cost UX Design in New Media Design,N/A,0
Geert de Haan,Systematic design of user interfaces,N/A,0
Geert de Haan,How to Cook ETAG and Related Dishes: Uses of,N/A,0
Geert de Haan,The Politics of Information and Knowledge Sharing for Systems Management,N/A,0
Geert de Haan,The Design of a Information Infrastructure to support System Managers and Business Procedures: how to catch a guru with quality,N/A,0
Geert de Haan,The Design of a Information Infrastructure to support System,N/A,0
Geert de Haan,Requirements for Intelligent Access to Mankind's Collective Memory in I-Mass,N/A,0
Geert de Haan,User Interface Design for Internet of Things and Intelligent Agents Systems,N/A,0
Geert de Haan,of the Document Evaluation and validation Plan,N/A,0
Geert de Haan,The Evaluation and Validation Plan MASS II,N/A,0
Geert de Haan,Extended Task-Action Grammar (ETAG),N/A,0
Geert de Haan,Een Sociale Context-gevoelige Applicatie voor Skaters,N/A,0
Jorge Saldivar,"Sense of presence, attitude change, perspective-taking and usability in first-person split-sphere 360 video",2018,86
Jorge Saldivar,"Unmasking the crowd: participants’ motivation factors, expectations, and profile in a crowdsourced law reform",2017,66
Jorge Saldivar,Civic Technology for Social Innovation,2018,63
Jorge Saldivar,Agora2. 0: enhancing civic participation through a public display,2013,52
Jorge Saldivar,"Examining augmented reality in journalism: Presence, knowledge gain, and perceived visual authenticity",2022,47
Jorge Saldivar,Motivating participation in crowdsourced policymaking: The interplay of epistemic and interactive aspects,2017,36
Jorge Saldivar,Civic CrowdAnalytics: Making sense of crowdsourced civic input with big data tools,2016,28
Jorge Saldivar,Analysis and improvement of business process models using spreadsheets,2015,28
Jorge Saldivar,Idea Management Communities in the Wild: An Exploratory Study of 166 Online Communities,2016,15
Jorge Saldivar,"Examining the quality of crowdsourced deliberation: Respect, reciprocity and lack of common-good orientation",2017,12
Jorge Saldivar,Online idea management for civic engagement: A study on the benefits of integration with social networking,2019,9
Jorge Saldivar,On the (in) effectiveness of the share/tweet button: A study in the context of idea management for civic participation,2016,9
Jorge Saldivar,"Civic Technologies: Research, Practice and Open Challenges",2020,7
Jorge Saldivar,Self-selection In Crowdsourced Democracy: A Bug Or A Feature?,2014,6
Jorge Saldivar,A categorization of decentralized autonomous organizations: the case of the Aragon platform,2023,3
Jorge Saldivar,Blockchain (not) for Everyone: Design Challenges of Blockchain-based Applications,2023,3
Jorge Saldivar,The electoral success of social media losers: a study on the usage and influence of Twitter in times of elections in Paraguay,2022,3
Jorge Saldivar,The platform belongs to those who work on it! Co-designing worker-centric task distribution models,2021,3
Jorge Saldivar,Idea management in social networks: A study of how to tap into the ideas of facebook communities,2016,2
Jorge Saldivar,Club De Othello XO: Una Experiencia De Aprendizaje En Ambiente De Interacción Social,2008,1
Jorge Saldivar,Blockchain (not) for everyone: Assessing the user experience of blockchain-based applications,N/A,1
Jorge Saldivar,"Disagreement, Agreement, and Elaboration in Crowdsourced Deliberation: Ideation Through Elaborated Perspectives",2023,0
Jorge Saldivar,A Sentiment Analysis Approach to Process Civic Contributions,2020,0
Jorge Saldivar,SmartParking: Facilitando la búsqueda de espacios de estacionamiento en Asunción,2020,0
Jorge Saldivar,Exploring gender differences in bioinformatics research,2020,0
Jorge Saldivar,SmartTraffic: sistemas colectivos adaptativos para una ciudad inteligente,2018,0
Jorge Saldivar,Empowering Online Idea Management for Civic Engagement with Public Displays and Social Networking Services,2017,0
Jorge Saldivar,Participa: fostering civic participation for public services innovation,2014,0
Jorge Saldivar,Club de Othello XO: una Experiencia de Aprendizaje en Ambiente de Interacción Social,2011,0
Jorge Saldivar,"Pablo Aragón Eurecat, Centre Tecnològic de Catalunya Universitat Pompeu Fabra Barcelona, Spain elaragon@ gmail. com",N/A,0
Jorge Saldivar,Twitter en las elecciones de Paraguay,N/A,0
Jorge Saldivar,CTS 2016,N/A,0
Muhanna Muhanna,"Virtual reality and the CAVE: Taxonomy, interaction challenges and research directions",2015,355
Muhanna Muhanna,GA-based feature selection with ANFIS approach to breast cancer recurrence,2016,24
Muhanna Muhanna,Using a new set of heuristics in evaluating Arabic interfaces,2020,14
Muhanna Muhanna,Exploration of human-computer interaction challenges in designing software for mobile devices,2007,12
Muhanna Muhanna,The development of usability heuristics For Arabic m-commerce applications,2019,11
Muhanna Muhanna,Arabic mobile applications: Challenges of interaction design and development,2014,10
Muhanna Muhanna,Mitigating personalization challenges in mobile commerce: An empirical study,N/A,10
Muhanna Muhanna,HCI-based guidelines for electronic and mobile learning for Arabic speaking users: do they effectively exist?,2014,9
Muhanna Muhanna,Usability heuristics for evaluating Arabic mobile games,2022,5
Muhanna Muhanna,Enhancement of throughput time using MS-TCP transport layer protocol for 4G mobiles,2008,5
Muhanna Muhanna,Using metadata in optimizing the design and development of enterprise information systems,2017,4
Muhanna Muhanna,By two: A two-dimensional mobile game model for novice developers,2019,3
Muhanna Muhanna,Social commerce quality service from customer persective,2017,3
Muhanna Muhanna,Software Infrastructure to Reduce the Cost and Time of Building Enterprise Software Applications: Practices and Case Studies,2017,3
Muhanna Muhanna,Steganalysis of LSB encoding in digital images using GLCM and Neural Networks,2006,3
Muhanna Muhanna,CHR vs. human-computer interaction design for emerging technologies: Two case studies,2023,2
Muhanna Muhanna,Prototype details of the smartphone-based researcher's companion software (RCS),2009,2
Muhanna Muhanna,Prioritisation of Nielsen’s Usability Heuristics for User Interface Design Using Fuzzy Cognitive Maps,2018,1
Muhanna Muhanna,Clowiz: A Model-driven Development Platform for Cloud-based Information Systems,2018,1
Muhanna Muhanna,Data Lossless Compression Using Improved GFC Algorithm with Multiple GPUs.,2016,1
Muhanna Muhanna,Interactive Environment for Command and Control Simulation Scenarios Inside CAVE,2012,1
Muhanna Muhanna,Specification and Design Aspects of the Academic Researcher's Assistant (ARA) Software for Mobile Devices,2008,1
Muhanna Muhanna,The Impact of Serious Games on Learning User Interface Design Guidelines,2023,0
Muhanna Muhanna,Archeological Sites Classification Through Partial Imaging and Convolutional Neural Networks.,2023,0
Muhanna Muhanna,The Role of Software Architecture in Business Model Transformability,2023,0
Muhanna Muhanna,Undercover Ethnography: Towards an Automated Framework to Study the Human Level of Interest,2014,0
Muhanna Muhanna,Real-time supervisor intervention software for scenario modification in cave applications,2011,0
Muhanna Muhanna,Using UML in a Non-Software Design Task: Creating an Electronic Software Engineering Handbook.,2006,0
Davide Ceneda,Characterizing Guidance in Visual Analytics.,2016,241
Davide Ceneda,A review of guidance approaches in visual data analysis: A multifocal perspective,2019,74
Davide Ceneda,Guide me in analysis: A framework for guidance designers,2020,31
Davide Ceneda,Perspectives of visualization onboarding and guidance in VA,2022,24
Davide Ceneda,Guidance or No Guidance? A Decision Tree Can Help,2018,23
Davide Ceneda,Guided visual exploration of cyclical patterns in time-series,2018,19
Davide Ceneda,COVIs: Supporting Temporal Visual Analysis of Covid-19 Events Usable in Data-Driven Journalism,2020,18
Davide Ceneda,Lotse: A Practical Framework for Guidance in Visual Analytics,2022,13
Davide Ceneda,A Typology of Guidance Tasks in Mixed‐Initiative Visual Analytics Environments,2022,12
Davide Ceneda,Show Me Your Face: Towards an Automated Method to Provide Timely Guidance in Visual Analytics,2021,9
Davide Ceneda,You get by with a little help: The effects of variable guidance degrees on performance and mental state,2019,7
Davide Ceneda,RoutingWatch: Visual exploration and analysis of routing events,2016,5
Davide Ceneda,Guided Visual Analytics for Image Selection in Time and Space,2023,1
Davide Ceneda,A Heuristic Approach for Dual Expert/End-User Evaluation of Guidance in Visual Analytics,2023,1
Davide Ceneda,Guidance-enriched visual analytics,2020,1
Davide Ceneda,Amending the Characterization of Guidance in Visual Analytics,2017,1
Davide Ceneda,TimeLighting: Guidance-Enhanced Exploration of 2D Projections of Temporal Graphs,2023,0
Davide Ceneda,A Methodology for Task-Driven Guidance Design,2023,0
Davide Ceneda,The Circle Of Thrones: Conveying the Story of Game of Thrones Using Radial Infographics,2018,0
Davide Ceneda,Guiding the Visualization of Time-Oriented Data,2016,0
Davide Ceneda,Enhancing Visual Analytics Systems with Guidance: A Task-Driven Methodology,N/A,0
Georgios Marentakis,Current technologies and compositional practices for spatialization: A qualitative and quantitative analysis,2011,72
Georgios Marentakis,"Effects of feedback, mobility and index of difficulty on deictic spatial audio target acquisition in the horizontal plane",2006,64
Georgios Marentakis,A study on gestural interaction with a 3d audio display,2004,41
Georgios Marentakis,Digital scent technology: Toward the internet of senses and the metaverse,2022,38
Georgios Marentakis,Phantom source widening with deterministic frequency dependent time delays,2011,32
Georgios Marentakis,A comparison of feedback cues for enhancing pointing efficiency in interaction with spatial audio displays,2005,30
Georgios Marentakis,"Vector-base and ambisonic amplitude panning: A comparison using pop, classical, and contemporary spatial music",2014,23
Georgios Marentakis,Hybrid perception,2001,16
Georgios Marentakis,Interactive theatre via mixed reality and Ambient Intelligence,2008,14
Georgios Marentakis,Evaluation of hear-through sound localization,2014,12
Georgios Marentakis,The timbre engine-progress report,2001,12
Georgios Marentakis,A simple technical measure for the perceived source width,2011,10
Georgios Marentakis,Gesture interaction with spatial audio displays: Effects of target size and inter-target separation,2005,10
Georgios Marentakis,Effects of reproduction equipment on interaction with a spatial audio interface,2005,10
Georgios Marentakis,Perceptual impact of gesture control of spatialization,2013,9
Georgios Marentakis,Latency Tolerance Enhancement in In-Ear Monitoring Systems,2012,7
Georgios Marentakis,Tech-note: Multimodal feedback in 3D target acquisition,2009,7
Georgios Marentakis,DJ spat: Spatialized interactions for DJs,2007,7
Georgios Marentakis,Sinusoidal synthesis optimization,2002,7
Georgios Marentakis,Using breath-like cues for guided breathing,2021,6
Georgios Marentakis,Creative evaluation,2017,6
Georgios Marentakis,Auditory perception of spatial extent in the horizontal and vertical plane,2016,6
Georgios Marentakis,Does serial memory of locations benefit from spatially congruent audiovisual stimuli? Investigating the effect of adding spatial sound to visuospatial sequences,2017,5
Georgios Marentakis,Advances in auditory display research,2016,5
Georgios Marentakis,Parisflâneur. artistic approaches to binaural technology and their evaluation,2018,4
Georgios Marentakis,"Auditory resolution in virtual environments: Effects of spatialization algorithm, off‐center listener positioning and speaker configuration",2008,4
Georgios Marentakis,Spatial audio for multimodal location monitoring,2021,3
Georgios Marentakis,Compression efficiency and Signal Distortion of common PCA bases for HRTF Modelling,2021,3
Georgios Marentakis,Top-down influences in the detection of spatial displacement in a musical scene,2016,3
Georgios Marentakis,Pictorize: Transforming Image Region Luminosity to Sound Brightness for Monitoring Location,2020,2
Georgios Marentakis,Zwischenräume-A Case Study in the Evaluation of Interactive Sound Installations,2014,2
Georgios Marentakis,Wave field synthesis evaluation using the minimum audible angle in a concert hall,2008,2
Georgios Marentakis,Influence of performance gestures on the identification of spatial sound trajectories in a concert hall,2008,2
Georgios Marentakis,Deictic spatial audio target acquisition in the frontal horizontal plane,2006,2
Georgios Marentakis,Exploring Sound and Spatialisation Design on Speaker Arrays using Physical Modelling,2012,1
Georgios Marentakis,Making spatial music accessible: Investigating elementary spatial movements,2008,1
Georgios Marentakis,Auditory resolution in auditory virtual environments,2007,1
Georgios Marentakis,Scalable Spectral Reflections In Conic Sections,2001,1
Georgios Marentakis,Multimodal feedback for guided breathing,2023,0
Georgios Marentakis,Sketching in sound and interaction design,2023,0
Georgios Marentakis,Principal component analysis of binaural HRTF pairs,2023,0
Georgios Marentakis,Communicating Emotions During Lectures,2023,0
Georgios Marentakis,Movement interaction with a loudspeaker: an index of possibilities,2022,0
Georgios Marentakis,Monitoring and Regulating Sonic Activity Through Feedback in Learning Environments,2022,0
Georgios Marentakis,Analysing tensions faced by pre-service mathematics teachers engaging in digital fabrication,2022,0
Georgios Marentakis,Variation In Timbre Descriptors Due To Outer Ear Filtering,2020,0
Georgios Marentakis,Das Blumlein-Pfanzagl-Triple-Theorie und Erfahrungen im Praxistest,2010,0
Georgios Marentakis,Current Technologies and Compositional Practices for Spatialization: A Quantitative Analysis,2009,0
Georgios Marentakis,Wave Field Synthesis Evaluation Using the Minimum Audible Angle in a Concert Hall,2008,0
Georgios Marentakis,"Spatial audio target acquisition in the frontal horizontal plane: Effects of feedback, mobility, and index of difficulty",2006,0
Georgios Marentakis,The Timbre Engine: Progress report,2002,0
Georgios Marentakis,Sinusodial Synthesis Optimization,2002,0
Georgios Marentakis,Current Directions at the Music Informatics Laboratory,2002,0
Georgios Marentakis,Music Informatics Laboratory,2001,0
Georgios Marentakis,"Current trends at the music informatics laboratory, DIKU-rapport 01/04",2001,0
Georgios Marentakis,Music Informatics Laboratory,2001,0
Georgios Marentakis,Detecting Spatial Displacement in Musical Scenes,N/A,0
Nicola Capece,On the use of virtual reality in software visualization: The case of the city metaphor,2019,47
Nicola Capece,Human segmentation in surveillance video with deep learning,2020,46
Nicola Capece,Freehand-Steering Locomotion Techniques for Immersive Virtual Environments: A Comparative Evaluation,2020,31
Nicola Capece,Visualising a software system as a city through virtual reality,2017,29
Nicola Capece,DeepFlash: Turning a Flash Selfie into a Studio Portrait,2019,28
Nicola Capece,Graphvr: A virtual reality tool for the exploration of graphs with htc vive system,2018,27
Nicola Capece,Sustainable Water Management: Virtual Reality Training for Open-Channel Flow Monitoring,2020,25
Nicola Capece,Visualizing the evolution of software systems using the forest metaphor,2012,23
Nicola Capece,StreamflowVL: A Virtual Fieldwork Laboratory that Supports Traditional Hydraulics Engineering Learning,2019,22
Nicola Capece,A low-cost full body tracking system in virtual reality based on microsoft kinect,2018,22
Nicola Capece,Engineering an advanced geo-location augmented reality framework for smart mobile devices,2017,21
Nicola Capece,A client-server framework for the design of geo-location based augmented reality applications,2016,21
Nicola Capece,Implementation of a coin recognition system for mobile devices with deep learning,2016,18
Nicola Capece,"The city metaphor in software visualization: feelings, emotions, and thinking",2019,16
Nicola Capece,A Deep Learning approach for the Motion Picture Content Rating,2019,12
Nicola Capece,Design and Implementation of a Web-basedCollaborative Authoring Tool for the Virtual Reality,2019,12
Nicola Capece,Archaeo Puzzle: An Educational Game Using Natural User Interface for Historical Artifacts,2020,10
Nicola Capece,An easy Hand Gesture Recognition System for XR-based collaborative purposes,2022,8
Nicola Capece,A Preliminary Investigation into a Deep Learning Implementation for Hand Tracking on Mobile Devices,2020,8
Nicola Capece,Converting night-time images to day-time images through a deep learning approach,2017,8
Nicola Capece,Exploring Upper Limb Segmentation with Deep Learning for Augmented Virtuality,2021,7
Nicola Capece,StreamFlowVR: A Tool for Learning Methodologies and Measurement Instruments for River Flow Through Virtual Reality,2019,6
Nicola Capece,Ambient Occlusion Baking via a Feed-Forward Neural Network.,2017,6
Nicola Capece,TryItOn: a virtual dressing room with motion tracking and physically based garment simulation,2022,5
Nicola Capece,Treesketchnet: From sketch to 3d tree parameters generation,2023,4
Nicola Capece,A Preliminary Investigation on a Multimodal Controller and Freehand Based Interaction in Virtual Reality,2021,4
Nicola Capece,Turning a Smartphone Selfie Into a Studio Portrait,2020,4
Nicola Capece,Egocentric upper limb segmentation in unconstrained real-life scenarios,2023,2
Nicola Capece,Solid and effective upper limb segmentation in egocentric vision,2021,2
Nicola Capece,Collaborative Visual Environments for Evidence Taking in Digital Justice: A Design Concept,2021,2
Nicola Capece,Vision-enhanced Peg-in-Hole for automotive body parts using semantic image segmentation and object detection,2024,1
Nicola Capece,Evaluation of virtual reality interaction techniques: the case of 3d graph,2023,1
Nicola Capece,Boidvr: An agent simulation environment based on freehand and virtual reality,2022,1
Nicola Capece,A Preliminary Investigation of Deep Emotion-based Classification from Natural Language Text,2019,1
Nicola Capece,An Educational Approach for Mixed Reality Visualization of Agro-meteorological Parameters,2023,0
Nicola Capece,Enhancing Art Therapy with Virtual Reality and Hand Gesture Recognition: A Case Study in Pottery Modeling,2023,0
Nicola Capece,GPU-Accelerating Hierarchical Descriptors for Point Set Registration,2023,0
Nicola Capece,A Foveated Framework to Accelerate Real-Time Path Tracing,2023,0
Nicola Capece,Remote and deviceless manipulation of virtual objects in mixed reality,2023,0
Nicola Capece,JPEG Line-drawing Restoration with Masks,2023,0
Nicola Capece,A Scale-Space Approach to the Morphological Simplification of Scalar Fields,2023,0
Nicola Capece,Adjoint Bijective ZoomOut: Efficient upsampling for learned linearly-invariant embedding,2023,0
Nicola Capece,Spectral-based segmentation for functional shape-matching,2023,0
Nicola Capece,User-Assisted Sphere-Mesh Construction,2023,0
Nicola Capece,AvatarizeMe: A Fast Software Tool for Transforming Selfies into Animatable Lifelike Avatars Using Machine Learning,2023,0
Nicola Capece,"Revolutionizing Media and Gaming with AI: Advancements in Body Measurement Calculation, Motion Tracking, Gesture Recognition, and Upper Limb Segmentation",2022,0
Nicola Capece,On the need of new educational curricula in the field of space technologies and their applications.,2021,0
Nicola Capece,A Validation Approach for Deep Reinforcement Learning of a Robotic Arm in a 3D Simulated Environment,2021,0
Nicola Capece,Experimenting Earth Science labs at University of Basilicata during the Coronavirus-19 pandemic,2020,0
Nicola Capece,"AR video presentation using 3D LiDAR information for operator support in mobile robot teleoperation               59 Kae Doki, Kenya Suzuki, Akihiro Torii, Suguru Mototani …",N/A,0
Nicola Capece,Visualizing the Evolution of Software Systems as Growing Forests,N/A,0
Johnathan Mell,Toward natural turn-taking in a virtual human negotiation agent,2015,90
Johnathan Mell,IAGO: interactive arbitration guide online,2016,69
Johnathan Mell,Grumpy & Pinocchio: answering human-agent negotiation questions through realistic agent design,2017,48
Johnathan Mell,Results of the first annual human-agent league of the automated negotiating agents competition,2018,43
Johnathan Mell,An Effective Conversation Tactic for Creating Value over Repeated Negotiations.,2015,33
Johnathan Mell,Challenges and main results of the automated negotiating agents competition (anac) 2019,2020,32
Johnathan Mell,What's on your virtual mind? Mind perception in human-agent negotiations,2019,28
Johnathan Mell,Effects of perceived agency and message tone in responding to a virtual personal trainer,2018,24
Johnathan Mell,The effects of experience on deception in human-agent negotiation,2020,23
Johnathan Mell,Welcome to the real world: How agent strategy increases human willingness to deceive,2018,12
Johnathan Mell,"Prestige questions, online agents, and gender-driven differences in disclosure",2017,12
Johnathan Mell,The Likeability-Success Tradeoff: Results of the 2nd Annual Human-Agent Automated Negotiating Agents Competition,2019,11
Johnathan Mell,"Towards a repeated negotiating agent that treats people individually: cooperation, social value orientation, & machiavellianism",2018,10
Johnathan Mell,Toward social-emotional virtual humans,2015,7
Johnathan Mell,An expert-model and machine learning hybrid approach to predicting human-agent negotiation outcomes in varied data,2021,5
Johnathan Mell,Research challenges for the automated negotiating agents competition (anac) 2019,2020,5
Johnathan Mell,An expert-model & machine learning hybrid approach to predicting human-agent negotiation outcomes,2019,5
Johnathan Mell,The Nineth International Automated Negotiating Agents Competition (ANAC2018),2018,5
Johnathan Mell,Saying YES! The cross-cultural complexities of favors and trust in human-agent negotiation,2015,5
Johnathan Mell,Varied magnitude favor exchange in human-agent negotiation,2020,3
Johnathan Mell,The Effectiveness of Competitive Agent Strategy in Human-Agent Negotiation,2018,3
Johnathan Mell,Customizing virtual interpersonal skills training applications may not improve trainee performance,2023,2
Johnathan Mell,Human-like agents for repeated negotiation,2017,2
Johnathan Mell,Toward social-emotional virtual humans (doctoral consortium),2015,2
Johnathan Mell,NegotiAge: Development and pilot testing of an artificial intelligence‐based family caregiver negotiation program,2024,0
Johnathan Mell,Boiling the frog: Ethical leniency due to prior exposure to technology,2024,0
Johnathan Mell,CREATION OF A FAMILY CAREGIVER NEGOTIATION TRAINING PROGRAM USING ARTIFICIAL INTELLIGENCE,2023,0
Johnathan Mell,Harmony Index: A Scalar Index to Assess and Predict Effectiveness in Multi-Agent Teaming,2023,0
