Author Name,Title,Year,Citations
Marta Larusdottir,Assessment model for HCI practice maturity in small and medium sized software development companies,2017,3
Marta Larusdottir,"Workshop on the integration of user-centred design and agile development: Approach, findings and themes",2016,3
Marta Larusdottir,A case study—Hindrances and success factors in student projects,2009,3
Marta Larusdottir,A case study of software replacement,2005,3
Marta Larusdottir,The UCD sprint: a process for user-centered innovation,2023,2
Marta Larusdottir,Describing digital work environment through contextual personas,2021,2
Marta Larusdottir,Human-Centered Software Engineering,2019,2
Marta Larusdottir,User Evaluations of Virtually Experiencing Mount Everest,2019,2
Marta Larusdottir,Learning outcome outcomes: an evaluation of quality,2018,2
Marta Larusdottir,Students envisioning the future,2016,2
Marta Larusdottir,Re-design of a database course unit using the ACM Computer Science Curricula 2013,2016,2
Marta Larusdottir,Challenges for action research on HWID in activity based workplaces,2015,2
Marta Larusdottir,The landscape of UX requirements practices,2015,2
Marta Larusdottir,TeSS-projektet: Udvikling af et system til eksperimentel undersøgelse af brugergrænseflader til edb-baseret tekstsøgning,1993,2
Marta Larusdottir,The UCD sprint: Bringing users along to sprint,2023,1
Marta Larusdottir,Little Stakeholder Communication in Distributed Scrum Projects During the Covid-19 Period,2022,1
Marta Larusdottir,Aligning Quality Assurance at the course unit and educational program levels,2016,1
Marta Larusdottir,Human-Centred Software Engineering,2010,1
Marta Larusdottir,Human-centred software engineering,2010,1
Marta Larusdottir,Group cognitive behavioural therapy (CBT) for university students with attention-deficit/hyperactivity disorder (ADHD): a feasibility study,2024,0
Marta Larusdottir,UCD Sprint: A Fast Process to Involve Users in the Design Practices of Software Companies,2023,0
Marta Larusdottir,Supporting Active Learning in STEM Higher Education Through the User-Centred Design Sprint,2023,0
Marta Larusdottir,Ethical Value Exchange in HCI,2023,0
Marta Larusdottir,"Human-Computer Interaction–INTERACT 2023: 19th IFIP TC13 International Conference, York, UK, August 28–September 1, 2023, Proceedings, Part III",2023,0
Marta Larusdottir,User-Centered Design Approaches and Software Development Processes,2023,0
Marta Larusdottir,Experiences of Extensive User Involvement through Vision Seminars in a Large IT Project,2023,0
Marta Larusdottir,GameQA: Gamified Mobile App Platform for Building Multiple-Domain Question-Answering Datasets,2023,0
Marta Larusdottir,Contextual Think Aloud: Method for Understanding Users and Their Digital Work Environment,2023,0
Marta Larusdottir,"Sense, Feel, Design: INTERACT 2021 IFIP TC 13 Workshops, Bari, Italy, August 30–September 3, 2021, Revised Selected Papers",2022,0
Marta Larusdottir,Reykjavik University Question-Answering Dataset 2 (RUQuAD-2)-version 22.02,2022,0
Marta Larusdottir,Contextual Personas-A Method for Capturing the Digital Work Environment of Users,2021,0
Marta Larusdottir,Selecting the Best Agile Team for Developing a Web Service,2020,0
Marta Larusdottir,"NordiCHI'20: Shaping Experiences, Shaping Society: Proceedings of the 11th Nordic Conference on Human-Computer Interaction",2020,0
Marta Larusdottir,Assessing the Performance of Agile Teams,2019,0
Marta Larusdottir,TECHNICAL REPORT/RUTR-CS16003,2016,0
Marta Larusdottir,"Four Public Self-Service Applications: A Study of the Development Process, User Involvement and Usability in Danish Public Self-Service Applications",2016,0
Marta Larusdottir,Subject-Level Quality Assurance In Computing,2014,0
Marta Larusdottir,NordiCHI 2010: Extending Boundaries-Proceedings of the 6th Nordic Conference on Human-Computer Interaction: Preface,2010,0
Marta Larusdottir,"Human-Centred Software Engineering: Third International Conference, HCSE 2010, Reykjavik, Iceland, October 14-15, 2010. Proceedings",2010,0
Marta Larusdottir,"Proceedings of the 6th Nordic Conference on Human-Computer Interaction 2010, Reykjavik, Iceland, October 16-20, 2010",2010,0
Marta Larusdottir,COST294-MAUSE Workshop Downstream Utility: The Good,2007,0
Marta Larusdottir,Agile UCD,N/A,0
Marta Larusdottir,Subject-Level Quality Assurance In Computing,N/A,0
Marta Larusdottir,TeSS-projektet,N/A,0
Marta Larusdottir,D​ IGITAL​​ ARBETSMILJÖ​​ OCH​​ PROJEKTET​ N​ ÄRA​​ VÅRD​​ ONLINE​,N/A,0
Marta Larusdottir,Towards a Model to Support HCI Practice Maturity in Small and Medium Software Development Companies,N/A,0
Marta Larusdottir,SPI in Agile Approaches,N/A,0
Marta Larusdottir,which is commonly known as TwinTide (Towards the Integration of Trans-sectorial IT Design,N/A,0
Marta Larusdottir,A License To Kill-Improving UCSD In Agile Development,N/A,0
Marta Larusdottir,Solving One Task with Many Devices,N/A,0
Marta Larusdottir,Student centered HCI teaching,N/A,0
Marta Larusdottir,The Usability of a User Centered Design approach,N/A,0
Marta Larusdottir,Reducing the gap between HCI research and software development teams in Iceland,N/A,0
Marta Larusdottir,Adapting User Testing for Evaluating a Multiplayer Game,N/A,0
Kathryn E. Ringland,"""Will I always be not social?"": Re-Conceptualizing Sociality in the Context of a Minecraft Community for Autism",2016,241
Kathryn E. Ringland,Evaluating a collaborative iPad game's impact on social relationships for children with autism spectrum disorder,2015,104
Kathryn E. Ringland,Towards accessible remote work: Understanding work-from-home practices of neurodivergent professionals,2021,92
Kathryn E. Ringland,Would you be mine: Appropriating minecraft as an assistive technology for youth with autism,2016,91
Kathryn E. Ringland,Mobile video modeling for employment interviews for individuals with autism,2015,77
Kathryn E. Ringland,SensoryPaint: a multimodal sensory intervention for children with neurodevelopmental disorders,2014,76
Kathryn E. Ringland,Making 'Safe': Community-Centered Practices in a Virtual World Dedicated to Children with Autism,2015,71
Kathryn E. Ringland,A place to play: the (dis) abled embodied experience for autistic children in online spaces,2019,65
Kathryn E. Ringland,Social technologies for digital wellbeing among marginalized communities,2019,57
Kathryn E. Ringland,Understanding mental ill-health as psychosocial disability: Implications for assistive technology,2019,50
Kathryn E. Ringland,Designing mental health technologies that support the social ecosystem of college students,2020,49
Kathryn E. Ringland,(In)Visibility in Disability and Assistive Technology,2017,48
Kathryn E. Ringland,Making in Minecraft: A means of self-expression for youth with autism,2017,46
Kathryn E. Ringland,""" I think people are powerful"" The Sociality of Individuals Managing Depression",2019,38
Kathryn E. Ringland,Designing for Emotional Well-Being: Integrating Persuasion and Customization into Mental Health Technologies,2021,36
Kathryn E. Ringland,“Autsome”: Fostering an Autistic Identity in an Online Minecraft Community for Youth with Autism,2019,32
Kathryn E. Ringland,Myautsomefamilylife: Analyzing parents of children with developmental disabilities on YouTube,2019,30
Kathryn E. Ringland,Optimal load scheduling for residential renewable energy integration,2012,29
Kathryn E. Ringland,Crafting Game-Based Learning: An Analysis of Lessons for Minecraft Education Edition,2020,24
Kathryn E. Ringland,Stepping up: predictors of ‘Stepping’within an iCBT stepped-care intervention for depression,2019,22
Kathryn E. Ringland,Articulations toward a crip HCI,2021,21
Kathryn E. Ringland,"Designing accessible, explainable AI (XAI) experiences",2020,20
Kathryn E. Ringland,Accessibility and digital mental health: considerations for more accessible and equitable mental health apps,2021,17
Kathryn E. Ringland,SensoryPaint: a natural user interface supporting sensory integration in children with neurodevelopmental disorders,2014,16
Kathryn E. Ringland,Evaluating an iPad Game to Address Overselectivity in Preliterate AAC Users with Minimal Verbal Behavior,2017,15
Kathryn E. Ringland,ARMY’s magic shop: Understanding the collaborative construction of playful places in online communities,2022,14
Kathryn E. Ringland,Home worlds: situating domestic computing in everyday life through a study of DIY home repair,2019,12
Kathryn E. Ringland,Using Depression Analytics to Reduce Stigma via Social Media: BlueFriends,2014,12
Kathryn E. Ringland,Dancecraft: A whole-body interactive system for children with autism,2019,9
Kathryn E. Ringland,""" Do you work for aperture science?"" researching and finding the gamer identity in a minecraft community for autistic children",2019,8
Kathryn E. Ringland,Playful places in online playgrounds: An ethnography of a minecraft virtual world for children with autism,2018,8
Kathryn E. Ringland,""" You're my best friend."" finding community online in BTS's fandom, ARMY",2022,6
Kathryn E. Ringland,Participating through data: Charting relational tensions in multiplatform data flows,2018,6
Kathryn E. Ringland,SIG on the State of Accessibility at CHI,2016,6
Kathryn E. Ringland,Marginalized Populations and Research Ethics Online,2015,6
Kathryn E. Ringland,Designing an accessible clothing tag system for people with vision impairments,2013,6
Kathryn E. Ringland,Teachers Designing Lessons with a Digital Sandbox Game: The Case of Minecraft Education Edition,2021,5
Kathryn E. Ringland,A Better World: Examples of Disability in Overwatch,2018,5
Kathryn E. Ringland,“You Can't Possibly Have ADHD”: Exploring Validation and Tensions around Diagnosis within Unbounded ADHD Social Media Communities,2023,4
Kathryn E. Ringland,Health information technologies for cancer care: Characterizing developments for precision and personalized medicine,2019,4
Kathryn E. Ringland,Accessible clothing tags: designing for individuals with visual impairments,2013,4
Kathryn E. Ringland,Proposing body doubling as a continuum of space/time and mutuality: An investigation with neurodivergent participants,2023,3
Kathryn E. Ringland,(In) visible Choices: Articulation Work and the Rise in US Maternal Mortality,2019,3
Kathryn E. Ringland,Who Has Access? Making Accessible Play Spaces in Minecraft for Children with Autism,2017,3
Kathryn E. Ringland,"Making"" Safe",1788,3
Kathryn E. Ringland,A Playful Twist on the Peer Review Process and Methodological Gaslighting,2023,2
Kathryn E. Ringland,Weaving Autistic Voices on TikTok: Utilizing Co-Hashtag Networks for Netnography,2023,1
Kathryn E. Ringland,"Creating assistive technology in disabled communities, five years on: a reflection of neurodivergency and crafting accessible social spaces",2021,1
Kathryn E. Ringland,Social Justice in HCI: A Systematic Literature Review,2024,0
Kathryn E. Ringland,“Caption It in an Accessible Way That Is Also Enjoyable”: Characterizing User-Driven Captioning Practices on TikTok,2024,0
Kathryn E. Ringland,'You are finally Home': Centering Playful Marginalized Community Values in Designing Online Social Platforms,2023,0
Kathryn E. Ringland,Minecraft as an Online Playground: Reframing Play and Games in a Minecraft Community for Autistic Youth,2022,0
Kathryn E. Ringland,ARMY Census,2022,0
Kathryn E. Ringland,Building Inclusive Minecraft Communities for Players With Disabilities and Neurological Differences,2021,0
Kathryn E. Ringland,DREEM: An Emerging Method for Building a Meaningful Disability-Related Research Agenda,2021,0
Kathryn E. Ringland,Exploring Feminist Disability  Studies  and CSCW,2015,0
Kathryn E. Ringland,Virtual Worlds: An Alternative Method for Communication for Children with Autism Spectrum Disorder,2014,0
Kathryn E. Ringland,DREU Final Report,2012,0
Kathryn E. Ringland,Category: BTS-ARMY (Page 1 of 2),N/A,0
Kathryn E. Ringland,Tag: research (Page 1 of 12),N/A,0
Kathryn E. Ringland,Personal Informatics as a Site of Digital Mental Health,N/A,0
Xiaojun (Jenny) Yuan,Query length in interactive information retrieval,2003,224
Xiaojun (Jenny) Yuan,The thematic and citation landscape of data and knowledge engineering (1985–2007),2008,215
Xiaojun (Jenny) Yuan,"Domain knowledge, search behaviour, and search effectiveness of engineering and science students: An exploratory study.",2005,144
Xiaojun (Jenny) Yuan,Visualizing and mapping the intellectual structure of information retrieval,2012,97
Xiaojun (Jenny) Yuan,Heuristic evaluation of healthy eating apps for older adults,2014,53
Xiaojun (Jenny) Yuan,Factors affecting user perception of a spoken language vs. textual search interface: a content analysis,2016,51
Xiaojun (Jenny) Yuan,Examining users’ knowledge change in the task completion process,2013,45
Xiaojun (Jenny) Yuan,Investigating information retrieval support techniques for different information‐seeking strategies,2010,41
Xiaojun (Jenny) Yuan,Supporting multiple information-seeking strategies in a single system framework,2007,41
Xiaojun (Jenny) Yuan,Identifying and improving retrieval for procedural questions,2007,31
Xiaojun (Jenny) Yuan,Rutgers' TREC 2001 Interactive Track Experience.,2001,31
Xiaojun (Jenny) Yuan,Building the trail best traveled: effects of domain knowledge on web search trailblazing,2012,27
Xiaojun (Jenny) Yuan,Recognizing fake information through a developed feature scheme: a user study of health misinformation on social media in China,2022,25
Xiaojun (Jenny) Yuan,Understanding searchers' perception of task difficulty: Relationships with task type,2011,25
Xiaojun (Jenny) Yuan,Features of documents relevant to task-and fact-oriented questions,2002,25
Xiaojun (Jenny) Yuan,Seeking information with an information visualization system: a study of cognitive styles.,2011,22
Xiaojun (Jenny) Yuan,"The coronavirus pandemic: Accessible technology for education, employment, and livelihoods",2021,21
Xiaojun (Jenny) Yuan,An investigation of task characteristics and users’ evaluation of interaction design in different online health information systems,2021,21
Xiaojun (Jenny) Yuan,Evaluating an integrated system supporting multiple information‐seeking strategies,2010,21
Xiaojun (Jenny) Yuan,Rutgers' HARD and Web Interactive Track Experiments at TREC 2003.,2003,21
Xiaojun (Jenny) Yuan,Rutgers Information Interaction Lab at TREC 2005: Trying HARD.,2005,20
Xiaojun (Jenny) Yuan,Relationship between cognitive styles and users' task performance in two information systems,2013,19
Xiaojun (Jenny) Yuan,Rutgers' HARD Track Experiences at TREC 2004.,2004,19
Xiaojun (Jenny) Yuan,Applying an information-seeking dialogue model in an interactive information retrieval system,2014,18
Xiaojun (Jenny) Yuan,Understanding the information needs and search behaviour of mobile users.,2012,18
Xiaojun (Jenny) Yuan,Rutgers Interactive Track at TREC 2002.,2002,16
Xiaojun (Jenny) Yuan,Socially vulnerable populations adoption of technology to address lifestyle changes amid COVID-19 in the US,2022,15
Xiaojun (Jenny) Yuan,Examining users' partial query modification patterns in voice search,2020,15
Xiaojun (Jenny) Yuan,What users prefer and why: A user study on effective presentation styles of opinion summarization,2015,15
Xiaojun (Jenny) Yuan,Testing visualization on the use of information systems,2010,13
Xiaojun (Jenny) Yuan,The relationship between ASK and relevance criteria,2002,12
Xiaojun (Jenny) Yuan,User query behaviour in different task types in a spoken language vs. textual interface: A wizard of Oz experiment,2017,11
Xiaojun (Jenny) Yuan,Open government data portals: Predictors of site engagement among early users of Health Data NY,2021,10
Xiaojun (Jenny) Yuan,What motivates people use social tagging,2013,10
Xiaojun (Jenny) Yuan,Examining user perception and usage of voice search,2021,8
Xiaojun (Jenny) Yuan,A review of the current intelligent personal agents,2018,8
Xiaojun (Jenny) Yuan,The mental state of Americans amid the COVID-19 crisis: How socially vulnerable populations face greater disparities during and after a crisis,2021,7
Xiaojun (Jenny) Yuan,Effects of domain knowledge on user performance and perception in a knowledge domain visualization system,2013,6
Xiaojun (Jenny) Yuan,Design of a study to evaluate the effectiveness of a spoken language interface to information systems,2011,6
Xiaojun (Jenny) Yuan,Illuminating privacy and security concerns in older adults’ technology adoption,2024,5
Xiaojun (Jenny) Yuan,Under what conditions does web conferencing inhibit learning in a computer science classroom,2013,5
Xiaojun (Jenny) Yuan,Cyber Behaviors in Seeking Information,2012,5
Xiaojun (Jenny) Yuan,Adoption and perception of artificial intelligence technologies by children and teens in education,2022,4
Xiaojun (Jenny) Yuan,Twelve agendas on interacting with information: a human-engaged computing perspective,2020,4
Xiaojun (Jenny) Yuan,Understanding voice search behavior: review and synthesis of research,2020,4
Xiaojun (Jenny) Yuan,Research on voice search behavior in the last 10 years,2019,4
Xiaojun (Jenny) Yuan,User evaluation of an interactive music information retrieval system,2011,4
Xiaojun (Jenny) Yuan,Age-related difference in conversational search behavior: Preliminary findings,2022,3
Xiaojun (Jenny) Yuan,Evaluating an Education Department Portal: A Case Study,2015,3
Xiaojun (Jenny) Yuan,Perception and use of COVID contact tracing mobile applications in New York State (NYS),2022,2
Xiaojun (Jenny) Yuan,Technology adoption and COVID-19 pandemic,2022,2
Xiaojun (Jenny) Yuan,The Age-related differences in web information search process,2020,2
Xiaojun (Jenny) Yuan,A Teacher Dashboard for Real-Time Intervention,2018,2
Xiaojun (Jenny) Yuan,Using web conferencing to foster learning partnerships in a team-based learning computer science classroom,2015,2
Xiaojun (Jenny) Yuan,Investigating the effect of visualization on user performance of information systems,2013,2
Xiaojun (Jenny) Yuan,Experimental study of index terms and information access,2003,2
Xiaojun (Jenny) Yuan,Rutgers' TREC 2002. Interactive Track Experience.,2003,2
Xiaojun (Jenny) Yuan,Privacy and security concerns: A systematic review of older adults' perceptions surrounding the use of technology,2023,1
Xiaojun (Jenny) Yuan,Rethinking Algorithmic Fairness in the Context of Information Access,2022,1
Xiaojun (Jenny) Yuan,Cultural discourse on keyboards: the selection of alphabets,2022,1
Xiaojun (Jenny) Yuan,Online social games in the eyes of children and teens: a systematic review,2022,1
Xiaojun (Jenny) Yuan,Social Vulnerability to COVID-19: Impacts of Technology Adoption and Information Behavior,2022,1
Xiaojun (Jenny) Yuan,The Societal Impacts of COVID-19 on Asian Americans: Mitigating Mental Health Disparities Stemming from Labels Like the “China Virus”,2021,1
Xiaojun (Jenny) Yuan,Speak to Me: Interacting with a Spoken Language Interface,2020,1
Xiaojun (Jenny) Yuan,Cultural discourse in user interface design: investigating characteristics of communicators in Microsoft word,2020,1
Xiaojun (Jenny) Yuan,The structural design computer model-based games for assisting mathematics classroom learning,2018,1
Xiaojun (Jenny) Yuan,Presentation Styles on User Perceived Usefulness in Opinion Summarization,2016,1
Xiaojun (Jenny) Yuan,Sources of noise in interactive information search,2015,1
Xiaojun (Jenny) Yuan,Social Networking Using Mobile Devices,2013,1
Xiaojun (Jenny) Yuan,U. Albany & USC at the TREC 2012 Session Track.,2012,1
Xiaojun (Jenny) Yuan,Supporting complex tasks in a spoken language interface,2011,1
Xiaojun (Jenny) Yuan,Developing and evaluating a gamified information retrieval system for Generation Z,2024,0
Xiaojun (Jenny) Yuan,Older Adults Decision-Making During the COVID-19 Infodemic,2023,0
Xiaojun (Jenny) Yuan,Designing a Pinyin-Based Keyboard Based on the Frequency of Pinyin of Chinese Characters,2023,0
Xiaojun (Jenny) Yuan,COVID-19 Contact Tracing Mobile Applications in New York State (NYS): an Empirical Study,2023,0
Xiaojun (Jenny) Yuan,Empowered Or Left Behind: Use of Technology During COVID-19,2023,0
Xiaojun (Jenny) Yuan,Technological Innovations in Response to COVID-19: Research Agenda Considering Marginalized Populations,2023,0
Xiaojun (Jenny) Yuan,Adoption of Artificial Intelligence Technologies by Often Marginalized Populations,2023,0
Xiaojun (Jenny) Yuan,Responding to COVID-19: Privacy Implications of the Rapid Adoption of ICTs,2023,0
Xiaojun (Jenny) Yuan,"Creating a Model for Faculty Success: Faculty Advancement Initiative for Black, Indigenous, Latinx, and People of Color at the University at Albany",2023,0
Xiaojun (Jenny) Yuan,Improving the effectiveness of voice search systems through partial query modification,2022,0
Xiaojun (Jenny) Yuan,Older Adults Use of Technology for Decision-Making: A Systematic Literature Review,2022,0
Xiaojun (Jenny) Yuan,Older Adults’ Voice Search through the Human-Engaged Computing Perspective,2021,0
Xiaojun (Jenny) Yuan,Cultural Discourse in User Behavior: Transfer of Thought in Keyboard Key Practice,2021,0
Xiaojun (Jenny) Yuan,User Assessment of Webpage Usefulness,2021,0
Xiaojun (Jenny) Yuan,Reimagining information science and technology beyond traditional boundaries in the global coronavirus pandemic situation,2020,0
Xiaojun (Jenny) Yuan,Cyber Behaviors in Seeking Health Information,2019,0
Xiaojun (Jenny) Yuan,Health Data on the Front Lines: Data-Driven Decision-Making for New York City's Opioid Overdose Epidemic,2018,0
Xiaojun (Jenny) Yuan,Distribution of user-perceived usefulness of four presentation styles of opinion summarization,2016,0
Xiaojun (Jenny) Yuan,Improving User Experience through Task Design and Evaluation Metrics in Research Projects,2015,0
Xiaojun (Jenny) Yuan,Understanding the information needs and search behaviour,2012,0
Xiaojun (Jenny) Yuan,A comparative experiment of the effect of visualization on user performance of information systems,2011,0
Xiaojun (Jenny) Yuan,ALL RIGHTS RESERVED,2007,0
Xiaojun (Jenny) Yuan,Social Vulnerability to COVID-19,N/A,0
Xiaojun (Jenny) Yuan,Contact Tracing Mobile Applications in New York: A Qualitative Study on the Use and Privacy Perceptions,N/A,0
Xiaojun (Jenny) Yuan,"Addressing Differential Impacts of Covid-19 in NYS: COVID-19, Technology, and the Digital Divide: Implications for NYS",N/A,0
Xiaojun (Jenny) Yuan,Addressing Differential Impacts of Covid-19 in NYS: The Impact of COVID-19 Related Anti-Asian Rhetoric and Racial Discrimination on the Mental Health of Asian Americans,N/A,0
Xiaojun (Jenny) Yuan,Rutgers” HARD Track Experiences at TREC 2004,N/A,0
Xiaojun (Jenny) Yuan,TING WITH COMPUTERS,N/A,0
Xiaojun (Jenny) Yuan,What Makes Short Phrases Useful as Indexing Terms?,N/A,0
Xiaojun (Jenny) Yuan,Do users with different domain knowledge select different sets of documents?,N/A,0
Ana-Belén Gil-González (https://orcid.org/0000-0001-7235-6151),Distributed continuous-time fault estimation control for multiple devices in IoT networks,2019,180
Ana-Belén Gil-González (https://orcid.org/0000-0001-7235-6151),Arquitectura para la Recuperación de Objetos de Aprendizaje de calidad en Repositorios Distribuidos,2007,140
Ana-Belén Gil-González (https://orcid.org/0000-0001-7235-6151),A collaborative filtering method for music recommendation using playing coefficients for artists and users,2016,128
Ana-Belén Gil-González (https://orcid.org/0000-0001-7235-6151),Fog computing architecture for personalized recommendation of banking products,2020,93
Ana-Belén Gil-González (https://orcid.org/0000-0001-7235-6151),Deepsign: Sign language detection and recognition using deep learning,2022,75
Ana-Belén Gil-González (https://orcid.org/0000-0001-7235-6151),Integration of IoT technologies in the maritime industry,2021,69
Ana-Belén Gil-González (https://orcid.org/0000-0001-7235-6151),Temperature curve complexity predicts survival in critically ill patients,2006,66
Ana-Belén Gil-González (https://orcid.org/0000-0001-7235-6151),A review on edge computing in smart energy by means of a systematic mapping study,2019,48
Ana-Belén Gil-González (https://orcid.org/0000-0001-7235-6151),Twitter user clustering based on their preferences and the Louvain algorithm,2016,34
Ana-Belén Gil-González (https://orcid.org/0000-0001-7235-6151),Automatic Learning Object Extraction and Classification in Heterogeneous Environments,2011,30
Ana-Belén Gil-González (https://orcid.org/0000-0001-7235-6151),Learning object retrieval in heterogeneous environments,2013,26
Ana-Belén Gil-González (https://orcid.org/0000-0001-7235-6151),A multi-agent system that searches for learning objects in heterogeneous repositories,2010,23
Ana-Belén Gil-González (https://orcid.org/0000-0001-7235-6151),Learner course recommendation in e-learning based on swarm intelligence.,2008,23
Ana-Belén Gil-González (https://orcid.org/0000-0001-7235-6151),CEBRA: A CasE-Based Reasoning Application to recommend banking products,2021,22
Ana-Belén Gil-González (https://orcid.org/0000-0001-7235-6151),LSTM networks for overcoming the challenges associated with photovoltaic module maintenance in smart cities,2021,22
Ana-Belén Gil-González (https://orcid.org/0000-0001-7235-6151),Towards a blockchain-based peer-to-peer energy marketplace,2022,19
Ana-Belén Gil-González (https://orcid.org/0000-0001-7235-6151),Cloud Computing and Multi Agent System to improve Learning Object Paradigm.,2014,19
Ana-Belén Gil-González (https://orcid.org/0000-0001-7235-6151),Un sistema multiagente de recuperación de objetos de aprendizaje con atributos de contexto,2007,19
Ana-Belén Gil-González (https://orcid.org/0000-0001-7235-6151),Las reformas de la Ley de Propiedad Intelectual,2006,19
Ana-Belén Gil-González (https://orcid.org/0000-0001-7235-6151),Cryptocurrencies and price prediction: a survey,2022,18
Ana-Belén Gil-González (https://orcid.org/0000-0001-7235-6151),E-commerce recommenders: powerful tools for E-business,2003,16
