Author Name,Title,Year,Citations
Muhammad Aslam,An Accessible Agent for Blind's Self-Localization and Navigational Assistance,N/A,0
Muhammad Aslam,energy report,N/A,0
Muhammad Aslam,"RESULT OF SECOND SEMESTER EXAMINATIONS HELD IN NOV./DEC., 2016",N/A,0
Muhammad Aslam,Assessment of variation and interrelationship among plant growth and development traits in Chenopodium album,N/A,0
Muhammad Aslam,"Kóczy, Lászó T. 32 Lavalle Martínez, José de Jesus 8 López, Iván Darío 51 López, Omar Velázquez 13",N/A,0
Muhammad Aslam,Econocau WAys or Gowls MAIzE FoR GRAIN AND FODDER UNosa RAINee CoNorrios N NoRTHERN PUNJAB OF PAKISTAN,N/A,0
Muhammad Aslam,An empirical evaluation of artificial cooperative search algorithm for classification and regression problems,N/A,0
Muhammad Aslam,nuns UNDER MODULAR cnour ACTI-ON,N/A,0
Muhammad Aslam,IRRIGATED CROP PRODUCTION FOR FOOD SECURITY: THE ROLE OF LEGUMES,N/A,0
Muhammad Aslam,FIREARM WOUNDS,N/A,0
Muhammad Aslam,Impact Resistance and Energy Absorption of Concrete Containing High Volume Rubber Aggregate,N/A,0
Muhammad Aslam,MoDULAR GRouP AcTioN oN,N/A,0
Muhammad Aslam,A Collaborative Knowledge Management Framework for Unani Medicines,N/A,0
Muhammad Aslam,"Governmnt College of Commerce, Qadir Pur Raan, Multan, Pakistan",N/A,0
Muhammad Aslam,Khizar H k. Brackish Water Desalination Using Solar Desalination Pannel. Curr Inves Agri Curr Res 3 (1)-2018,N/A,0
Muhammad Aslam,Application of Nanomaterials as Antimicrobial Agents: A Review. Arch Nano Op Acc J 1 (3)-2018,N/A,0
Muhammad Aslam,Antibacterial Activity of Citrus Aurantifolia Leaves Extracts Against Some Enteric Bacteria of Public Health Importance. Mod App Matrl Sci 1 (2)-2018,N/A,0
Muhammad Aslam,EFFECT OF WEEDING FREQUENCY ON TOMATO (Solanum lycopersicon L.) YIELD IN NORTHERN GUINEA SAVANNA OF NIGERIA,N/A,0
Muhammad Aslam,Mixed Matrix Membranes incorporated with Sonication-assisted ZIF-8 Nanofillersfor Industrial Wastewater Treatment,N/A,0
Muhammad Aslam,INTERNATIONAL JOURNAL “Advancements in Life Sciences”,N/A,0
Muhammad Aslam,SI NDH UNIVERSITY RESEARCH JOURNAL (SCIENCE SERIES),N/A,0
Muhammad Aslam,"Agaian, S. Novel Multi-Color Transfer Algorithms and Quality Measure, T-CE August 2016 292–300 Ahn, J. In-Memory File System with Efficient Swap Support for Mobile Smart …",N/A,0
Muhammad Aslam,Hybrid Hardware Architecture for Low Complexity Motion Estimation Algorithm,N/A,0
Muhammad Aslam,CONSUMER ELECTRONICS,N/A,0
Muhammad Aslam,CONSUMPTION AND UTILIZATION OF FOOD IEY AIOLOPUS TAMULUS IABR.(ORTHOPTERA: ACRIDIDAE),N/A,0
Muhammad Aslam,Reusable Verification Model for Motion estimation Algorithm,N/A,0
Muhammad Aslam,Food consumption and utilization of,N/A,0
Muhammad Aslam,"INCIDENCE OF WEBWORM,(LOXOSTEGE MASSALIS WALKER)(LEPIDOPTERA: CRAMBIDAE) ON DATE PALM FRUITS,(PHOENIX DACTYLIFERA L.) MARKETED IN SOME NORTHERN STATES OF NIGERIA",N/A,0
Muhammad Aslam,Estimation of interrelationship among plant growth related traits of Portulaca oleracea,N/A,0
Muhammad Aslam,ELECTRONIC STRUCTURE PROPERTIES ANALYSIS OF ZINC OXIDE NANOSHEETS ATTACHED TO NI ELECTRODES,N/A,0
Muhammad Aslam,Effect Of Theophylline On Blood Pressure Of Normotensive Cats Pre-Administered With Adrenaline.,N/A,0
Muhammad Aslam,Modulatory Role of Cabbage (Brassica Olaeracea) Supplement on Blood Glucose and Some Physiological Profiles on Alloxan Induced Diabetic Wistar Rats,N/A,0
Muhammad Aslam,Seasonal Activity of Tick Infestation in Goats and Buffalo of District Sargodha Punjab Province Pakistan,N/A,0
Muhammad Aslam,The Use of Indigenous Plant in Controlling Mosquito (Agent of Infectious Disease),N/A,0
Muhammad Aslam,www. expert-reviews. com 117,N/A,0
Muhammad Aslam,"DETERMINATION OF THERMAL CONDUCTIVITY AND DIFFUSIVITY OF DIFFERENT SOIL SAMPLES IN HADEJIA METROPOLIS, JIGAWA STATE NIGERIA",N/A,0
Muhammad Aslam,RHF AND DFT STUDY OF THE BENZENE AND HYDROXYL BENZENE MOLECULE GROUP IN GAS PHASE,N/A,0
Muhammad Aslam,Ad Hoc Gateway Service for Automatic Package Delivery using Networked Appliances,N/A,0
Muhammad Aslam,RHF AND DFT THEORETICAL STUDY OF THE BENZENE AND HYDROXYL BENZENE MOLECULE GROUP IN GAS PHASE.,N/A,0
Muhammad Aslam,Nominees elected to the Fellowship and Member-ship under Bye Law III 2 ii,N/A,0
Muhammad Aslam,"The Organizing and Technical Committees of 2017 IEEE Conference on Systems, Process & Control (ICSPC 2017) would like to express gratitude to all reviewers for the volunteering …",N/A,0
Muhammad Aslam,COMPARATIVE STUDY OF TRANSIENT ANALYSIS OF PAKISTAN RESEARCH REACTOR-1 (PARR-1) WITH HIGH DENSITY FUEL,N/A,0
Muhammad Aslam,"1University of Engineering and Technology, Pakistan, 2University of Toledo, USA",N/A,0
Muhammad Aslam,The Organizing and Technical Committees of 2013 IEEE 9th International Colloquium on Signal Processing and its Applications (CSPA 2013) would like to express gratitude to all …,N/A,0
Muhammad Aslam,"Transmutation of 129 I, 237 Np, 238 Pu, 239 Pu, and 241 Am using neutrons pro-duced in target-blanket system ‘Energy plus Transmutation’by relativistic pro-tons 201",N/A,0
Muhammad Aslam,Colloquium 2013,N/A,0
Muhammad Aslam,WI 2012 Non-PC Reviewers,N/A,0
Muhammad Aslam,AgentServices: Agent Services Framework for Handheld Devices,N/A,0
Muhammad Aslam,Intelligent Interface for Wearable Items Suggestion,N/A,0
Muhammad Aslam,Work Proximity on Interrelated Coauthoring Production,N/A,0
Muhammad Aslam,Intelligent System for Searching Nearest Services using Multi-Agent Approach,N/A,0
Muhammad Aslam,A Framework for Constraint Classification and Management in Dynamic Environment of the Process Industry,N/A,0
Muhammad Aslam,Performance Fitness Analysis & Implementation Framework for Information Technology Modernization in Chemical Industry,N/A,0
Muhammad Aslam,An Inference Engine for Web Adaptive Cooperative Work,N/A,0
Ammar Mahdhaoui,Interpersonal synchrony: A survey of evaluation methods across disciplines,2012,582
Ammar Mahdhaoui,Motherese in interaction: at the cross-road of emotion and cognition?(A systematic review),2013,399
Ammar Mahdhaoui,Do parents recognize autistic deviant behavior long before diagnosis? Taking into account interaction using computational methods,2011,174
Ammar Mahdhaoui,Do parentese prosody and fathers' involvement in interacting facilitate social interaction in infants who later develop autism?,2013,106
Ammar Mahdhaoui,Computerized home video detection for motherese may help to study impaired interaction between infants who become autistic and their parents,2011,62
Ammar Mahdhaoui,Time-scale feature extractions for emotional speech characterization: applied to human centered interaction analysis,2009,42
Ammar Mahdhaoui,Generating robot/agent backchannels during a storytelling experiment,2009,42
Ammar Mahdhaoui,Emotional speech classification based on multi view characterization,2010,20
Ammar Mahdhaoui,Automatic motherese detection for face-to-face interaction analysis,2009,18
Ammar Mahdhaoui,Motherese detection based on segmental and supra-segmental features,2008,17
Ammar Mahdhaoui,Course of maternal prosodic incitation (motherese) during early development in autism: an exploratory home movie study,2013,13
Ammar Mahdhaoui,Multimodal feedback from robots and agents in a storytelling experiment,2008,12
Ammar Mahdhaoui,Supervised and semi-supervised infant-directed speech classification for parent-infant interaction analysis,2011,11
Ammar Mahdhaoui,Analyse de signaux sociaux pour la modélisation de l'interaction face à face,2010,9
Ammar Mahdhaoui,A new approach for motherese detection using a semi-supervised algorithm,2009,9
Ammar Mahdhaoui,Emotional speech characterization based on multi-features fusion for face-to-face interaction,2009,6
Ammar Mahdhaoui,Detecção automática do manhês: análise da prosódia de pais de crianças autistas,2010,4
Ammar Mahdhaoui,Time-frequency features extraction for infant directed speech discrimination,2010,4
Ammar Mahdhaoui,Understanding parent-infant behaviors using non-negative matrix factorization,2011,3
Ammar Mahdhaoui,Course of maternal prosodic incitation during early development in autism: An exploratory home movie study,2013,0
Ammar Mahdhaoui,Do Parentese Prosody and Fathers’ Involvement in Interacting Facilitate,2013,0
Ammar Mahdhaoui,"Computation highlights subtle interactions between autistic babies and their parents, who are sensitive to their child's particularities",2012,0
Ammar Mahdhaoui,Sensing Emotion and Affect-Facing Realism in Speech Processing,2011,0
Ammar Mahdhaoui,Project# 3.4: multimodal feedback from robots and agents in a storytelling experiment,2008,0
Ammar Mahdhaoui,Automatic Motherese Detection for Parent-Infant Interaction,N/A,0
Brian Dorn,Theory and practice of case-based learning aids,2012,228
Brian Dorn,Measuring cognitive load in introductory CS: adaptation of an instrument,2014,139
Brian Dorn,Learning on the job: characterizing the programming knowledge and learning strategies of web designers,2010,108
Brian Dorn,Empirical validation and application of the computing attitudes survey,2015,105
Brian Dorn,Jeroo: a tool for introducing object-oriented programming,2003,101
Brian Dorn,A statistical analysis of student performance in online computer science courses,2004,62
Brian Dorn,Graphic designers who program as informal computer science learners,2006,58
Brian Dorn,"Aggregate compilation behavior: Findings and implications from 27,698 users",2015,56
Brian Dorn,An analysis of HTML and CSS syntax errors in a web development course,2015,41
Brian Dorn,Piloting TrACE: Exploring spatiotemporal anchored collaboration in asynchronous learning,2015,41
Brian Dorn,Classroom experience with Jeroo,2003,41
Brian Dorn,Discovering computing: perspectives of web designers,2010,34
Brian Dorn,"Understanding the"" teacher experience"" in primary and secondary CS professional development",2017,33
Brian Dorn,Context as support for learning computer organization,2008,33
Brian Dorn,Learning sciences for computing education,2019,32
Brian Dorn,An empirical analysis of video viewing behaviors in flipped CS1 courses,2016,32
Brian Dorn,Toward a validated computing attitudes survey,2012,32
Brian Dorn,Lost while searching: Difficulties in information seeking among end‐user programmers,2013,28
Brian Dorn,The case for validated tools in computer science education research,2013,24
Brian Dorn,Introductory computing construct use in an end-user programming community,2007,24
Brian Dorn,Native language's effect on java compiler errors,2019,23
Brian Dorn,Examining instructor use of learning analytics,2017,23
Brian Dorn,Using Jeroo to introduce object-oriented programming,2003,23
Brian Dorn,Enabling and integrating online formative assessment in a flipped calculus course,2016,21
Brian Dorn,Becoming experts: Measuring attitude development in introductory computer science,2013,20
Brian Dorn,ScriptABLE: Supporting informal learning with cases,2011,18
Brian Dorn,Using influence and persuasion to shape player experiences,2009,18
Brian Dorn,A case-based approach for supporting the informal computing education of end-user programmers.,2010,16
Brian Dorn,Student performance online vs onground: A statistical analysis of is courses,2006,13
Brian Dorn,Computing education research today,2019,11
Brian Dorn,Identification of the emergent leaders within a CSE professional development program,2016,11
Brian Dorn,Sparcs: A personalized problem-based learning approach for developing successful computer science learning experiences in middle school,2017,10
Brian Dorn,Automated Analysis of Lecture Video Engagement Using Student Posts,2017,9
Brian Dorn,Computing on the silicon prairie: The state of CS in Nebraska public schools,2015,9
Brian Dorn,Explorations and experiences with ambient information systems,2007,9
Brian Dorn,A type notation for Scheme,2005,8
Brian Dorn,Thanks for sharing: CS pedagogical content knowledge sharing in online environments,2016,7
Brian Dorn,Stepwise refinement in block-based programming,2019,6
Brian Dorn,Community chairs as a catalyst for campus collaborations in STEM,2015,4
Brian Dorn,Designing a user interface for a PDA-based campus navigation device,2004,4
Brian Dorn,Computational thinking bins: Outreach and more,2019,3
Brian Dorn,Graphic designers who program as informal cs learners,2006,2
Brian Dorn,Design and implementation of a reusable type inference engine and its application to Scheme,2005,2
Brian Dorn,Object-oriented programming with Jeroo in the information technology classroom,2004,2
Brian Dorn,ICER 2016 preview,2016,1
Brian Dorn,Teacher Perspectives on Web Design Instruction,2015,1
Brian Dorn,The Case for Validated Tools in Computer Science Education Research,2013,1
Brian Dorn,Reaching learners beyond our hallowed halls,2011,1
Brian Dorn,Learning on the Web: A Case Study of Graphic Design End-User Programmers,2009,1
Brian Dorn,Introduction to computer programming with JEROO: post-conference workshop,2008,1
Brian Dorn,"Computer science construct use, learning, and creative credit in a graphic design community",2008,1
Brian Dorn,Community-Based Scaffolding to Promote End-User Learning,2007,1
Brian Dorn,Teaching without a classroom: delivering courses online,2003,1
Brian Dorn,SIGCSE Technical Symposium 2023 Report,2023,0
Brian Dorn,"SIGCSE Bulletin Vol. 55, No. 2",2023,0
Brian Dorn,SIGCSE Technical Symposium 2023: Information for Attendees,2023,0
Brian Dorn,"SIGCSE Bulletin Vol. 55, No.",2023,0
Brian Dorn,SIGCSE Technical Symposium 2022: call for submissions,2022,0
Brian Dorn,"Message from the 2022 Symposium, Program, and Hybrid Experience Chairs",2022,0
Brian Dorn,Bulldozing the STEM Silos in Omaha: While Engaging P-12 Teachers and Building Campus STEM Excellence,2019,0
Brian Dorn,ICER 2016 Chairs' welcome,2016,0
Brian Dorn,ICER preview,2016,0
Brian Dorn,ICER conference report,2015,0
Brian Dorn,ICER preview: join us in Omaha,2015,0
Brian Dorn,ICER 2015 Chairs' welcome,2015,0
Brian Dorn,K12 CS Teaching Methods Courses,2015,0
Brian Dorn,ICER2015 preview,2015,0
Brian Dorn,The evolution of TrACE: Integration of a collaborative learning platform in flipped classrooms,2015,0
Brian Dorn,"Still time to contribute to ICER 2104, Glasgow, Scotland",2014,0
Brian Dorn,ICER 2014 chairs' welcome,2014,0
Brian Dorn,A look ahead to ICER 2014,2013,0
Brian Dorn,Including HCI and user experience (UX) methodologies in computing curriculum,2013,0
Brian Dorn,A Framework for Implementing Type Systems,2007,0
Brian Dorn,Session details: Keynote Address,N/A,0
Brian Dorn,"Session details: Research: predictors, creative thinking, co-linking courses",N/A,0
Brian Dorn,Session details: Papers: Perceptions of CS Study and Careers,N/A,0
Brian Dorn,Jeroo–A Tool for Introducing Object-Oriented Concepts,N/A,0
Brian Dorn,Student Performance Online vs Onground: A Statistical Analysis of IS Courses Gary Ury garyury@ mail. nwmissouri. edu,N/A,0
Nicholas Kong,Sizing the horizon: the effects of chart size and layering on the graphical perception of time series visualizations,2009,415
Nicholas Kong,"ReVision: automated classification, analysis and redesign of chart images",2011,325
Nicholas Kong,System and method for supporting targeted sharing and early curation of information,2013,247
Nicholas Kong,Perceptual guidelines for creating rectangular treemaps,2010,153
Nicholas Kong,Graphical Overlays: Using Layered Elements to Aid Chart Reading,2012,103
Nicholas Kong,Delta: a tool for representing and comparing workflows,2012,75
Nicholas Kong,Extracting references between text and charts via crowdsourcing,2014,73
Nicholas Kong,Modeling pointing at targets of arbitrary shapes,2007,41
Nicholas Kong,System and method for providing mixed-initiative curation of information within a shared repository,2014,28
Nicholas Kong,Perceptual interpretation of ink annotations on line charts,2009,27
Nicholas Kong,VisualWikiCurator: human and machine intelligencefor organizing wiki content,2011,19
Nicholas Kong,Mail2Wiki: low-cost sharing and early curation from email to wikis,2011,11
Nicholas Kong,Absolute vs. Relative Direct Pen Input,2006,7
Nicholas Kong,Mail2Wiki: posting and curating Wiki content from email,2011,3
Nicholas Kong,VisualWikiCurator: a corporate Wiki plugin,2011,2
Nicholas Kong,Techniques for Modifying and Augmenting Existing Charts for Improved Usability,2013,1
Nicholas Kong,Mail2Wiki: Low-cost sharing and organization on wikis,2010,1
Djoko Budiyanto Setyohadi,Analisis Penerimaan e-Learning Menggunakan Technology Acceptance Model (TAM)(Studi Kasus: Universitas Atma Jaya Yogyakarta),2017,191
Djoko Budiyanto Setyohadi,Model DeLone and McLean untuk mengukur kesuksesan e-government Kota Pekalongan,2015,143
Djoko Budiyanto Setyohadi,Analysis of the effect of information system quality to intention to reuse of employee management information system (Simpeg) based on information systems success model,2016,63
Djoko Budiyanto Setyohadi,Analisis Dampak Faktor Customer Relationship Managementdalam Melihat Tingkat Kepuasan Dan Loyalitas Pada Pelanggan Marketplace Di Indonesia,2017,52
Djoko Budiyanto Setyohadi,Analisis sentimen pada Twitter mahasiswa menggunakan metode backpropagation,2016,42
Djoko Budiyanto Setyohadi,Galvanic skin response data classification for emotion detection,2018,41
Djoko Budiyanto Setyohadi,Strategic information system plan for the implementation of information technology at Polytechnic “API” Yogyakarta,2017,34
Djoko Budiyanto Setyohadi,FAKTOR-FAKTOR YANG MEMPENGARUHI PENERIMAAN MOBILE BANKING STUDI KASUS: BRI CABANG BAJAWA,2016,34
Djoko Budiyanto Setyohadi,Information Technology Governance Assessment in Universitas Atma Jaya Yogyakarta using COBIT 5 Framework,2017,33
Djoko Budiyanto Setyohadi,Summarizing Indonesian text automatically by using sentence scoring and decision tree,2017,31
Djoko Budiyanto Setyohadi,Strategic plan with enterprise architecture planning for applying information system at PT. Bestonindo Central Lestari,2017,31
Djoko Budiyanto Setyohadi,Analisis Komunikasi Sosial Media Twitter sebagai Saluran Layanan Pelanggan Provider Internet dan Seluler di Indonesia,2017,29
Djoko Budiyanto Setyohadi,Pengaruh Kekuatan Media Sosial dalam Pengembangan Kesenjangan Digital,2016,29
Djoko Budiyanto Setyohadi,Social critical factors affecting intentions and behaviours to use E-Learning: An empirical investigation using technology acceptance model,2017,28
Djoko Budiyanto Setyohadi,Perencanaan strategis sistem informasi menggunakan TOGAF (studi kasus: universitas satria makassar),2016,27
Djoko Budiyanto Setyohadi,M-Learning interface design based on emotional aspect analysis,2017,24
Djoko Budiyanto Setyohadi,Increasing user satisfaction of mobile commerce using usability,2020,22
Djoko Budiyanto Setyohadi,Perbaikan Performansi Klasifikasi Dengan Preprocessing Iterative Partitioning Filter Algorithm,2017,22
Djoko Budiyanto Setyohadi,Pengukuran Kesenjangan Digital Masyarakat Di Kota Pekalongan,2016,21
Djoko Budiyanto Setyohadi,FACTORS INFLUENCING ACCEPTANCE OF ONLINE SHOPPING IN TANZANIA USING UTAUT2,2020,20
Djoko Budiyanto Setyohadi,Understanding customers’ intention to use social network sites as complaint channel: an analysis of young customers’ perspectives,2018,20
Djoko Budiyanto Setyohadi,Strategic Planning of Information System (Case Study: Ministry of Religious Affairs in Southwest Sumba),2017,20
Djoko Budiyanto Setyohadi,The Analysis of Academic Information System Success: A Case Study at Instituto Profissional De Canossa (IPDC) Dili Timor-Leste,2017,19
Djoko Budiyanto Setyohadi,Analysis Of Public Sentiment About Covid-19 In Indonesia On Twitter Using Multinomial Naive Bayes And Support Vector Machine,2021,18
Djoko Budiyanto Setyohadi,The Analysis of Implementation Business Model Canvas At The E-Marketplace Dipeta Company,2017,18
Djoko Budiyanto Setyohadi,Motivation and Engagement of Final-Year Students When Using E-learning: A Qualitative Study of Gamification in Pandemic Situation,2022,17
Djoko Budiyanto Setyohadi,Designing An Iot Based Smart Monitoring and Emergency Alert System for Covid19 Patients,2021,17
Djoko Budiyanto Setyohadi,Enterprise architecture modeling for oriental university in Timor Leste to support the strategic plan of integrated information system,2017,17
Djoko Budiyanto Setyohadi,An identification of success of academic system application using Delone and McLean design (Case study at Wira Husada school of health science Yogyakarta),2018,15
Djoko Budiyanto Setyohadi,"Identification of Factors Influencing the Success of Hospital Information System (SIRS) by Hot-Fit Model 2006: A Case Study of RSUD Dr Samratulangi Tondano, Minahasa Regency …",2017,14
Djoko Budiyanto Setyohadi,Strategic planning for the information development of IPDC (Instituto Profissional De Canossa) library using TOGAF method,2017,14
Djoko Budiyanto Setyohadi,Analysis Business Architecture Study Case: Medical Colleges in Purwokerto,2017,14
Djoko Budiyanto Setyohadi,Research Trend on the Use of IT in Digital Addiction: An Investigation Using a Systematic Literature Review,2020,12
Djoko Budiyanto Setyohadi,"E-Government Integration Based on SOA for Supporting Sleman Smart Regency (A Case Study of Sleman Regency, Special Region of Yogyakarta)",2018,12
Djoko Budiyanto Setyohadi,An investigation of external factors for technological acceptance model of nurses in Indonesia,2018,12
Djoko Budiyanto Setyohadi,Optimization overlap clustering based on the hybrid rough discernibility concept and rough K-Means,2015,12
Djoko Budiyanto Setyohadi,Exploring collective memory and place attachment using social media data,2017,11
Djoko Budiyanto Setyohadi,Student learning styles and emotional tendencies detection based on Twitter,2017,11
Djoko Budiyanto Setyohadi,Factors Affecting the Successful Implementation of E-Government on Network Documentation and Legal Information Website in Riau,2018,10
Djoko Budiyanto Setyohadi,System dynamics modelling for calculation of carbon footprint on a non-homogeneous production system: A case in a ceramic studio,2023,9
Djoko Budiyanto Setyohadi,AHP-TOPSIS on selection of new university students and the prediction of future employment,2017,9
Djoko Budiyanto Setyohadi,Empirical investigation on factors related to individual of impact performance information system,2017,9
Djoko Budiyanto Setyohadi,An empirical investigations of user acceptance of “Scalsa” e-learning in stikes Harapan Bangsa Purwokerto,2017,9
Djoko Budiyanto Setyohadi,IoT-Based Monitoring and Design of Automatic Fish Drying Equipment Using Fuzzy Logic,2021,8
Djoko Budiyanto Setyohadi,Design of Mobile Application for Community Health Workers: A Case Study in Rwanda,2020,8
Djoko Budiyanto Setyohadi,Novel Graph Model for Solving Collision-Free Multiple-Vehicle Traveling Salesman Problem Using Ant Colony Optimization,2020,8
Djoko Budiyanto Setyohadi,Analisis Perbandingan Metode Sibis Dan Metode Econometric Dalam Pengukuran Kesenjangan Digital Di Sumba Barat Daya,2017,8
Djoko Budiyanto Setyohadi,GPU CUDA accelerated Image Inpainting using Fourth Order PDE equation,2016,8
Djoko Budiyanto Setyohadi,Identifying the effect of emotions in government-citizen online (G2C) tourism based on the HEART metrics,2021,7
Djoko Budiyanto Setyohadi,Improvement of Information Technology Infrastructure in Higher Education using IT Balanced Scorecard,2018,7
Djoko Budiyanto Setyohadi,Self-Efficacy a Critical Factor of Information System: An Investigation using DeLone McLean,2018,7
Djoko Budiyanto Setyohadi,What Should Be Considered for Acceptance Mobile Payment: An Investigation of the Factors Affecting of the Intention to Use System Services T-Cash,2018,7
Djoko Budiyanto Setyohadi,Determination of assistance to the poor by integrating fuzzy AHP and TOPSIS models:(Case study Bali Province),2017,7
Djoko Budiyanto Setyohadi,Accounting information system for nonprofit organization based on PSAK 45 standards,2017,7
Djoko Budiyanto Setyohadi,Mengukur Kesiapan Implementasi Customer Relationship Management (CRM) Model Application Service Provider (ASP) pada Usaha Mikro Kecil Menengah (UMKM) di Indonesia,2017,7
Djoko Budiyanto Setyohadi,PENGUKURAN TATA KELOLA INFRASTRUKTUR TEKNOLOGI INFORMASI BERDASARKAN COBIT FRAMEWORK 4.1 (STUDI KASUS UNIVERSITAS PEMBANGUNAN NASIONAL “VETERAN” JAWA TIMUR),2015,7
Djoko Budiyanto Setyohadi,Analisis User Interface (UI) Dan User Experience (UX) Sudut Elevasi Pemukul Gamelan Metaverse Virtual Reality Menggunakan User Centered Design (UCD),2023,6
Djoko Budiyanto Setyohadi,E-commerce online review for detecting influencing factors users perception,2021,6
Djoko Budiyanto Setyohadi,Reverse engineering from 3D mesh to ceramic product in the form of miranda kerr tea for one teapot in PT doulton Indonesia,2021,6
Djoko Budiyanto Setyohadi,An Investigation of Factors Affecting the Success of Regional Financial Management Information System (Case Study of Palangka Raya Government),2018,6
Djoko Budiyanto Setyohadi,Usability Evaluation Using Multi-Method for Improvement Interaction in M-Commerce,2018,6
Djoko Budiyanto Setyohadi,Regulatory framework creation analysis to reduce security risks the use of social media in companies,2017,6
Djoko Budiyanto Setyohadi,Virtual design and machining of core and cavity for fabrication of dining plate tableware with Kawung batik pattern,2022,5
Djoko Budiyanto Setyohadi,Image Classification Of Infected Potato Leaves Using Deep CNN Transfer Learning,2021,5
Djoko Budiyanto Setyohadi,Usability Experience on Tourism Website Using the Use Questionnaire Approach,2021,5
Djoko Budiyanto Setyohadi,Measuring User Satisfaction in Website Usability by Considering Stress Level,2021,5
Djoko Budiyanto Setyohadi,Uncertainty Avoidance and Individualism Collectivism on Acceptance of Smart City Mobile Applications,2020,5
Djoko Budiyanto Setyohadi,Interaction Design Consideration for Senior High School Students: A Usability Evaluation of Go-Jek Mobile Applications,2018,5
Djoko Budiyanto Setyohadi,Digital Divide Measurement in Lembata Regency Using SIBIS,2018,5
