Author Name,Title,Year,Citations
Niklas Humble,Educational Game Design for Girls and Boys: Towards an Inclusive Conceptual Model for Learning Programming,2023,0
Niklas Humble,Redesigning Professional Development on Digital Transformation Using Andragogy as a Theoretical Lens,2023,0
Niklas Humble,Development of an Enjoyable Educational Game on Fundamental Programming: Designing for Inclusion and Learning Analytics,2023,0
Niklas Humble,Need-Based Game Design: Developing a CT Game Based on Educational Needs,2023,0
Niklas Humble,The consequences of ChatGPT for programming education: Cheating or AI-enhanced learning?,2023,0
Niklas Humble,A lifelong learning perspective on artificial intelligence: What do we need to know?,2023,0
Niklas Humble,Redesigning technology-enhanced professional development to facilitate lifelong learning,2023,0
Niklas Humble,Redesigning Technology-Enhanced Professional Development to Facilitate Lifelong Learning,2023,0
Niklas Humble,An Educational Escape Room for Computational Thinking: Defining the Requirements,2023,0
Niklas Humble,Programming in grade 7-9: Action possibilities and constraints from the perspective of mathematics and technology teachers,2023,0
Niklas Humble,Sentiment analysis for emotional navigation in written communication: What support do autistic people need?,2022,0
Niklas Humble,Discover Artificial Intelligence,2022,0
Niklas Humble,Computerised Consequentialism to Support Moral Reasoning and Decision Making in Crisis Management,2021,0
Niklas Humble,Teaching in the Age of COVID19–One Year Later,2021,0
Niklas Humble,Computational Moral Support in Crisis Management: The Idea of Facilitating Decision Making,2021,0
Niklas Humble,Teaching in the Age of Covid-19—1 Year Later,2021,0
Niklas Humble,Developing a web application for auto-generating grammar tests,2020,0
Niklas Humble,Teaching in the age of Covid-19. Postdigital Science and Education,2020,0
Niklas Humble,Learning Analytics For Programming Education: Obstacles And Opportunities,2019,0
Evangelos Niforatos,Analysis of users’ heart rate data and self-reported perceptions to understand effective virtual reality characteristics,2018,54
Evangelos Niforatos,EmoSnaps: a mobile application for emotion recall from facial expressions,2014,50
Evangelos Niforatos,Measuring the media effects of a tourism-related virtual reality experience using biophysical data,2017,49
Evangelos Niforatos,Atmos: a hybrid crowdsourcing approach to weather estimation,2014,44
Evangelos Niforatos,Understanding the Potential of Human-Machine Crowdsourcing for Weather Data,2016,42
Evangelos Niforatos,Does locality make a difference? Assessing the effectiveness of location-aware narratives,2012,42
Evangelos Niforatos,Assessing cognitive performance using physiological and facial features: Generalizing across contexts,2020,40
Evangelos Niforatos,EEGlass: An EEG-eyeware prototype for ubiquitous brain-computer interaction,2019,35
Evangelos Niforatos,"Can less be more? Contrasting limited, unlimited, and automatic picture capture for augmenting memory recall",2017,33
Evangelos Niforatos,Augmenting skiers' peripheral perception,2017,28
Evangelos Niforatos,Design and Evaluation of a Wearable AR System for Sharing Personalized Content on Ski Resort Maps,2016,24
Evangelos Niforatos,"Everyday commuting: Prediction, actual experience and recall of anger and frustration in the car",2015,24
Evangelos Niforatos,Would you do it?: Enacting Moral Dilemmas in Virtual Reality for Understanding Ethical Decision-Making,2020,22
Evangelos Niforatos,Multimedia Memory Cues for Augmenting Human Memory,2016,22
Evangelos Niforatos,Augmenting Customer Journey Maps with quantitative empirical data: a case on EEG and eye tracking,2012,21
Evangelos Niforatos,SkiAR: Wearable augmented reality system for sharing personalized content on ski resort maps,2016,20
Evangelos Niforatos,Shadowtouch: A multi-user application selection interface for interactive public displays,2015,18
Evangelos Niforatos,PLBSD: a platform for proactive location-based service discovery,2012,17
Evangelos Niforatos,Investigating the Effect of User Profile during Training for BCI-based Games,2017,14
Evangelos Niforatos,My good old kodak: understanding the impact of having only 24 pictures to take,2014,14
Evangelos Niforatos,Designing for task resumption support in mobile learning,2019,13
Evangelos Niforatos,Re-live the moment: visualizing run experiences to motivate future exercises,2015,13
Evangelos Niforatos,A cognitive assistant for operators: AI-powered knowledge sharing on complex systems,2022,11
Evangelos Niforatos,s-Helmet: a ski helmet for augmenting peripheral perception,2016,11
Evangelos Niforatos,Augmenting memory recall in work meetings: establishing a quantifiable baseline,2018,10
Evangelos Niforatos,Amplifying human cognition: bridging the cognitive gap between human and machine,2017,10
Evangelos Niforatos,Supporting interactivity on a ski lift,2015,10
Evangelos Niforatos,Harnessing large language models for cognitive assistants in factories,2023,9
Evangelos Niforatos,‘Weather With You’: Evaluating Report Reliability in Weather Crowdsourcing,2015,9
Evangelos Niforatos,Measuring the effect of cued recall on work meetings,2016,8
Evangelos Niforatos,eMotion: retrospective in-car user experience evaluation,2015,8
Evangelos Niforatos,PulseCam: biophysically driven life logging,2015,8
Evangelos Niforatos,Safeguarding Crowdsourcing Surveys from ChatGPT with Prompt Injection,2023,7
Evangelos Niforatos,A conversational user interface for instructional maintenance reports,2022,7
Evangelos Niforatos,Goalkeeper: A zero-sum exergame for motivating physical activity,2021,7
Evangelos Niforatos,Augmenting humans on the slope: Two electronic devices that enhance safety and decision making,2018,7
Evangelos Niforatos,Mobile first? Understanding device usage practices in novel content sharing services,2016,7
Evangelos Niforatos,Public displays for monitoring and improving community wellbeing,2015,6
Evangelos Niforatos,Brain–Computer Interfacing with Interactive Systems,2021,5
Evangelos Niforatos,Exploring EEG signals during the different phases of game-player interaction,2019,5
Evangelos Niforatos,Lessons learned from designing and evaluating CLAICA: a continuously learning ai cognitive assistant,2023,4
Evangelos Niforatos,"Break, Repair, Learn, Break Less: Investigating User Preferences for Assignment of Divergent Phrasing Learning Burden in Human-Agent Interaction to Minimize Conversational …",2022,4
Evangelos Niforatos,Effects of a Monocular Laser-Based Head-Mounted Display on Human Night Vision,2019,4
Evangelos Niforatos,WAHM 2016: 3rd workshop on ubiquitous technologies for augmenting the human mind,2016,4
Evangelos Niforatos,WeatherUSI: User-Based Weather Crowdsourcing on Public Displays,2016,4
Evangelos Niforatos,WeatherUSI: Crowdsourcing weather experience on public displays,2015,4
Evangelos Niforatos,Knowledge sharing in manufacturing using LLM-powered tools: user study and model benchmarking,2024,3
Evangelos Niforatos,Chatbots in Knowledge-Intensive Contexts: Comparing Intent and LLM-Based Systems,2024,3
Evangelos Niforatos,Design for long-term memory augmentation in personal knowledge management applications,2021,3
Evangelos Niforatos,Tacit Knowledge Elicitation for Shop-floor Workers with an Intelligent Assistant,2023,2
Evangelos Niforatos,Method and system for pervasive memory augmentation via a heads-up display,2022,2
Evangelos Niforatos,New Trends in HCI and Sports,2022,2
Evangelos Niforatos,"Promoting CARE: Changes via Awareness, Recognition and Experience",2017,2
Evangelos Niforatos,An Emotion-Adaptive VR Experience for Recreational Use in Eldercare,2023,1
Evangelos Niforatos,Technology-Augmented Perception and Cognition,2021,1
Evangelos Niforatos,From Toolmakers to Cyborgs,2021,1
Evangelos Niforatos,The role of context in human memory augmentation,2018,1
Evangelos Niforatos,Workshop on Mobile Cognition: Using Mobile Devices to Enhance Human Cognition,2015,1
Evangelos Niforatos,Enwildering the lab: merging field evaluation with in-lab experience sampling,2013,1
Evangelos Niforatos,Exploring the use of EEG and Eye Tracking in Understanding Customer Experiences for Service Design,2012,1
Evangelos Niforatos,MarkupLens: An AI-Powered Tool to Support Designers in Video-Based Analysis at Scale,2024,0
Evangelos Niforatos,"Systems, devices, and methods for assisting human-to-human interactions",2023,0
Evangelos Niforatos,How Emoji and Explanations Influence Adherence to AI Recommendations,2023,0
Evangelos Niforatos,Nose-operated head-mounted device,2023,0
Evangelos Niforatos,Proceedings of the New Trends in HCI and Sports Workshop (NTSPORT 2022),2022,0
Evangelos Niforatos,Preface to the Proceedings of the Workshop “New Trends in HCI and Sports” held at MobileHCI ‘22,2022,0
Evangelos Niforatos,"Systems, devices, and methods for assisting human-to-human interactions",2020,0
Evangelos Niforatos,Endowing Head-Mounted Displays with Physiological Sensing for Augmenting Human Learning and Cognition,2020,0
Evangelos Niforatos,EEGlass,2019,0
Evangelos Niforatos,WAHM 2016,2016,0
Evangelos Niforatos,Footprint Tracker: reviewing lifelogs and reconstructing daily experiences,2012,0
Evangelos Niforatos,s-Helmet,N/A,0
Evangelos Niforatos,Session details:(WAHM) 3rd workshop on ubiquitous technologies for augmenting the human mind,N/A,0
Evangelos Niforatos,3.11 Ambient Episodic Memory Augmentation with Context,N/A,0
Evangelos Niforatos,3.10 Augmenting Human Memory For UX Evaluation,N/A,0
Evangelos Niforatos,Human-Computer Interaction Design,N/A,0
Antonio Origlia,Smart parking: Using a crowd of taxis to sense on-street parking space availability,2019,124
Antonio Origlia,Continuous emotion recognition with phonetic syllables,2014,52
Antonio Origlia,Different parts of the same elephant: a roadmap to disentangle and connect different perspectives of prosodic prominence,2015,46
Antonio Origlia,From speech to personality: Mapping voice quality and intonation into personality differences,2012,43
Antonio Origlia,From nonverbal cues to perception: personality and social attractiveness,2012,38
Antonio Origlia,On the use of the rhythmogram for automatic syllabic prominence detection,2011,35
Antonio Origlia,Prosomarker: a prosodic analysis tool based on optimal pitch stylization and automatic syllabi fication.,2012,31
Antonio Origlia,Imitation/self-imitation in computer-assisted prosody training for Chinese learners of L2 Italian,2012,28
Antonio Origlia,Automatic classification of emotions via global and local prosodic features on a multilingual emotional database,2010,26
Antonio Origlia,A 2-step approach to improve data-driven parking availability predictions,2017,24
Antonio Origlia,A dynamic tonal perception model for optimal pitch stylization,2013,23
Antonio Origlia,Attentional and emotional regulation in human-robot interaction,2012,23
Antonio Origlia,From architectural survey to continuous monitoring: graph-based data management for cultural heritage conservation with digital twins,2021,18
Antonio Origlia,An audiovisual corpus of guided tours in cultural sites: Data collection protocols in the chrome project,2018,18
Antonio Origlia,Investigating syllabic prominence with Conditional Random Fields and Latent-Dynamic Conditional Random Fields.,2012,16
Antonio Origlia,Psycho-acoustics inspired automatic speech recognition,2021,14
Antonio Origlia,A divide et impera algorithm for optimal pitch stylization,2011,13
Antonio Origlia,Exploiting recurring patterns to improve scalability of parking availability prediction systems,2020,12
Antonio Origlia,Pitch behavior detection for automatic prominence recognition,2010,12
Antonio Origlia,Multiple-source data collection and processing into a graph database supporting cultural heritage applications,2021,11
Antonio Origlia,"FANTASIA: a framework for advanced natural tools and applications in social, interactive approaches",2019,11
Antonio Origlia,CoWME: a general framework to evaluate cognitive workload during multimodal interaction,2013,11
Antonio Origlia,"Phonetic and functional features of pauses, and concurrent gestures, in tourist guides’ speech",2019,10
Antonio Origlia,A Dialogue-based Software Architecture for Gamified Discrimination Tests.,2017,10
Antonio Origlia,On-line filtering of on-street parking data to improve availability predictions,2019,9
Antonio Origlia,Evalita 2011: Forced alignment task,2013,9
Antonio Origlia,GalataV (2014) Continuous emotion recognition with phonetic syllables,N/A,9
Antonio Origlia,Brillo: A robotic architecture for personalised long-lasting interactions in a bartending domain,2021,8
Antonio Origlia,"Human, all too human: Towards a disfluent virtual tourist guide",2019,8
Antonio Origlia,Towards a logic-based approach for multi-modal fusion and decision making during motor rehabilitation sessions,2019,7
Antonio Origlia,Semantically Annotated 3D Material Supporting the Design of Natural User Interfaces for Architectural Heritage.,2018,7
Antonio Origlia,MWN-E: a graph database to merge morpho-syntactic and phonological data for italian,2017,7
Antonio Origlia,Graph databases for designing high-performance speech recognition grammars,2017,7
Antonio Origlia,Evaluating a multi-avatar game for speech therapy applications,2018,6
Antonio Origlia,Multimedia Responses in Natural Language Dialogues.,2016,6
Antonio Origlia,Overview of the evalita 2018 spoken utterances guiding chef’s assistant robots (sugar) task,2018,5
Antonio Origlia,Overview of the evalita 2018 evaluation of italian dialogue systems (idial) task,2018,5
Antonio Origlia,From linguistic linked open data to multimodal natural interaction: A case study,2018,5
Antonio Origlia,A framework for distributed interaction in intelligent environments,2017,5
Antonio Origlia,Why so Serious? Raising Curiosity Towards Cultural Heritage with Playful Games.,2016,5
Antonio Origlia,"C, Avesani, G",2015,5
Antonio Origlia,Introducing context in syllable based emotion tracking,2014,5
Antonio Origlia,Evalita 2014: Emotion recognition task (ert),2014,5
Antonio Origlia,Polarexpress: Polar question forms expressing bias-evidence conflicts in italian,2021,4
Antonio Origlia,AVI-CH 2018: advanced visual interfaces for cultural heritage,2018,4
Antonio Origlia,Forced alignment on children speech,2014,4
Antonio Origlia,Forced alignment on children speech,2014,4
Antonio Origlia,Developing embodied conversational agents in the unreal engine: the FANTASIA Plugin,2022,3
Antonio Origlia,A multi-source graph representation of the movie domain for recommendation dialogues analysis,2022,3
Antonio Origlia,Exploring Attention in a Multimodal Corpus of Guided Tours.,2020,3
Antonio Origlia,Gamified discrimination tests for speech therapy applications,2018,3
Antonio Origlia,"Syllable structure, automatic syllabification and reduction phenomena",2018,3
Antonio Origlia,"A Generic, Multimodal Framework for Sensorial Feedback on Android Systems",2016,3
Antonio Origlia,Cultural Heritage Presentations with a Humanoid Robot Using Implicit Feedback.,2016,3
Antonio Origlia,A simplified version of the OpS algorithm for pitch stylization,2014,3
Antonio Origlia,Dialogue Analysis with Graph Databases: Characterising Domain Items Usage for Movie Recommendations.,2021,2
Antonio Origlia,Establishing a Theoretical Background for a Museum-centric Entertainment System.,2017,2
Antonio Origlia,Designing Interactive Experiences to Explore Artwork Collections: a Multimedia Dialogue System Supporting Visits in Museum Exhibits.,2016,2
Antonio Origlia,WORDEN: a PYTHON interface to automatic (non) word generation,2015,2
Antonio Origlia,Syllable classification using static matrices and prosodic features,2010,2
Antonio Origlia,Phonetic variation and syllabic structures in Italian and German speech,2022,1
Antonio Origlia,AVI-CH 2022: workshop on advanced visual interfaces and interactions in cultural heritage,2022,1
Antonio Origlia,On the impact of location-related terms in neural embeddings for content similarity measures in cultural heritage recommender systems,2022,1
Antonio Origlia,A ROS Architecture for Personalised HRI with a Bartender Social Robot,2022,1
Antonio Origlia,3D Avatars and Semantic Models Annotations for Introductory Cultural Heritage Presentations.,2022,1
Antonio Origlia,Cutting melted butter? Common Ground inconsistencies management in dialogue systems using graph databases,2021,1
Antonio Origlia,Conflict Search Graph for Common Ground Consistency checks in Dialogue Systems,2021,1
Antonio Origlia,An adaptive neuro-fuzzy inference system for the qualitative study of perceptual prominence in linguistics,2017,1
Antonio Origlia,CHAPTER FOUR AUGMENTED REALITY WITHOUT BARRIERS: DEMATERIALIZING INTERFACES IN CULTURAL HERITAGE APPLICATIONS,2016,1
Antonio Origlia,Combining Energy and Cross-Entropy Analysis for Nuclear Segments Detection.,2016,1
Antonio Origlia,An analysis of perceptual cues in robot group selection tasks,2015,1
Antonio Origlia,Disentagling and Connecting Different Perspectives on Prosodic Prominence,2015,1
Antonio Origlia,Rhythm-Based Syllabic Stress Learning Without Labelled Data,2015,1
Antonio Origlia,Towards a Formal Approach to Generative Design: An Assistant System for the Creation of Artefact Models,2007,1
Antonio Origlia,"Though this be hesitant, yet there is method in’t: Effects of disfluency patterns in neural speech synthesis for cultural heritage presentations",2024,0
Antonio Origlia,BRILLO: Personalised HRI with a Bartender Robot,2024,0
Antonio Origlia,Exploring emergent syllables in end-to-end automatic speech recognizers through model explainability technique,2024,0
Antonio Origlia,A Bayesian Framework for Learning Proactive Robot Behaviour in Assistive Tasks,2024,0
Antonio Origlia,Increasing visitors attention with introductory portal technology to complex cultural sites,2023,0
Antonio Origlia,Monitoring Systems Design with Real Time Interactive 3D and Artificial Intelligence,2023,0
Antonio Origlia,Rail anomalies detection: A comparative analysis of three self-supervised models on real data,2023,0
Antonio Origlia,Modeling Hesitations. Speech Synthesis Application and Evaluation,2022,0
Antonio Origlia,Preface: AVI-CH 2022: Workshop on Advanced Visual Interfaces and Interactions in Cultural Heritage,2022,0
Antonio Origlia,Virtual Canova: a Digital Exhibition Across MANN and Hermitage Museums,2022,0
Antonio Origlia,CHROME Project: Representation and Survey for AI Development,2021,0
Antonio Origlia,Learning Between the Lines: Interactive Learning Modules Within Corpus Design,2021,0
Antonio Origlia,Acoustic experiences for cultural heritage sites: a pilot experiment on spontaneous visitors’ interest,2020,0
Antonio Origlia,Dynamic time warping and prosodic prominence,2018,0
Antonio Origlia,SCOPERTA SITI CULTURALI E OFFERTA DI PERCORSI EMOZIONALI CON RETI DI TECNOLOGIE AVANZATE,2018,0
Antonio Origlia,The gestures of the tourist guide and their communicative functions,2018,0
Antonio Origlia,Preface of 2nd workskhop on advanced visual interfaces for cultural heritage 2018 (AVI-CH 2018),2018,0
Antonio Origlia,Distributed Processes for Spoken Questions and Commands Understanding.,2017,0
Antonio Origlia,Graph Databases for Designing High-Performance Speech Recognition Grammars,2017,0
Antonio Origlia,Route of the Ελευθερία: a Design Exercise for Museum-Centric Entertainment Systems.,2017,0
Antonio Origlia,CHAPTER SIXTEEN FROM THEORY TO APPLICATIONS,2016,0
Antonio Origlia,PaSt: Human Tracking and Gestures Recognition for Flexible Virtual Environments Management,2016,0
Antonio Origlia,Syllable based speech analysis,2013,0
Antonio Origlia,IMITATION/SELF-IMITATION IN COMPUTER-ASSISTED PROSODY TRAINING FOR CHINESE LEARNERS OF L2 ITALIAN,2012,0
Antonio Origlia,W-PhAMT: A web tool for phonetic multilevel timeline visualization.,2012,0
Antonio Origlia,Multimodal Interaction with Emotional Feedback.,2012,0
Antonio Origlia,"Sillabificazione con l'ausilio di features relative a energia, pitch ed armonicità",2010,0
Antonio Origlia,CALCOLO DELLO SPEECH RATE MEDIANTE UN ALGORITMO DI RICERCA DI NUCLEI SILLABICI IN BASE AL PROFILO DELL'ENERGIA,2010,0
Antonio Origlia,Reducing hardware and software complexity in Eye-tracking techniques,2009,0
Antonio Origlia,Natural and Artificial Representation Issues in Artificial Intelligence-Towards a Formal Approach to Generative Design: An Assistant System for the Creation of Artefact Models,2007,0
Antonio Origlia,"Though this Be Hesitant, Yet There is Method in’T: Disfluencies in Neural Speech Synthesis",N/A,0
Antonio Origlia,A dialogue-based software architecture for gamified logopedic discrimination tests.,N/A,0
Antonio Origlia,Convolutional Neural Network With Adaptive Regularization to Classify Driving Styles on Smartphones.............,N/A,0
Antonio Origlia,CONDITIONAL RANDOM FIELDS COME STRUMENTO DI INDAGINE PER LA RILEVAZIONE AUTOMATICA DI PROMINENZE SILLABICHE,N/A,0
Antonio Origlia,Connected Digits Recognition Using a Syllable-Based ASR System,N/A,0
Frank Chun Yat Li,Virtual shelves: interactions with orientation aware devices,2009,150
Frank Chun Yat Li,The 1line keyboard: a QWERTY layout in a single line,2011,142
Frank Chun Yat Li,Virtual/augmented reality input device,2020,67
Frank Chun Yat Li,A SNP-Based Linkage Map Revealed QTLs for Resistance to Early and Late Leaf Spot Diseases in Peanut (Arachis hypogaea L.),2018,57
Frank Chun Yat Li,Leveraging proprioception to make mobile phones more accessible to users with visual impairments,2010,57
Frank Chun Yat Li,Combining gaze input and touch surface input for user interfaces in augmented and/or virtual reality,2019,44
Frank Chun Yat Li,Managing information display,2017,42
Frank Chun Yat Li,Systems and methods for performing multi-touch operations on a head-mountable device,2017,39
Frank Chun Yat Li,Design of unimanual multi-finger pie menu interaction,2011,38
Frank Chun Yat Li,Virtual reality/augmented reality handheld controller sensing,2020,33
Frank Chun Yat Li,Using head gesture and eye position to wake a head mounted device,2016,33
Frank Chun Yat Li,Combining gyromouse input and touch input for navigation in an augmented and/or virtual reality environment,2019,26
Frank Chun Yat Li,Systems and methods for performing multi-touch operations on a head-mountable device,2016,19
Frank Chun Yat Li,Methods and apparatus to align components in virtual reality environments,2019,18
Frank Chun Yat Li,Myngle: unifying and filtering web content for unplanned access between multiple personal devices,2011,18
Frank Chun Yat Li,Bluetooth multipoint algorithm and private notifications,2021,13
Frank Chun Yat Li,Tap to initiate a next action for user requests,2017,12
Frank Chun Yat Li,Effects of hand drift while typing on touchscreens,2013,11
Frank Chun Yat Li,"Methods, apparatuses, and computer program products for determination of the digit being used by a user to provide input",2015,8
Frank Chun Yat Li,Utilizing External Devices to Offload Text Entry on a Head Mountable Device,2015,8
Frank Chun Yat Li,Methods and apparatus to align components in virtual reality environments,2019,7
Frank Chun Yat Li,Entering Unlock Sequences Using Head Movements,2017,4
Frank Chun Yat Li,System and method for input device layout,2013,2
Frank Chun Yat Li,Auto-aligner for virtual reality display,2020,1
Frank Chun Yat Li,Bluetooth Multipoint Algorithm and Private Notifications,2023,0
Frank Chun Yat Li,Contextual Haptics for Wearable Devices,2020,0
Frank Chun Yat Li,Micro Touchpad for Wearables,2018,0
Frank Chun Yat Li,Distributed Physics Simulation with Stateless Server,2017,0
ann Lantz,User centered design—problems and possibilities: a summary of the 1998 PDC & CSCW workshop,1999,138
ann Lantz,"Meetings in a distributed group of experts: Comparing face-to-face, chat and collaborative virtual environments",2001,112
ann Lantz,Accessibility to electronic communication for people with cognitive disabilities: a systematic search and review of empirical evidence,2015,95
ann Lantz,Heavy users of electronic mail,1998,49
ann Lantz,Digitaliseringen och arbetsmiljön,2018,48
ann Lantz,Design versus design-from the shaping of products to the creation of user experiences,2003,41
ann Lantz,Digital arbetsmiljö,2015,35
ann Lantz,Does the use of e-mail change over time?,2003,30
ann Lantz,User participation when users have mental and cognitive disabilities,2015,28
ann Lantz,The glass box user model for filtering,1994,26
ann Lantz,Mutual capacity building through north-south collaboration using challenge-driven education,2019,20
ann Lantz,Interaction design as experienced by practitioners,2005,17
ann Lantz,The world wide Web as a social infrastructure for knowledge-oriented work,2003,13
ann Lantz,Connecting North and South through Challenge Driven Education,2018,11
ann Lantz,Cognitive accessibility for mentally disabled persons,2015,11
ann Lantz,Exploring the use of design pattern maps for aligning new technical support to new clinical team meeting routines,2013,11
ann Lantz,Medicine meets engineering in cooperative design of collaborative decision-supportive system,2010,11
ann Lantz,How to make user centred design usable,2001,11
ann Lantz,Understanding engineering education change with the introduction of challenge driven education in Tanzania,2018,9
ann Lantz,"The role of"" genre"" in the analysis of the use of videoconference systems at work",2002,8
ann Lantz,Computer mediated communication in a work context: an interdisciplinary approach,1996,8
ann Lantz,Interaction design in procurement: the view of procurers and interaction designers,2010,7
ann Lantz,Prototyping,2001,7
ann Lantz,How do experienced users of the system Usenet news select their information,1993,7
ann Lantz,Design management of interaction design,2008,6
ann Lantz,User oriented cooperative interaction design: a multidisciplinary project course,2006,6
