Author Name,Title,Year,Citations
Molly Q Feldman,MultiPL-E: A Scalable and Polyglot Approach to Benchmarking Neural Code Generation,2023,63
Molly Q Feldman,Automatic Diagnosis of Students' Misconceptions in K-8 Mathematics,2018,32
Molly Q Feldman,How We Write with Crowds,2021,19
Molly Q Feldman,Towards Answering “Am I on the Right Track?” Automatically using Program Synthesis,2019,19
Molly Q Feldman,StudentEval: A Benchmark of Student-Written Prompts for Large Language Models of Code,2023,15
Molly Q Feldman,How Beginning Programmers and Code LLMs (Mis) read Each Other,2024,1
Yansen Theopilus,Analisis Risiko Produk Alat Pelindung Diri (APD) Pencegah Penularan COVID-19 untuk Pekerja Informal di Indonesia,2020,106
Yansen Theopilus,Pengembangan kemasan makanan untuk menghasilkan user experience yang positif: Studi kasus pada salah satu UMKM makanan di Kota Bandung,2019,9
Yansen Theopilus,Customer experience analysis of cosmetics retail store on millennial women,2021,8
Yansen Theopilus,Persuasive-universal design model for creating user experience in product to solve behavior problems,2018,8
Yansen Theopilus,Development of A Special Material Handling Tool to Minimize Physical and Mental Workload of The Crank Case Production Operator on Motorcycle Manufacturing Factory in Indonesia,2018,5
Yansen Theopilus,Pemetaan kemasan produk UMKM,2018,4
Yansen Theopilus,Desain Interaksi: Fundamental dan Proses,2022,2
Yansen Theopilus,Eye Tracking Analysis of Airport Flight Information Display System (FIDS) to Improve The Information Search Efficiency,2020,2
Yansen Theopilus,Analisis Risiko Produk Alat Pelindung Diri (APD) Pencegahan Penularan COVID-19 Pekerja Infornal di Indonesia,2020,2
Yansen Theopilus,Pengembangan Sistem Persuasif pada Smartphone untuk Mengatasi Perilaku Kecanduang Smartphone pada Anak menggunakan Metode Design with Intent (DwI),2022,1
Yansen Theopilus,Development of Low-Cost Multi-Input Automated Storage and Retrieval System (AS/RS) for Educational Purposes,2020,1
Yansen Theopilus,"The Analysis and Recommendation of Size, Location, and Dynamic Element on Website Advertising Effectiveness Using Eye Tracking",2018,1
Yansen Theopilus,An Investigation on Eye Tracking Indicators to Detect Alertness on Inspection Jobs with Sleep Limits and Gender Differences,2023,0
Yansen Theopilus,ANALISIS INDIKATOR EYE TRACKING UNTUK MENDETEKSI KEWASPADAAN YANG DIPENGARUHI PEMBATASAN DURASI TIDUR DAN WAKTU PEMERIKSAAN,2023,0
Yansen Theopilus,The Effect of Sex Differences and Experience of Using Virtual Reality on Presence,2023,0
Yansen Theopilus,Development of Collapsible Motorcycle Helmet for Motorcycle Users in Indonesia,2023,0
Yansen Theopilus,Arduino-Based Development of Automatic Body Posture Measuring Device for Rapid Entire Body Assessment Method,2023,0
Yansen Theopilus,ANALISIS KINERJA BERDASARKAN PERBEDAAN REALITAS DAN TINGKAT KESULITAN TUGAS: STUDI KASUS PADA PERAKITAN REPETITIF,2023,0
Yansen Theopilus,Designing persuasive technology applications to solve human behavior problems: Enhancing better lifestyle on millennials,2023,0
Yansen Theopilus,Helm Lipat Ergonomis untuk Pengendara Sepeda Motor,2022,0
Yansen Theopilus,Paten Dan Kekayaan Intelektual,2022,0
Yansen Theopilus,Analysis of Customer Preferences and Satisfaction of Video Conferencing Applications for Productive Activities Using Kano Model,2021,0
Yansen Theopilus,Alat Pelindung diri Portabel Untuk Keselamatan Penumpang Kendaraan Umum,2021,0
Yansen Theopilus,Belajar Teknik Industri – Biomekanika Kerja,2021,0
Yansen Theopilus,Belajar Teknik Industri – Sampling Pekerjaan,2021,0
Yansen Theopilus,Belajar Teknik Industri - Pengukuran Waktu Standar Kerja,2021,0
Yansen Theopilus,Development Of a Persuasive and Universal Wearable Device to Promote Healthy Behavior and Enhance Exercise Self-Efficacy,2021,0
Yansen Theopilus,Modul Perancangan Kemasan Makanan Dan Minuman Untuk UMKM,2020,0
Yansen Theopilus,Perancangan Kemasan Makanan Dan Minuman Untuk UMKM,2020,0
Yansen Theopilus,Pengembangan Participatory Coaching Pelaku UMKM Berdasarkan Pendekatan Service Experience: Studi pada UMKM Binaan Kota Bandung,2019,0
Yansen Theopilus,Analisis Customer Experience Wanita Milenial Pada Retail Kosmetik X Menggunakan Eye Tracking Dan In-Depth Interview,2019,0
Yansen Theopilus,Pendampingan UMKM Kadin Kota Bandung untuk merancang kemasan produk,2019,0
Yansen Theopilus,Personal Home Device Development to Support Elderly with Dementia to Live Independently,2018,0
Yansen Theopilus,Perangkat Personal Penunjang Lansia yang Mengalami Demensia untuk Hidup Mandiri,2018,0
Yansen Theopilus,Perancangan alat penunjang olahraga persuasif yang universal untuk menunjang perilaku berolahraga secara teratur,2018,0
Tarfah Alrashed,An observational study of usability in collaborative tangible interfaces for complex planning systems,2015,35
Tarfah Alrashed,The lifetime of email messages: A large-scale analysis of email revisitation,2018,31
Tarfah Alrashed,Perception of speaker personality traits using speech signals,2018,28
Tarfah Alrashed,Scrapir: making web data apis accessible to end users,2020,18
Tarfah Alrashed,Dataset or Not? A study on the veracity of semantic markup for dataset pages,2021,9
Tarfah Alrashed,Evaluating user actions as a proxy for email significance,2019,9
Tarfah Alrashed,Extending a reactive expression language with data update actions for end-user application authoring,2018,5
Tarfah Alrashed,Wikxhibit: Using HTML and Wikidata to Author Applications that Link Data Across the Web,2022,3
Tarfah Alrashed,Shapir: standardizing and democratizing access to web APIs,2021,3
Tarfah Alrashed,Prototyping Complex Systems: A Diary Study Approach to Understand the Design Process,2016,2
Tarfah Alrashed,Collaborative Tangible Interface (CoTI) for Complex Decision Support Systems,2015,2
Tarfah Alrashed,Discovering datasets on the web scale: Challenges and recommendations for Google Dataset Search,2024,1
Tarfah Alrashed,Visual exploration patterns in information visualizations: Insights from eye tracking,2017,1
Tarfah Alrashed,Social communities in urban mobility systems,2016,1
Tarfah Alrashed,Coding Schemes for Observational Studies of Usability in Collaborative Tangible User Interfaces,2015,1
Tarfah Alrashed,Systems to Democratize and Standardize Access to Web APIs,2021,0
Jaemarie Solyst,“It feels like I am talking into a void”: Understanding interaction gaps in synchronous online classrooms,2021,53
Jaemarie Solyst,Engaging students with instructor solutions in online programming homework,2020,16
Jaemarie Solyst,Peer-designed active learning modules as a strategy to improve confidence and comprehension within introductory computer science,2020,8
Jaemarie Solyst,“I Would Like to Design”: Black Girls Analyzing and Ideating Fair and Accountable AI,2023,7
Jaemarie Solyst,“I Want to Be Unique From Other Robots”: Positioning Girls as Co-creators of Social Robots in Culturally-Responsive Computing Education,2023,7
Jaemarie Solyst,Procrastination and gaming in an online homework system of an inverted CS1,2021,7
Jaemarie Solyst,Investigating Girls’ Perspectives and Knowledge Gaps on Ethics and Fairness in Artificial Intelligence in a Lightweight Workshop,2022,6
Jaemarie Solyst,Exploring additional personalized support while attempting exercise problems in online learning platforms,2021,6
Jaemarie Solyst,The design of co-robotic games for computer science education,2021,5
Jaemarie Solyst,Unwritten magic: Participatory design of AI Dialogue to empower marginalized voices,2022,4
Jaemarie Solyst,Agentic Engagement with a Programmable Dialog System,2021,4
Jaemarie Solyst,Running an Online Synchronous Culturally Responsive Computing Camp for Middle School Girls,2022,3
Jaemarie Solyst,"""It is the Future"": Exploring Parent Perspectives of CS Education",2022,3
Jaemarie Solyst,Characterizing and influencing students' tendency to write self-explanations in online homework,2020,3
Jaemarie Solyst,Engaging Students with Instructor Solutions in Online Programming Homework,2020,3
Jaemarie Solyst,Explaining Engagement: Learner Behaviors in a Virtual Coding Camp,2021,2
Jaemarie Solyst,Negotiating Systemic Racial and Gender Bias as a Minoritized Adult Design Researcher.,2021,2
Jaemarie Solyst,"It Feels Like I Am Talking into a Void”: Understanding Interaction Gaps in Synchronous Online Classrooms. Association for Computing Machinery, New York, NY, USA, 1–9",2021,2
Jaemarie Solyst,The Potential of Diverse Youth as Stakeholders in Identifying and Mitigating Algorithmic Bias for a Future of Fairer AI,2023,1
Jaemarie Solyst,“What's Your Name Again?”: How Race and Gender Dynamics Impact Codesign Processes and Output,2023,1
Jaemarie Solyst,“I'm a little less inclined to do it”: How Afterschool Programs’ Culture Impact Co-Design Processes and Outcomes,2023,1
Jaemarie Solyst,"Making Sense of Machine Learning: Integrating Youth's Conceptual, Creative, and Critical Understandings of AI",2023,1
Jaemarie Solyst,Booklet-Based Design Fiction to Support AI Literacy,2023,1
Jaemarie Solyst,Understanding Instructors' Cultivation of Connectedness in K-12 Online Synchronous Culturally Responsive STEM and Computing Education,2022,1
Jaemarie Solyst,Data Detectives: A Tabletop Card Game About Training Data,2022,1
Jaemarie Solyst,Insights from Virtual Culturally Responsive Computing Camps,2022,1
Jaemarie Solyst,Culturally Responsive Personalized Learning: Recommendations for a Working Definition and Framework,2023,0
Jaemarie Solyst,Comparative Design-Based Research: How Afterschool Programs Impact Learners' Engagement with a Video Game Codesign,2023,0
Jaemarie Solyst,Intergenerational Games to Learn About AI and Ethics,2023,0
Jaemarie Solyst,Negotiating Systemic Racial and Gender Bias as a Minoritized Adult Design Researcher,2021,0
Jaemarie Solyst,Investigating the impact of social and biological cues in children's perception of humanoid robots.,2020,0
Jaemarie Solyst,The instructor reads what you write: Encouraging introductory programming students to engage in self-explanation online,2019,0
Jaemarie Solyst,Redundant Persistent Acyclic Formations for Vision-Based Control of Distributed Multi-Agent Formations,2019,0
Diyi Liu,Social bots’ sentiment engagement in health emergencies: A topic-based analysis of the COVID-19 pandemic discussions on Twitter,2020,78
Diyi Liu,An examination of factors contributing to the acceptance of online health misinformation,2021,69
Diyi Liu,How to Obtain Social Support in Online Support Forums? The Effects of Structural Social Capital and Politeness Principle,2021,2
Diyi Liu,Attracting Effective Support on Social Networking Sites: Examining Three Characteristics of Online Support-Seeking Messages,2023,0
Diyi Liu,From Monologue to Dialogue: Reimagining Intercultural Communication Studies in the Context of the Belt and Road Initiative,2022,0
"Oluyemi Folorunso Ayanbode, PhD",Use of indigenous knowledge by rural women in the development of Ogun State: agriculture and food production,2008,54
"Oluyemi Folorunso Ayanbode, PhD",Use of indigenous knowledge by women in a Nigerian rural community,2009,43
"Oluyemi Folorunso Ayanbode, PhD","Students’ interactions, satisfaction and perceived progress in an online class: Empirical evidence from Babcock university Nigeria",2022,20
"Oluyemi Folorunso Ayanbode, PhD",Collaborative Technologies and Knowledge Management in Psychiatric Hospitals in South West Nigeria,2020,18
"Oluyemi Folorunso Ayanbode, PhD",Library Digitisation: A Strategy to Bridge Information and Knowledge Divides,2011,7
"Oluyemi Folorunso Ayanbode, PhD","Librarians’ Management of COVID-19 Information Glut on Social Media: A Study of Information Censorship, Evaluation, Use and Dissemination in Ogun State, Nigeria",2021,4
"Oluyemi Folorunso Ayanbode, PhD",Use of Collaborative Technologies for Knowledge Management in Psychiatric Hospitals in Southwest Nigeria.,2019,3
"Oluyemi Folorunso Ayanbode, PhD","19 Knowledge Management Strategies in Clinical Settings, Southwest Nigeria",2023,0
"Oluyemi Folorunso Ayanbode, PhD",Perceived Superiority Complex and Interpersonal Relationships in  Medical Libraries in Nigeria: Confirmatory Factor Analysis  Approach,2023,0
"Oluyemi Folorunso Ayanbode, PhD",Preferences and Motivations of Nigerian Undergraduates in Sharing COVID-19 Information on Social Media,2022,0
"Oluyemi Folorunso Ayanbode, PhD","Optimizing New Technologies, Knowledge Management and Service Delivery in Public Libraries",2022,0
"Oluyemi Folorunso Ayanbode, PhD","Use of Satire, Music and Comedy for Sharing COVID-19 Information on Social Media by Nigeria Undergraduates",2021,0
"Oluyemi Folorunso Ayanbode, PhD",Effects of Perception of Collaborative Technologies on Knowledge Creation and Socialisation among Psychiatric Nurses in Southwest Nigeria,2020,0
"Oluyemi Folorunso Ayanbode, PhD","Therapeutic Impact of Harnessing Library Info resources on the  Rehabilitation of Persons with Substance Misuse at Neuropsychiatric Hospital Aro Abeokuta, Nigeria: a Road to …",2012,0
"Oluyemi Folorunso Ayanbode, PhD",AGRICULTURE AND FOOD PRODUCTION,2008,0
Sonia Wilkie,Considerations For Designing H5P Online Interactive Activities,2018,38
Sonia Wilkie,Who are the women authors in NIME?—improving gender balance in NIME research,2018,26
Sonia Wilkie,Implementing H5P online interactive activities at scale,2021,15
Sonia Wilkie,Integration of H5P Online Learning Activities to Increase Student Success,2017,9
Sonia Wilkie,The effect of audio cues and sound source stimuli on the perception of approaching objects,2020,8
Sonia Wilkie,Surround Sound Using Variable-Ambisonics and Variable-Polar Pattern Theories,2012,7
Sonia Wilkie,The Perception of Auditory-visual Looming in Film,2012,7
Sonia Wilkie,Psychoacoustic manipulation of the sound-induced illusory flash,2008,6
Sonia Wilkie,Applications for virtual reality experiences in tertiary education,2020,5
Sonia Wilkie,Transforming Lectures to (H5P) Online Interactive Activities,2018,5
Sonia Wilkie,The effect of audio cues and sound source stimuli on looming perception.,2015,4
Sonia Wilkie,Improving staff capacity to support student learning in the digital age,2017,3
Sonia Wilkie,A User-assisted Approach to Multiple Instrument Music Transcription,2014,3
Sonia Wilkie,Listening for noise: An approach to percussive onset detection,2008,3
Sonia Wilkie,Computer Music Modeling and Retrieval,2008,3
Sonia Wilkie,"Perception of objects that move in depth, using ecologically valid audio cues",2018,2
Sonia Wilkie,Amplitude Manipulation For Perceived Movement In Depth,2012,2
Sonia Wilkie,Engaging staff with program redesign and blended learning in two large scale institutional projects,2019,1
Sonia Wilkie,From Sounds to Music and Emotions,2013,1
Sonia Wilkie,ePortfolio as part of a new method of assessment to meet the needs of the Block Model across units and years,2018,0
Sonia Wilkie,Transforming Lectures to (H5P) Online Interactive Activities,2018,0
Sonia Wilkie,ePortfolio as a method of assessment,2018,0
Sonia Wilkie,H5P Online Interactive Activities Provide an Alternative to Lectures,2018,0
Sonia Wilkie,ePortfolio as a method of assessment to transition students through the Block Model,2018,0
Sonia Wilkie,Technology in Tertiary Eduction - Sports Science,2018,0
Sonia Wilkie,H5P Online Interactive Activities Provide An Alternative To Lectures,2018,0
Sonia Wilkie,H5P Online Learning Activities for the Flipped Classroom Model,2017,0
Sonia Wilkie,STEM education and Brightspace: Investigating digital tools,2017,0
Sonia Wilkie,ePortfolio as an Authentic Assessment Tool,2017,0
Sonia Wilkie,NIME 2016-Committee,2016,0
Sonia Wilkie,ICME WORKSHOPS 2012,2012,0
Sonia Wilkie,Auditory manipulation of visual perception,2008,0
Sonia Wilkie,Pitch Interval and Perceived Spatialisation of the Sound Induced Illusory Flash,2007,0
Sonia Wilkie,Sonia Wilkie,2007,0
Sonia Wilkie,"Tristramn Cary: Rhyme of the Flying Bomb, and Steam Music",2005,0
Sonia Wilkie,Electronic Music Unit-Elder Conservatorium of Music,2001,0
Kyle Boyd,Chatbots to support mental wellbeing of people living in rural areas: can user groups contribute to co-design?,2021,32
Kyle Boyd,A usability protocol for evaluating online social networks,2012,15
Kyle Boyd,Easisocial: an innovative way of increasing adoption of social media in older people,2015,14
Kyle Boyd,An investigation into the usability of the STAR training and re-skilling website for carers of persons with dementia,2014,13
Kyle Boyd,Digital reminiscence app co‐created by people living with dementia and carers: Usability and eye gaze analysis,2021,10
Kyle Boyd,Eye tracking in the assessment of electrocardiogram interpretation techniques,2012,10
Kyle Boyd,"How people judge the usability of a desktop graphic user interface at different time points: Is there evidence for memory decay, recall bias or temporal bias?",2019,7
Kyle Boyd,Investigating methods for increasing the adoption of social media amongst carers for the elderly,2014,7
Kyle Boyd,A multilingual digital mental health and well-being Chatbot (ChatPal): pre-post multicenter intervention study,2023,6
Kyle Boyd,"Comparing single-page, multipage, and conversational digital forms in health care: Usability study",2021,6
Kyle Boyd,Can micro interactions in user interfaces affect their perceived usability?,2021,6
Kyle Boyd,Insights and lessons learned from trialling a mental health chatbot in the wild,2021,4
Kyle Boyd,EasiSocial: Recommendations in the development and training of social media tools for older people.,2018,4
Kyle Boyd,Usability testing and trust analysis of a mental health and wellbeing chatbot,2022,3
Kyle Boyd,Usability and behaviour analysis of prisoners using an interactive technology to manage daily living,2017,3
Kyle Boyd,Interaction and Service Design of a Virtual Health Hub for Patients with Cardiovascular Disease,2023,2
Kyle Boyd,Can users recall their user experience with a technology? Temporal bias and the system usability scale.,2018,2
Kyle Boyd,UX-handle: a cloud-based system to streamline usability testing analytics,2017,2
Kyle Boyd,Toolkit for the co-creation of health-based chatbots,2022,1
Kyle Boyd,Incorporation of carer and patient needs in the development of assistive technology for people with dementia,2011,1
Kyle Boyd,"Measuring the Quality and Impact of 3D Medical Printing in Surgical Planning, Procedures and Communications using Product Usefulness Surveys",2024,0
Kyle Boyd,Community level digital mental health interventions: A policy and practice brief,2024,0
Kyle Boyd,Exploring the Variability of Human Factors and Usability Testing Methods for Evaluating Medical Devices-Preliminary Results,2023,0
Kyle Boyd,Designing Multimodal Video Search by Examples (MVSE) user interfaces: UX requirements elicitation and insights from semi-structured interviews,2023,0
Kyle Boyd,The InspireD reminiscence app..... a more personalised reminiscence experience for people living with dementia and their carers,2023,0
Kyle Boyd,Hidden in Plain Sight: Discreet User Interfaces,2023,0
Kyle Boyd,User testing of a prototype six degrees of freedom (6DoF) Virtual Reality (VR) experience by expert user groups.,2023,0
Kyle Boyd,A study protocol to measure the variability of user testing methods in the medical device industry,2023,0
Kyle Boyd,"Understanding User Acceptance, Inclusion, and the Societal Impact of Digital Health Technologies",2023,0
Kyle Boyd,Proceedings of the 15th Irish Human Computer Interaction Symposium,2023,0
Kyle Boyd,Designing Multimodal Video Search by Examples (MVSE) user interfaces: elicitation of UX requirements and insights from semi-structured interviews,2023,0
Kyle Boyd,Design Exchange Partnership Forum: Interaction and service design of a virtual health hub for patients with cardiovascular disease,2022,0
Kyle Boyd,The InspireD Reminiscence App-A more personalised reminiscence experience for people living with dementia and their carers,2022,0
Kyle Boyd,The InspireD App: Individual Specific Reminiscence in Dementia.,2022,0
Kyle Boyd,Teaching Nexus Toolkit,2022,0
Kyle Boyd,The InspireD Reminiscence App,2022,0
Kyle Boyd,Correction to: Chatbots to Support Mental Wellbeing of People Living in Rural Areas: Can User Groups Contribute to Co‑design?,2021,0
Kyle Boyd,The InspireD Reminiscence App to Support People Living with Dementia,2021,0
Kyle Boyd,"Digital Forms in Healthcare: Comparing the Usability of Single-Page, Multi-Page and Conversational Forms",2021,0
Kyle Boyd,INCORPORATIONOFCARERANDPATIENTNEEDS INTHE DEVELOPMENTOFASSISTIVETECHNOLOGYFOR PEOPLEWITHDEMENTIA,2017,0
Kyle Boyd,Interactive technology solutions for prisoners: an environment where sub-optimal user interfaces can have significant impact?,2016,0
Kyle Boyd,An investigation into improving the usability of social media for older users and their carers,2014,0
Kyle Boyd,Opportunities and Challenges for supporting people with Vascular Dementia through the use of common Web 2.0 services,2014,0
Kyle Boyd,Methods of Increasing Adoption of Social Media Among Elderly Carers,2013,0
Kyle Boyd,Methods of Increasing Adoption of Social Media Among Elderly Carers,2013,0
Kyle Boyd,Conference-Based Usability Evaluation Methodology for Medical Web Applications,2013,0
Loai F. Al-Zoua’bi,Usability of the academic websites of Jordan's universities an evaluation study,2008,146
Loai F. Al-Zoua’bi,Bilingual Text-Based Image Retrieval Using PDA's(BTBIRUP),2010,2
Uwe Oestermeier,Verbal and visual causal arguments,2000,101
Uwe Oestermeier,Singular and general causal arguments,2001,10
Uwe Oestermeier,Organizing and externalizing activity structures in distributed settings,2003,8
Uwe Oestermeier,Begriffliche und empirische Fragen der Kausalkognition,1997,7
Uwe Oestermeier,Bildliches und logisches Denken: eine Kritik der Computertheorie des Geistes,2013,6
Uwe Oestermeier,"Repräsentation, mentale",1995,6
Uwe Oestermeier,"Neue Medien, neue Forschungsinitiativen",2000,3
Uwe Oestermeier,Der Einsatz von BSCW im Virtuellen Graduiertenkolleg–„Wissenserwerb und Wissensaustausch mit neuen Medien “,2003,2
Uwe Oestermeier,VANOVA–Interactive Visualizations of the Analysis of Variance,2013,1
Uwe Oestermeier,Interdisciplinary perspectives on causation,2001,1
Uwe Oestermeier,The mathematisation of the sciences and the observability of causal relations,2001,1
Uwe Oestermeier,Die Computertheorie des Geistes,1998,1
Uwe Oestermeier,Psychologische Theorien des logischen Schliessens,1991,1
Uwe Oestermeier,Copyright@ 2001 Bern Studies in the History and Philosophy of Science,2001,0
Uwe Oestermeier,New Media—New Research Initiatives,2000,0
Uwe Oestermeier,"Branigan, HP, B13",2000,0
Uwe Oestermeier,Forschungszentrum Informationstechnik GmbH Schloß Birlinghoven D-53754 Sankt Augustin Germany Telefon+ 49-2241-14-0,1999,0
Uwe Oestermeier,Thematik und Ablauf des Workshops,1999,0
Uwe Oestermeier,Theorien mentaler Repräsentation von Demokrit bis Kant,1998,0
Uwe Oestermeier,Visuelle kausale Argumente,1998,0
Uwe Oestermeier,Logisches Denken,1998,0
Uwe Oestermeier,Die Psychologismusdebatte,1998,0
Uwe Oestermeier,Anschauliches Schließen,1998,0
Uwe Oestermeier,Fazit,1998,0
Uwe Oestermeier,Semiotische Präliminarien,1998,0
Uwe Oestermeier,Bildliches Vorstellen,1998,0
Uwe Oestermeier,Die Ähnlichkeitstheorie der bildlichen Darstellung,1998,0
Uwe Oestermeier,Von der Erfindung der Schrift bis zu logischen Kalkülen,1998,0
Uwe Oestermeier,Conceptual and empirical questions of causal cognition,1997,0
Uwe Oestermeier,"Copyright G2001 Bern Studies in the History and Philosophy of Science Editor: Gerd Graßhoff, Bern",N/A,0
Uwe Oestermeier,Workshop Kausalität,N/A,0
Hussain M. Aljaroodi,Avatars and embodied agents in experimental information systems research: A systematic review and conceptual framework,2019,42
Hussain M. Aljaroodi,Effects of in-store live stream on consumers’ offline purchase intention,2023,34
Hussain M. Aljaroodi,Exploring the design of avatars for users from Arabian culture through a hybrid approach of deductive and inductive reasoning,2020,25
Hussain M. Aljaroodi,Empathic avatars in stroke rehabilitation: A co-designed mHealth artifact for stroke survivors,2017,25
Hussain M. Aljaroodi,Understanding the importance of cultural appropriateness for user interface design: an Avatar study,2023,12
Hussain M. Aljaroodi,Designing Persuasive Avatars in mHealth for Arabic Culture: A Qualitative Study,2017,4
Hussain M. Aljaroodi,Live Stream Influencer Marketing on Consumers' Offline Purchase Intention: A Quantitative Study.,2021,3
Hussain M. Aljaroodi,Systems Design and Interpersonal Dimensions in Technostress,2016,3
Hussain M. Aljaroodi,Work-in-Progress: Investigating intention to use virtual environments using Technology Readiness Index: A quantitative study in Saudi Arabia,2023,0
Simran Chopra,Negotiating sustainable futures in communities through participatory speculative design and experiments in living,2022,30
Simran Chopra,"Co-creating"" Smart"" sustainable food futures with urban food growers",2019,30
Simran Chopra,Towards a responsible innovation agenda for HCI,2019,26
Simran Chopra,Towards a responsible innovation agenda for HCI,2019,26
Simran Chopra,Feminist voices about ecological issues in HCI,2022,16
Simran Chopra,My phone assistant should know I am an Indian: influencing factors for adoption of assistive agents,2017,15
Simran Chopra,HCI for participatory futuring in sustainable communities: Reconciling visions with everyday practice,2019,10
Simran Chopra,How do I communicate my emotions on SNS and IMs?,2016,8
Simran Chopra,Codefruits: Teaching computational thinking skills through hand gestures,2017,7
Simran Chopra,Infrastructuring ecological sustainability through multi-scalar speculations,2022,3
Simran Chopra,Field immersion on fitness activities in urban India,2016,2
Simran Chopra,Bottom-up visions for future of food growing in cities,2023,1
Simran Chopra,Food as a Feminist Issue,2024,0
