Author Name,Title,Year,Citations
Maurizio Caon,Context-aware multimodal sharing of emotions,2013,7
Maurizio Caon,Functional gestures for human-environment interaction,2013,7
Maurizio Caon,"Codesign of public spaces for intercultural communication, diversity and inclusion",2020,6
Maurizio Caon,Teenagers’ Usage of a Mobile-Wearable-Cloud Platform to Promote Healthy Lifestyles: the PEGASO Experience*,2018,6
Maurizio Caon,Towards an engaging mobile food record for teenagers,2015,6
Maurizio Caon,An anthropomorphic lamp for the communication of emotions,2014,6
Maurizio Caon,Atelier of smart garments and accessories,2014,6
Maurizio Caon,Atelier of smart garments and accessories: second edition,2014,6
Maurizio Caon,Cheer for me: effect of non-player character audience feedback on older adult users of virtual reality exergames,2023,5
Maurizio Caon,A novel actuating–sensing bone conduction-based system for active hand pose sensing and material densities evaluation through hand touch,2021,5
Maurizio Caon,Seniors’ perception of smart speakers: challenges and opportunities elicited in the silver&home living lab,2021,5
Maurizio Caon,Design of an ergonomic gestural interface for professional road cycling,2020,5
Maurizio Caon,Gesturing on the handlebar: a user-elicitation study for on-bike gestural interaction,2018,5
Maurizio Caon,PEGASO companion: a mobile app to promote healthy lifestyles among adolescents,2017,5
Maurizio Caon,Third workshop on full-body and multisensory experience,2016,5
Maurizio Caon,We are super-humans: Towards a democratisation of the socio-ethical debate on augmented humanity,2016,5
Maurizio Caon,Tailoring motivational mechanisms to engage teenagers in healthy life-style: A concept,2014,5
Maurizio Caon,Towards an AI-based tailored training planning for road cyclists: a case study,2020,4
Maurizio Caon,Ubiquitous Chatbots: Workshop on Wearable and Embodied Conversational Agents,2018,4
Maurizio Caon,Designing systems in the digital immortality era,2018,4
Maurizio Caon,Tangible interaction with light in the IoT,2016,4
Maurizio Caon,Towards individualised persuasive technology for obesity prevention in teenagers,2014,4
Maurizio Caon,My pain coach: A mobile system with tangible interface for pain assessment,2018,3
Maurizio Caon,Towards cross-generational system design,2018,3
Maurizio Caon,Second Workshop on Full-Body and Multisensory Experience,2016,3
Maurizio Caon,Kinesiologic electromyography for activity recognition,2013,3
Maurizio Caon,Democratizing 3D dynamic gestures recognition,2013,3
Maurizio Caon,Exploring the impact of commercial wearable activity trackers on body awareness and body representations: A mixed-methods study on self-tracking,2024,2
Maurizio Caon,Co-designing an embodied e-coach with older adults: the tangible coach journey,2023,2
Maurizio Caon,Building trust and companionship in e-coaching through embodiment,2021,2
Maurizio Caon,Wearables in Healthcare,2021,2
Maurizio Caon,Enriching the user experience of a connected car with quantified self,2020,2
Maurizio Caon,A personalised virtual coach to counteract ageing decline: The H2020 NESTORE project,2019,2
Maurizio Caon,Enhancing toward the last universal common descendant,2018,2
Maurizio Caon,The NESTORE Project: Co-Designing a Virtual Coach with Older Adults,2018,2
Maurizio Caon,Integration of BCTs in a Companion App to Support and Motivate Teenagers in the Adoption of Healthy Lifestyle Behaviours,2016,2
Maurizio Caon,Optimization of an electromyography-based activity recognition system,2013,2
Maurizio Caon,Etude exploratoire d'un assistant digital d'aide au montage basé sur la projection en réalité augmentée,2022,1
Maurizio Caon,Etude exploratoire d’un assistant digital d’aide au montage basé sur la projection en réalité augmentée: An Exploratory Study of a Projection-based Augmented Reality Digital …,2022,1
Maurizio Caon,"The NESTORE e-coach: designing a multi-domain pathway to well-being in older age. Technologies 2022, 10, 50",2022,1
Maurizio Caon,An Ecological Monitoring and Management App (EMMA) for Older Adults With Chronic Pain: Protocol for a Design and Feasibility Study,2021,1
Maurizio Caon,Opportunities and challenges of digital technologies for inclusion,2021,1
Maurizio Caon,Inclusion design and functionalities of a personalized virtual coach for wellbeing to facilitate a universal access for older adults,2021,1
Maurizio Caon,The antecedents and outcomes of AI adoption in SMEs,2019,1
Maurizio Caon,A mobile serious game fostering healthy eating habits,2017,1
Maurizio Caon,Investigating How to Measure Mobile User Engagement,2017,1
Maurizio Caon,Designing a mobile serious game to promote healthy lifestyles: motivating teenagers to adopt healthy habits through play,2016,1
Maurizio Caon,Smart garments and accessories for healthy lifestyles,2015,1
Maurizio Caon,"Gesturing on the steering wheel, a comparison with speech and touch interaction modalities",2015,1
Maurizio Caon,Multi-user pointing and gesture interaction for large screen using infrared emitters and accelerometers,2011,1
Maurizio Caon,Backward-compatible robust error protection of JPEG XR compressed video,2010,1
Maurizio Caon,12th International Workshop on Intelligent Environments Supporting Healthcare and Well-Being (WISHWell’2023),2023,0
Maurizio Caon,"Correction to: Promoting healthy teenage behaviour across three European countries through the use of a novel smartphone technology platform, PEGASO fit for future: study …",2021,0
Maurizio Caon,Coaching Older Adults Towards a Healthier Lifestyle: Psychological and Technological Methods,2021,0
Maurizio Caon,A Study on the Acceptance Towards Blockchain-Based Access to Biobanks’ Services Using UTAUT2 with ITM and Perceived Risk,2021,0
Maurizio Caon,A study on the acceptance towards blockchain-based access to biobanks’ services using UTAUT2 with ITM and perceived risk,2021,0
Maurizio Caon,"Protection des données: consentement, devoir d'informer et utilisation de pictogrammes",2021,0
Maurizio Caon,Conversational Agents for Health and Well-being Across the Life Course,2021,0
Maurizio Caon,Comparing the ergonomics of gestural interfaces while running on a treadmill,2020,0
Maurizio Caon,Designing systems for the digital immortality of intangible cultural heritage,2020,0
Maurizio Caon,Towards the Design of Digital Immortality,2019,0
Maurizio Caon,Utilizzare il design partecipativo per l'innovazione sostenibile,2018,0
Maurizio Caon,Ubiquitous Chatbots,2018,0
Maurizio Caon,Gesturing on the handlebar,2018,0
Maurizio Caon,My pain coach,2018,0
Maurizio Caon,Leveraging Participatory Design for Sustainable Innovation,2018,0
Maurizio Caon,Eudaimonic gamification to engage cancer patients in positive coping strategies,2018,0
Maurizio Caon,Psychisches Wohlbefinden im Alter/Bien-être psychologique avec l'âge,2017,0
Maurizio Caon,Bien-être psychologique avec l'âge,2017,0
Maurizio Caon,La Fenêtre Interactive Tangible,2016,0
Maurizio Caon,Multi-sensory EmotiPlant,2016,0
Maurizio Caon,Workshop on full-body and multisensory experience in ubiquitous interaction,2015,0
Maurizio Caon,Engaging Community for Participatory Design,2015,0
Maurizio Caon,A Smartphone Application to Promote Affective Interaction and Mental Health,2015,0
Maurizio Caon,Context-aware gestural interaction in the smart environments of the ubiquitous computing era,2014,0
Maurizio Caon,Testing the Tangible Interactive Window with Older Adults: Towards an Accessible Video-Communication System to Fight Social Isolation,N/A,0
Maurizio Caon,Session details: Wearable Technologies for Automotive User Interfaces: Danger or Opportunity?,N/A,0
Maurizio Caon,Session details: Tangible interaction with light in the IoT,N/A,0
Maurizio Caon,Session details: 3rd workshop on full-body and multisensory experience,N/A,0
Maurizio Caon,Improving vehicular user experience through context-aware multimodal interaction,N/A,0
Maurizio Caon,"Damak M., 377",N/A,0
Aaron L. Gardony,"Differential cognitive effects of energy drink ingredients: caffeine, taurine, and glucose",2012,226
Aaron L. Gardony,How navigational aids impair spatial memory: Evidence for divided attention,2013,157
Aaron L. Gardony,Gardony Map Drawing Analyzer: Software for quantitative analysis of sketch maps,2016,104
Aaron L. Gardony,Body-specific representations of spatial location,2012,87
Aaron L. Gardony,North is up (hill): Route planning heuristics in real-world environments,2010,84
Aaron L. Gardony,Navigational aids and spatial memory impairment: The role of divided attention,2015,83
Aaron L. Gardony,Think3d!: Improving mathematics learning through embodied spatial training,2017,78
Aaron L. Gardony,Eye tracking measures of uncertainty during perceptual decision making,2017,69
Aaron L. Gardony,Going to town: Visualized perspectives and navigation through virtual environments,2012,56
Aaron L. Gardony,What does physical rotation reveal about mental rotation?,2014,50
Aaron L. Gardony,Spatial decision dynamics during wayfinding: Intersections prompt the decision-making process,2018,49
Aaron L. Gardony,Elementary teachers’ attitudes and beliefs about spatial thinking and mathematics,2020,45
Aaron L. Gardony,Cognitive strategies in the mental rotation task revealed by EEG spectral power,2017,43
Aaron L. Gardony,Affective states influence spatial cue utilization during navigation,2011,39
Aaron L. Gardony,"Where did it come from, where do you go? Direction sources influence navigation decisions during spatial uncertainty",2015,38
Aaron L. Gardony,Direct current brain stimulation enhances navigation efficiency in individuals with low spatial sense of direction,2014,37
Aaron L. Gardony,Interaction strategies for effective augmented reality geo-visualization: Insights from spatial cognition,2021,30
Aaron L. Gardony,Stepping into a map: Initial heading direction influences spatial memory flexibility,2014,26
Aaron L. Gardony,Eye-tracking for human-centered mixed reality: promises and challenges,2020,24
Aaron L. Gardony,Iseecolor: method for advanced visual analytics of eye tracking data,2020,22
Aaron L. Gardony,Get in my belly: food preferences trigger approach and avoidant postural asymmetries,2013,20
Aaron L. Gardony,Retrieval practice enhances near but not far transfer of spatial memory.,2020,16
Aaron L. Gardony,Knowing when to fold'em: Problem attributes and strategy differences in the Paper Folding test,2019,16
Aaron L. Gardony,When the response does not match the threat: The relationship between threat assessment and behavioural response in ambiguous lethal force decision-making,2021,11
Aaron L. Gardony,Make-A-Dice Test: Assessing the intersection of mathematical and spatial thinking,2019,11
Aaron L. Gardony,Targeted right medial temporal lobe tDCS and associative spatial and non-spatial memory,2018,10
Aaron L. Gardony,Exploring the impact of network impairments on remote collaborative augmented reality applications,2019,9
Aaron L. Gardony,Characterizing the cognitive impact of tangible augmented reality,2019,9
Aaron L. Gardony,Investigating a virtual reality based subterranean scenario examining augmented reality implications for military operators,2021,8
Aaron L. Gardony,The Effects of Network Outages on User Experience in Augmented Reality Based Remote Collaboration-An Empirical Study,2021,7
Aaron L. Gardony,Cognitive focus affects spatial decisions under conditions of uncertainty,2020,4
Aaron L. Gardony,Gaze depth estimation for eye-tracking systems,2023,2
Aaron L. Gardony,Aided target recognition visual design impacts on cognition in simulated augmented reality,2022,1
Aaron L. Gardony,"Establishing A Cognitive, Health, Physical, And Social-emotional Toolkit To Predict Soldier Performance: 486",2022,1
Aaron L. Gardony,Identifying optimal graphical level of detail to support orienting with 3D geo-visualizations,2022,1
Aaron L. Gardony,Small arms weapon use influences distance estimation,2020,1
Aaron L. Gardony,Environmental knowledge: cognitive flexibility in structures and processes,2018,1
Aaron L. Gardony,"Efficient navigation, deficient representation: exploring how navigational aids impair spatial memory",2014,1
Aaron L. Gardony,To err is human: Landmark vs. turn reliance under conditions of route ambiguity,2012,1
Aaron L. Gardony,Personality Traits and Spatial Skills Are Related to Group Dynamics and Success During Collective Wayfinding,2024,0
Aaron L. Gardony,Characterizing information access needs in gaze-adaptive augmented reality interfaces: implications for fast-paced and dynamic usage contexts,2023,0
Aaron L. Gardony,"Characterizing Relationships Among the Cognitive, Physical, Social-emotional, and Health-related Traits of Military Personnel",2023,0
Aaron L. Gardony,Pupil Diameter Artifact Analysis-Experiment 2,2023,0
Aaron L. Gardony,Pronouns and Visual Perspective-Taking: Two Replication Results,2021,0
Aaron L. Gardony,How Do You Know If You’re Lost or Not?: Epistemic and Pragmatic Action During Navigation,2018,0
Aaron L. Gardony,To rotate or not to rotate: Strategy flexibility in the mental rotation task,2016,0
Aaron L. Gardony,How to Look and Where to Go: Visual Attention During Map Learning,2015,0
Aaron L. Gardony,Enhancing Navigation Efficiency via Low Current Brain Stimulation: A Role for Individual Differences,2014,0
Aaron L. Gardony,"Where did it come from, where do you go? Direction sources influence",N/A,0
Aaron L. Gardony,North is Up (hill): Route Planning Heuristics,N/A,0
Sun Young Park,The effects of EMR deployment on doctors’ work practices: A qualitative study in the emergency department of a teaching hospital,2012,181
Sun Young Park,How designers design and program interactive behaviors,2008,180
Sun Young Park,Caring for caregivers: designing for integrality,2013,168
Sun Young Park,Improving communication and social support for caregivers of high-risk infants through mobile technologies,2011,110
Sun Young Park,Identifying challenges and opportunities in human-AI collaboration in healthcare,2019,62
Sun Young Park,"Turning to peers: integrating understanding of the self, the condition, and others’ experiences in making sense of complex chronic conditions",2016,61
Sun Young Park,Loosely formed patient care teams: communication challenges and technology design,2012,52
Sun Young Park,Adaptation as design: learning from an EMR deployment study,2012,47
Sun Young Park,Individual and social recognition: Challenges and opportunities in migraine management,2015,39
Sun Young Park,Technological and organizational adaptation of EMR implementation in an emergency department,2015,38
Sun Young Park,Understanding students’ mental well-being challenges on a university campus: interview study,2020,36
Sun Young Park,Exploring real-time collaboration in crowd-powered systems through a ui design tool,2018,35
Sun Young Park,Conversational agents for health and wellbeing,2020,33
Sun Young Park,Designers’ natural descriptions of interactive behaviors,2008,31
Sun Young Park,Local-universality: Designing EMR to support localized informal documentation practices,2013,29
Sun Young Park,Opportunities to support parents in managing their children's health,2008,29
Sun Young Park,Social support mosaic: Understanding mental health management practice on college campus,2018,25
Sun Young Park,Creative arts therapies for the mental health of emerging adults: A systematic review,2022,24
Sun Young Park,Beyond health literacy: supporting patient-provider communication during an emergency visit,2017,24
Sun Young Park,Designing chatbots with black americans with chronic conditions: Overcoming challenges against covid-19,2022,19
Sun Young Park,Investigating the opportunity for a smart activity bag,2010,19
Sun Young Park,Balancing tensions between caregiving and parenting responsibilities in pediatric patient care,2019,18
Sun Young Park,More natural end-user software engineering,2008,18
Sun Young Park,Design and evaluation challenges of conversational agents in health care and well-being: selective review study,2022,17
Sun Young Park,Bridging the health disparity of African Americans through conversational agents,2020,17
Sun Young Park,Challenges in the parent-child communication of health-related information in pediatric cancer care,2021,16
Sun Young Park,Toward lightweight In-situ self-reporting: An exploratory study of alternative smartwatch interface designs in context,2020,16
Sun Young Park,igym: A wheelchair-accessible interactive floor projection system for co-located physical play,2019,14
Sun Young Park,Patient strategies as active adaptation: understanding patient behaviors during an emergency visit,2017,14
Sun Young Park,ENSURE: support for parents in managing their children’s health,2008,13
Sun Young Park,Learning from healthcare providers’ strategies: Designing technology to support effective child patient-provider communication,2021,10
Sun Young Park,Transitioning toward independence: enhancing collaborative self-management of children with type 1 diabetes,2022,9
Sun Young Park,Towards Low-Burden In-Situ Self-Reporting: A Design Space Exploration,2019,9
Sun Young Park,Harnessing mobile health technology to support long-term chronic illness management: exploring family caregiver support needs in the outpatient setting,2020,7
Sun Young Park,Design for improved workflow,2020,7
Sun Young Park,Bridging clinical and non-clinical health practices: opportunities and challenges,2012,7
Sun Young Park,"Exploring human-centered AI in healthcare: diagnosis, explainability, and trust",2022,6
Sun Young Park,Who cares? Exploring the concept of care networks for designing healthcare technologies,2019,6
Sun Young Park,User burden of microinteractions: An in-lab experiment examining user performance and perceived burden related to in-situ self-reporting,2021,5
Sun Young Park,Why not use mobile phones: an observational study of medical work,2011,5
Sun Young Park,Design opportunities for supporting patient information needs during an emergency visit,2016,4
Sun Young Park,Characteristics and challenges of clinical documentation in self-organized fast-paced medical work,2022,3
Sun Young Park,Trustworthy conversational agent design for African Americans with chronic conditions during COVID-19,2021,3
Sun Young Park,Learning from Positive Adaptations of Pediatric Cancer Patients to Design Health Technologies,2020,3
Sun Young Park,It’s like an educated guessing game: parents’ strategies for collaborative diabetes management with their children,2023,2
Sun Young Park,Exploring tracking needs and practices of recreational athletes,2019,2
Sun Young Park,Learning from Users' Adaptation Experience: Outlining the Design Space for Health IT Systems,2015,1
Sun Young Park,Supporting collaborative care in an emergency department (ED) through patient awareness,2014,1
Sun Young Park,Seeking Trustworthy Information on COVID-19: A Qualitative Study with the African American Community,2022,0
Sun Young Park,Revisiting patient-clinician interaction in 2022: Challenges from the Field and Opportunities for Future Research,2022,0
Sun Young Park,ewrapper: Perceived Receptivity to Engagement Strategies in mHealth,2019,0
Sun Young Park,ewrapper: Perceived Receptivity to Engagement Strategies in mHealth,2019,0
Sun Young Park,Patient-Provider Communication: Improving Patients’ Comprehension of Their Care.,2017,0
Sun Young Park,How Designers Design and Prototype Interactive Behaviors,N/A,0
Sun Young Park,Mosaic of Social Support: Understanding How College Students Manage Mental Health,N/A,0
Jim Wallace,The nice discussion room: Integrating paper and digital media to support co-located group meetings,2010,149
Jim Wallace,Investigating teamwork and taskwork in single-and multi-display groupware systems,2009,104
Jim Wallace,"Collaborative sensemaking on a digital tabletop and personal tablets: prioritization, comparisons, and tableaux",2013,92
Jim Wallace,Exploring automation in digital tabletop board game,2012,54
Jim Wallace,"Investigating the role of a large, shared display in multi-display environments",2011,54
Jim Wallace,"Technologies, methods, and values: Changes in empirical research at CSCW 1990–2015",2017,51
Jim Wallace,Watchpoint: Freehand pointing with a smartwatch in a ubiquitous display environment,2016,47
Jim Wallace,Tiltcasting: 3D Interaction on Large Displays using a Mobile Device,2015,43
Jim Wallace,Modelling and identifying collaborative situations in a collocated multi-display groupware setting,2011,41
Jim Wallace,Smartcasting: A Discount 3D Interaction Technique for Public Displays,2014,40
Jim Wallace,Watchcasting: Freehand 3D interaction with off-the-shelf smartwatch,2017,38
Jim Wallace,"Contextual design considerations for co-located, collaborative tables",2008,38
Jim Wallace,Group vs individual: Impact of touch and tilt cross-device interactions on mixed-focus collaboration,2018,37
Jim Wallace,Swordfish: user tailored workspaces in multi-display environments,2006,36
Jim Wallace,Food Literacy while Shopping: Motivating Informed Food Purchasing Behaviour with a Situated Gameful App﻿,2020,35
Jim Wallace,Creating your bubble: Personal space on and around large public displays,2016,34
Jim Wallace,Modelling symmetry of activity as an indicator of collocated group collaboration,2011,34
Jim Wallace,Pirate bri's grocery adventure: Teaching food literacy through shopping,2018,33
Jim Wallace,Comparing content and input redirection in MDEs,2008,31
Jim Wallace,Supporting serendipitous group interaction based on user activities,2012,30
Jim Wallace,Young adults’ perspectives on the use of symptom checkers for self-triage and self-diagnosis: Qualitative study,2021,29
Jim Wallace,Increasing Passersby Engagement with Public Large Interactive Displays: A Study of Proxemics and Conation,2018,29
Jim Wallace,“I Will Not Drink With You Today”: A Topic-Guided Thematic Analysis of Addiction Recovery on Reddit,2022,28
Jim Wallace,""" Local Remote"" Collaboration: Applying Remote Group AwarenessTechniques to Co-located Settings",2015,27
Jim Wallace,Exploring at-your-side gestural interaction for ubiquitous environments,2017,25
Jim Wallace,Effect of Bezel Presence and Width on Visual Search,2014,24
Jim Wallace,The computational thematic analysis toolkit,2022,23
Jim Wallace,Left‐handed scrolling for pen‐based devices,2006,23
Jim Wallace,Talkingtiles: Supporting personalization and customization in an aac app for individuals with aphasia,2015,21
Jim Wallace,Gestural text input using a smartwatch,2016,20
Jim Wallace,A web-based data visualization tool for the MIMIC-II database,2016,20
Jim Wallace,Co-located collaborative block-based programming,2019,16
Jim Wallace,My MDE: configuring virtual workspaces in multi-display environments,2006,16
Jim Wallace,Merlynne: Motivating peer-to-peer cognitive behavioral therapy with a serious game,2021,11
Jim Wallace,The Effect of Interior Bezel Presence and Width on Magnitude Judgement,2014,11
Jim Wallace,Use of symptom checkers for COVID-19-related symptoms among university students: a qualitative study.,2021,10
Jim Wallace,Post-hackathon learning circles: Supporting lean startup development,2020,10
Jim Wallace,Scalebridge: Design and evaluation of adaptive difficulty proportional reasoning game for children,2019,10
Jim Wallace,"Applying the cumulative fatigue model to interaction on large, multi-touch displays",2018,9
Jim Wallace,Solar scramble: an educational children's game for collaborative multi-touch digital tabletops,2010,9
Jim Wallace,Nature vs. stress: Investigating the use of biophilia in non-violent exploration games to reduce stress,2021,8
Jim Wallace,Joint action storyboards: A framework for visualizing communication grounding costs,2021,7
Jim Wallace,GroupBanter: Supporting Serendipitous Group Conversations with IM,2009,7
Jim Wallace,Latent classes associated with the intention to use a symptom checker for self-triage,2021,6
Jim Wallace,What is being used and who is using it: barriers to the adoption of smartphone patient experience surveys,2019,6
Jim Wallace,Changing peer support attitudes with avatar-based gamification,2018,6
Jim Wallace,Subtle and personal workspace requirements for visual search tasks on public displays,2017,6
Jim Wallace,Investigating Communication Grounding in Cross-Surface Interaction,2017,5
Jim Wallace,"Felines, foragers, and physicists: Supporting scientific outreach with multi-surface and multi-space games",2016,4
Jim Wallace,Handoff and Deposit: Designing Temporal Coordination in Cross-Device Transfer Techniques for Mixed-Focus Collaboration,2022,3
Jim Wallace,The Disappearing Tabletop: Social and Technical Challenges for Cross-Surface Collaboration,2017,3
Jim Wallace,"Collaboration Meets Interactive Surfaces and Spaces (CMIS) Walls, Tables, Mobiles, and Wearables",2016,3
Jim Wallace,3D interaction with networked public displays using mobile and wearable devices,2015,3
Jim Wallace,Towards contextual design requirements for MDEs,2008,3
Jim Wallace,Design and evaluation of technologies for informed food choices,2023,2
Jim Wallace,SmartSurveys: Does Context Influence Whether We'll Share Healthcare Experience Data with our Smartphone?,2018,2
Jim Wallace,Quantum Cats: The Demo,2016,2
Jim Wallace,Interfacing with interactive workspaces: extending the desktop,2006,2
Jim Wallace,Agency and Amplification: A Comparison of Manual and Computational Thematic Analyses by Public Health Researchers,2023,1
Jim Wallace,The Impact of Shared and Personal Devices on Collaborative Process and Performance,2012,1
Jim Wallace,INTERACTION WITH 2DAPPLICATIONS ON LARGE AND SMALL DISPLAYS,2008,1
Jim Wallace,Care of communicable diseases in general hospitals,1930,1
Jim Wallace,“The machine doesn't judge”: Counternarratives on surveillance among people accessing a safer opioid supply via biometric machines,2024,0
Jim Wallace,Advancing Public Health through Computational Thematic Analysi,2023,0
