Author Name,Title,Year,Citations
Jisu Jung,Motion control touch screen method and apparatus,2017,161
Jisu Jung,Method for providing ui and portable apparatus applying the same,2013,92
Jisu Jung,Remote controller,2015,89
Jisu Jung,Supporter for portable terminal,2014,66
Jisu Jung,Method for transmitting content with intuitively displaying content transmission direction and device using the same,2017,51
Jisu Jung,Display screen or portion thereof with animated graphical user interface,2016,35
Jisu Jung,Portable apparatus and screen displaying method thereof,2018,31
Jisu Jung,Examining the frequency and contribution of foods eaten away from home in the diets of 18-to 30-year-old Australians using smartphone dietary assessment (MYMeals): protocol for …,2018,31
Jisu Jung,Apparatus and method for providing user interface,2015,31
Jisu Jung,Foundations for systematic evaluation and benchmarking of a mobile food logger in a large-scale nutrition study,2020,23
Jisu Jung,Device and method for controlling rotation of displayed image,2016,22
Jisu Jung,Portable device and method for providing user interface mode thereof,2018,21
Jisu Jung,Display screen or portion thereof with graphical user interface,2016,21
Jisu Jung,User terminal and method of displaying lock screen thereof,2017,18
Jisu Jung,"Method of providing information regarding application, device for performing the method, and computer readable recording medium having recorded thereon a program for executing …",2013,18
Jisu Jung,The contribution of foods prepared outside the home to the diets of 18-to 30-year-old Australians: the MYMeals study,2021,16
Jisu Jung,Display screen or portion thereof with animated graphical user interface,2016,16
Jisu Jung,A tool to measure young adults’ food intake: Design and development of an Australian database of foods for the eat and track smartphone app,2018,15
Jisu Jung,Display screen or portion thereof with animated graphical user interface,2016,15
Jisu Jung,Display apparatus and control method thereof,2015,15
Jisu Jung,System and method of page sharing by a device,2013,13
Jisu Jung,Supporter for portable terminal,2015,11
Jisu Jung,Portable device and method for controlling brightness of the same,2020,10
Jisu Jung,"Harnessing the"" ambience"" of the mobile-phone lockscreen for ultra-lite logging",2017,10
Jisu Jung,"Method, apparatus, and computer readable recording medium for automatic grouping and management of content in real-time",2019,8
Jisu Jung,Annotation providing method and device,2018,8
Jisu Jung,Portable apparatus and method for sharing content with remote device thereof,2018,5
Jisu Jung,Stamp,2016,5
Jisu Jung,Mobile communication device,2015,4
Jisu Jung,"Method of displaying information in booting, and electronic apparatus and mobile terminal using the same",2018,3
Jisu Jung,Exer-model: A user model for scrutinising long-term models of physical activity from multiple sensors,2019,2
Jisu Jung,"The contribution of foods prepared outside the home to the diets of 18-to 30-year-old Australians: The MYMeals study., 2021, 13, 1761",2021,1
Jisu Jung,Terminal device and method for transceiving data thereof,2014,1
Jisu Jung,The Contribution of Nutrients of Concern to the Diets of 18-to-30-Year-Old Australians from Food Prepared Outside Home Differs by Food Outlet Types: The MYMeals Cross-Sectional …,2022,0
Jisu Jung,Terminal device and method for transceiving data thereof,2016,0
Jisu Jung,FIT: Lock-screen Ultra-lite Logging an Important Food Target,2016,0
Jisu Jung,확대 채널에서 확대율이 열전달과 마찰계수에 미치는 효과,2013,0
Huseyin Dogan,Exploring the roles of social participation in mobile social media learning: A social network analysis,2015,119
Huseyin Dogan,Exploring the requirements and design of persuasive intervention technology to combat digital addiction,2016,39
Huseyin Dogan,A Web-Based Intervention for Social Media Addiction Disorder Management in Higher Education: Quantitative Survey Study,2019,37
Huseyin Dogan,Identifying top challenges for international research on requirements engineering for systems of systems engineering,2013,33
Huseyin Dogan,Use of Technology to Promote Health and Wellbeing of People Who Are Homeless: A Systematic Review,2021,29
Huseyin Dogan,Usability Evaluation of Virtual Learning Environments: A University Case Study,2020,27
Huseyin Dogan,Towards a systems of systems engineering eu strategic research agenda,2013,23
Huseyin Dogan,Building online platforms for peer support groups as a persuasive behavior change technique,2018,22
Huseyin Dogan,A resilient cybersecurity framework for Mobile Financial Services (MFS),2017,22
Huseyin Dogan,COPE. er Method: Combating Digital Addiction via Online Peer Support Groups,2019,21
Huseyin Dogan,Systems of systems engineering: a research imperative,2013,20
Huseyin Dogan,The role of Human Factors in addressing Systems of Systems complexity,2011,20
Huseyin Dogan,Assessing System of Systems Security Risk and Requirements with OASoSIS,2018,19
Huseyin Dogan,Effectiveness and Usability of Digital Tools to Support Dietary Self-Management of Gestational Diabetes Mellitus: A Systematic Review,2021,16
Huseyin Dogan,Smartpowerchair: Characterization and usability of a pervasive system of systems,2017,16
Huseyin Dogan,A gesture-based CAPTCHA design supporting mobile devices,2015,15
Huseyin Dogan,The risk of information management without knowledge management: a case study,2011,15
Huseyin Dogan,Social Psychology: An under-used tool in Cybersecurity,2016,14
Huseyin Dogan,From Requirements to Operation: Components for Risk Assessment in a Pervasive System of Systems,2017,13
Huseyin Dogan,Designing mobile friendly CAPTCHAs: an exploratory study,2017,13
Huseyin Dogan,Digitizing a Face-to-Face Group Fatigue Management Program: Exploring the Views of People With Multiple Sclerosis and Health Care Professionals Via Consultation Groups and …,2019,12
Huseyin Dogan,System of systems characterisation assisting security risk assessment,2018,12
Huseyin Dogan,SmartPowerchair: To boldly go where a powerchair has not gone before,2015,11
Huseyin Dogan,Evaluating the usability of an Automated Transport and Retrieval System,2015,11
Huseyin Dogan,How do people who are homeless find out about local health and social care services: a mixed method study,2021,10
Huseyin Dogan,Conceptualising and Modelling E-Recruitment Process for Enterprises through a Problem Oriented Approach,2018,10
Huseyin Dogan,An Asia-Europe Massive Open Online Course for Lecturer Training: Development of Pedagogical Strategies for MOOCs,2015,10
Huseyin Dogan,A Process Model for Component-Based Model-Driven Software Development,2020,9
Huseyin Dogan,Identifying safety and human factors issues in rail using IRIS and CAIRIS,2020,8
Huseyin Dogan,Contextualising the National Cyber Security Capacity in an Unstable Environment: A Spring Land Case Study,2019,8
Huseyin Dogan,Using Human Factor Approaches to an Organisation’s Bring Your Own Device Scheme,2017,8
Huseyin Dogan,Surveying the Hackers: The Challenges of Data Collection From a Secluded Community,2017,8
Huseyin Dogan,Re-framing “The AMN”: A case study eliciting and modelling a System of Systems using the Afghan Mission Network,2017,8
Huseyin Dogan,7.5. 1 An incremental hybridisation of heterogeneous case studies to develop an ontology for capability engineering,2012,8
Huseyin Dogan,"How People Judge the Usability of a Desktop Graphic User Interface at Different Time Points: Is there Evidence for Memory Decay, Recall Bias or Temporal Bias?",2019,7
Huseyin Dogan,Automatic Detection of User Abilities through the SmartAbility Framework,2018,7
Huseyin Dogan,Economic and Societal Significance of the Systems of Systems Research Agenda,2013,7
Huseyin Dogan,Design of a web-based thesaurus for systems of systems engineering,2013,7
Huseyin Dogan,Formalisation and mapping of terminologies for systems of systems engineering thesaurus,2013,7
Huseyin Dogan,Systematic Analysis: Resistance to Traffic Analysis Attacks in Tor System for Critical Infrastructures,2018,6
Huseyin Dogan,UX Research is Dead. Long live UX Research!,2016,6
Huseyin Dogan,A “Soft” Approach to Analysing Mobile Financial Services Socio-Technical Systems,2016,6
Huseyin Dogan,Enhancing university student engagement using online multiple choice questions and answers,2015,6
Huseyin Dogan,Smartpowerchair: A pervasive system of systems,2015,6
Huseyin Dogan,A ‘soft’approach to TLM requirements capture to support through-life management,2009,6
Huseyin Dogan,Optimal Digital Filter Selection for Remote Photoplethysmography (rPPG) Signal Conditioning,2023,5
Huseyin Dogan,Effects of illuminance intensity on the green channel of remote photoplethysmography (rPPG) signals,2022,5
Huseyin Dogan,Creating a Digital Toolkit to Reduce Fatigue and Promote Quality of Life in Multiple Sclerosis: Participatory Design and Usability Study,2021,5
Huseyin Dogan,Development and Usability Evaluation of a Nutrition and Lifestyle Guidance Application for People Living with and Beyond Cancer,2019,5
Huseyin Dogan,A SmartDisability Framework: enhancing user interaction,2016,5
Huseyin Dogan,SmartDisability: A smart system of systems approach to disability,2016,5
Huseyin Dogan,A Usability Evaluation of Privacy Add-ons for Web Browsers,2019,4
Huseyin Dogan,Creating a FACETS digital toolkit to promote quality of life of people with multiple sclerosis through participatory design,2018,4
Huseyin Dogan,Forming Enterprise Recruitment Pattern Based on Problem-Oriented Conceptual Model,2015,4
Huseyin Dogan,Using Peerwise to improve engagement and learning.,2015,4
Huseyin Dogan,Systems of systems engineering thesaurus approach: from concept to realisation,2014,4
Huseyin Dogan,E-Military Recruitment: A Conceptual Model for Contextualizing the Problem Domain,2014,4
Huseyin Dogan,Transition from soft systems to an enterprise knowledge management architecture,2010,4
Huseyin Dogan,Evaluation of a Crisis Management Head Mounted Display (HMD) System,2006,4
Huseyin Dogan,Enhancing communication in rescue teams,2006,4
Huseyin Dogan,Assessing system of systems information security risk with OASoSIS,2022,3
Huseyin Dogan,Scoping the Need for a Tailored mHealth App to Improve Health and Well-being Behavioral Transformation in the Police: Exploring the Views of UK Police Workers via Web-Based …,2021,3
Huseyin Dogan,Development of Usable Security Heuristics for Fintech,2021,3
Huseyin Dogan,Use-case informed task analysis for secure and usable design solutions in rail,2021,3
Huseyin Dogan,Transforming Diagrams’ Semantics to Text for Visually Impaired,2020,3
Huseyin Dogan,National Cybersecurity Capacity Building Framework for Countries in a Transitional Phase.,2020,3
Huseyin Dogan,A Rule Based Reasoning System for Initiating Passive ADAS Warnings Without Driving Distraction Through an Ontological Approach,2018,3
Huseyin Dogan,Human Factors in Transportation Cyber-Physical Systems: A Case Study of a Smart Automated Transport and Retrieval System (SmartATRS),2018,3
Huseyin Dogan,Socially-augmented software: Empowering software operation through social contacts,2013,3
Huseyin Dogan,Trial of a special end user terminal that aids field operators during emergency rescue operations,2008,3
Huseyin Dogan,Detecting physical abilities through smartphone sensors: an assistive technology application,2022,2
Huseyin Dogan,Integrated Design Framework for Facilitating Systems-Theoretic Process Analysis,2022,2
Huseyin Dogan,Assessment of National Cybersecurity Capacity for Countries in a Transitional Phase: The Spring Land Case Study,2021,2
Huseyin Dogan,Problem-Oriented Conceptual Model and Ontology for Enterprise e-Recruitment.,2018,2
Huseyin Dogan,Assessing system of systems security risk and requirements with oasosis. Proceedings-2018 5th International Workshop on Evolving Security and Privacy Requirements Engineering …,2018,2
Huseyin Dogan,An Ontological Approach to Inform HMI Designs for Minimising Driver Distractions with ADAS,2018,2
Huseyin Dogan,Digitising a medical clerking system with multimodal interaction support,2017,2
Huseyin Dogan,Empowering University Students Through Online Multiple Choice Questions,2016,2
Huseyin Dogan,Digital Addiction Ontology for Social Networking Systems,2014,2
Huseyin Dogan,Applicability of SSM and UML for Designing a Search Application for the British Broadcasting Corporation (BBC),2014,2
Huseyin Dogan,Managing knowledge for capability engineering,2013,2
Huseyin Dogan,Capability Engineering Ontology,2012,2
Huseyin Dogan,Perspectives from Experts on Developing Transaction Monitoring Methods for Anti-Money Laundering,2023,1
Huseyin Dogan,From Concept to Reality: Examining India’s Clinical Decision Support System (CDSS) Challenges & Opportunities,2023,1
Huseyin Dogan,Authentibility Pass: An Accessible Authentication Gateway for People with Reduced Abilities,2022,1
Huseyin Dogan,A Usability Evaluation of YouDiagnose: Artificial Intelligence Powered Physician Consultation,2022,1
Huseyin Dogan,Dietary digital tools to support self-management of gestational diabetes mellitus: A systematic literature review,2021,1
Huseyin Dogan,Developing a FACETS digital toolkit.,2019,1
Huseyin Dogan,The development and evaluation of the SmartAbility Android Application to detect users' abilities,2019,1
Huseyin Dogan,Human-centred design for intelligent environments,2016,1
Huseyin Dogan,CrowdHiLite: A Peer Review Service to Support Serious Reading on the Screen,2014,1
Huseyin Dogan,Requirements Engineering For ADDICTion-Aware Software (E-ADDICT).,2014,1
Huseyin Dogan,Ergonomics for systems of systems: The challenge of the 21st century,2011,1
Huseyin Dogan,Enhancing Anti-Money Laundering: Development of a Synthetic Transaction Monitoring Dataset,2023,0
Huseyin Dogan,Interacting with Assistive Technology (IATech) Workshop,2023,0
Huseyin Dogan,A Tailored mHealth App for Improving Health and Well-Being Behavioral Transformation in UK Police Workers: Usability Testing via a Mixed Methods Study,2023,0
Huseyin Dogan,6 Exploring management of gestational diabetes during the third COVID-19 lockdown in the United Kingdom,2023,0
Huseyin Dogan,A Tailored mHealth App for Improving Health and Well-Being Behavioral Transformation in UK Police Workers: Usability Testing via a Mixed Methods Study,2023,0
Huseyin Dogan,Human Factors and Cyber Security Risks on the Railway–The Critical Role Played by Signalling Operations,2023,0
Huseyin Dogan,Health Ability Pass: An Accessible Healthcare Gateway for Patients with Disabilities,2022,0
Huseyin Dogan,Promoting Technology for Self-Care (ProTechS) for people who are sleeping rough,2022,0
Huseyin Dogan,"1st Workshop on Diversity, Accessibility and Inclusivity in Cyber Security",2021,0
Huseyin Dogan,Cyber Security Capabilities and Requirements for a User Interface Supporting the Routines of Retirement Village Residents across US and UK,2021,0
Huseyin Dogan,Evaluating Security and Accessibility Trade-off for Visually Impaired Mobile Financial Services Users,2021,0
Huseyin Dogan,"Designing an information, communication and entertainment interface for SMART retirement living",2021,0
Huseyin Dogan,Category/Research news,2021,0
Huseyin Dogan,Enhancing engagement with fatigue management via a digital toolkit,2020,0
Huseyin Dogan,Category/Research themes,2020,0
Huseyin Dogan,"Category/Health, Wellbeing & Society",2020,0
Huseyin Dogan,Design and Development of a Web Extension to Help Facilitate the Learning of a Foreign Language,2020,0
Huseyin Dogan,Template-Driven Documentation for Enterprise Recruitment Best Practices,2019,0
Huseyin Dogan,Category/Research news,2018,0
Huseyin Dogan,Tool-supporting Data Protection Impact Assessments with CAIRIS,2018,0
Huseyin Dogan,Assessing System of Systems Security Risk and Requirements with OASoSIS,2018,0
Huseyin Dogan,"Department of Computing & Informatics, Faculty of Science & Technology, Bournemouth University, Poole, United Kingdom",2018,0
Huseyin Dogan,Have usability and security trade-offs in mobile financial services become untrustworthy?,2018,0
Huseyin Dogan,SmartAbility: Detection of reduced physical abilities through smartphone sensors,2018,0
Huseyin Dogan,ERGONOMICS SYSTEMSOF SYSTEMS–THE CHALLENGEOFTHE 21 CENTURY,2017,0
Huseyin Dogan,Human-Centred Design for Intelligent Environments: Preface to the proceedings of the workshop on Human Centred Design for Intelligent Environments.,2016,0
Huseyin Dogan,Examining the effects of lighting effects on peripheral devices for visual user notifications,2016,0
Huseyin Dogan,UX Research is Dead. Long live UX Research!,2016,0
Huseyin Dogan,Proceedings of the 30th International BCS Human Computer Interaction Conference (HCI 2016)-Index,2016,0
Huseyin Dogan,Cybersecurity for the Unbanked,2016,0
Huseyin Dogan,Project Title Trans-Atlantic Research and Education Agenda in Systems of Systems (T-AREA-SoS),2012,0
Huseyin Dogan,ERGONOMICS SYSTEMS OF SYSTEMS–THE CHALLENGE OF THE 21ST CENTURY,2011,0
Huseyin Dogan,A conceptual approach to support through-life business transformation in an aerospace and defence context,2010,0
Huseyin Dogan,TRANSITION FROMA HUMAN-CENTRIC ‘SOFT’SYSTEMS APPROACH TO A BASELINE ENTERPRISE KNOWLEDGE MANAGEMENT ARCHITECTURE,2010,0
Huseyin Dogan,Socially-Augmented Software,N/A,0
Huseyin Dogan,INVITED SPEAKERS KEYNOTE SPEAKERS,N/A,0
Huseyin Dogan,AMOS4M,N/A,0
Huseyin Dogan,Full Access,N/A,0
Huseyin Dogan,International Review of Research in Open and Distributed Learning,N/A,0
Huseyin Dogan,Digitizing a Face-to-Face Group Fatigue Management Program: Exploring the Views of People With Multiple Sclerosis and Health Care Professionals Via Consultation Groups and …,N/A,0
Huseyin Dogan,Development of Human Factors and Cybersecurity Objectives for Mobile Financial Service (MFS),N/A,0
Huseyin Dogan,Exploring the views of people with multiple sclerosis and health care professionals about digitising FACETS-a face-to-face group fatigue management programme,N/A,0
Huseyin Dogan,Usability and Security Factors in Mobile Financial Services and Their Impact on End-User Trust,N/A,0
Huseyin Dogan,TAPCHA–An ‘Invisible’CAPTCHA Scheme,N/A,0
Huseyin Dogan,2 nd Workshop on Human Centred Design for Intelligent Environments (HCD4IE),N/A,0
Zhu-Tian Chen,Applying machine learning advances to data visualization: A survey on ml4vis,2020,92
Zhu-Tian Chen,Towards automated infographic design: Deep learning-based auto-extraction of extensible timeline,2019,82
Zhu-Tian Chen,Shuttlespace: Exploring and analyzing movement trajectory in immersive visualization,2020,69
Zhu-Tian Chen,Marvist: Authoring glyph-based visualization in mobile augmented reality,2019,60
Zhu-Tian Chen,StreamExplorer: a multi-stage system for visually exploring events in social streams,2017,59
Zhu-Tian Chen,Augmenting Static Visualizations with PapARVis Designer,2020,52
Zhu-Tian Chen,LassoNet: Deep lasso-selection of 3D point clouds,2019,48
Zhu-Tian Chen,Augmenting sports videos with viscommentator,2021,47
Zhu-Tian Chen,Visual analysis of discrimination in machine learning,2020,46
Zhu-Tian Chen,TIVEE: Visual exploration and explanation of badminton tactics in immersive visualizations,2021,45
Zhu-Tian Chen,Exploring the design space of immersive urban analytics,2017,41
Zhu-Tian Chen,Animated narrative visualization for video clickstream data,2016,24
Zhu-Tian Chen,The quest for: Embedded visualization for augmenting basketball game viewing experiences,2022,23
Zhu-Tian Chen,Crossdata: Leveraging text-data connections for authoring data documents,2022,21
Zhu-Tian Chen,Sporthesia: Augmenting sports videos using natural language,2022,18
Zhu-Tian Chen,Blossom: design of a tangible interface for improving intergenerational communication for the elderly,2016,18
Zhu-Tian Chen,DataParticles: Block-based and language-oriented authoring of animated unit visualizations,2023,17
Zhu-Tian Chen,Millions and billions of views: Understanding popular science and knowledge communication on video-sharing platforms,2022,16
Zhu-Tian Chen,Improving particle swarm optimization algorithm for distributed sensing and search,2013,13
Zhu-Tian Chen,Immersive urban analytics through exploded views,2017,12
Zhu-Tian Chen,iBall: Augmenting Basketball Videos with Gaze-moderated Embedded Visualizations,2023,10
Zhu-Tian Chen,Exploring Interactions with Printed Data Visualizations in Augmented Reality,2022,9
Zhu-Tian Chen,Beyond Generating Code: Evaluating GPT on a Data Visualization Course,2023,8
Zhu-Tian Chen,Stac: Enhancing stacked graphs for time series analysis,2016,8
Zhu-Tian Chen,The Ball is in Our Court: Conducting Visualization Research With Sports Experts,2023,5
Zhu-Tian Chen,An adaptive particle swarm optimization algorithm for distributed search and collective cleanup in complex environment,2013,5
Zhu-Tian Chen,A modified particle swarm optimization algorithm for distributed search and collective cleanup,2013,5
Zhu-Tian Chen,PoseCoach: A Customizable Analysis and Visualization System for Video-based Running Coaching,2022,4
Zhu-Tian Chen,ARrow: A Real-Time AR Rowing Coach,2023,3
Zhu-Tian Chen,PuzzleFixer: A Visual Reassembly System for Immersive Fragments Restoration,2022,3
Zhu-Tian Chen,VIRD: Immersive Match Video Analysis for High-Performance Badminton Coaching,2023,2
Zhu-Tian Chen,VCoach: a customizable visualization and analysis system for video-based running coaching,2022,2
Zhu-Tian Chen,RL-LABEL: A Deep Reinforcement Learning Approach Intended for AR Label Placement in Dynamic Scenarios,2023,1
Zhu-Tian Chen,Unraveling the Temporal Dynamics of the Unet in Diffusion Models,2023,0
Zhu-Tian Chen,VoxAR: Adaptive Visualization of Volume Rendered Objects in Optical See-Through Augmented Reality,2023,0
Zhu-Tian Chen,Quantifying the Impact of XR Visual Guidance on User Performance Using a Large-Scale Virtual Assembly Experiment,2023,0
Zhu-Tian Chen,探讨沉浸式城市的可视化分析设计空间,N/A,0
Soh MASUKO,A fitness game reflecting heart rate,2006,64
Soh MASUKO,Comparing VR-and AR-based try-on systems using personalized avatars,2020,43
Soh MASUKO,"Search device, search method, recording medium, and program",2016,41
Soh MASUKO,Head‐eye animation corresponding to a conversation for CG characters,2007,38
Soh MASUKO,"Image processing system, image processing device, image processing method, program, and information storage medium for providing an aid that makes it easy to grasp color of an …",2016,35
Soh MASUKO,"Color name determination device, color name determination method, information recording medium, and program",2014,31
Soh MASUKO,"Information processing device, information processing method, information processing program, and recording medium on which information processing program is recorded",2014,26
Soh MASUKO,Object displacement method for web page,2014,23
Soh MASUKO,Machine translation of a web page having an image containing characters,2015,21
Soh MASUKO,"Clothing image processing device, clothing image display method and program",2018,20
Soh MASUKO,"Information processing device, information processing method, and recording medium that has recorded information processing program",2014,18
Soh MASUKO,Gesture-based mobile communication system providing side-by-side shopping feeling,2018,16
Soh MASUKO,"Question and answer processing device, question and answer processing method, question and answer processing program, and recording medium",2013,15
Soh MASUKO,Generating head–eye movement for virtual actor,2006,15
Soh MASUKO,"Image providing device, image processing method, image processing program, and recording medium for forming a mosaic image",2013,14
Soh MASUKO,"Information processing device, information processing method, information processing program and recording medium",2013,14
Soh MASUKO,"User interface device, user interface method, program, and computer-readable information storage medium",2020,12
Soh MASUKO,Shopping together: a remote co-shopping system utilizing spatial gesture interaction,2018,11
Soh MASUKO,Recommendation system of sightseeing area for groups,2015,11
Soh MASUKO,Proof-of-concept of distributed optimization of micro-services on edge computing for beyond 5G,2022,10
Soh MASUKO,FUROSHIKI: augmented reality media that conveys Japanese traditional culture,2019,10
Soh MASUKO,MR-Shoppingu: physical interaction with augmented retail products using continuous context awareness,2017,10
Soh MASUKO,Information supply device,2017,10
Soh MASUKO,Lovable couch: Mitigating distrustful feelings for couples by visualizing excitation,2015,10
Soh MASUKO,Mec/cloud orchestrator to facilitate private/local beyond 5g with mec and proof-of-concept implementation,2022,9
Soh MASUKO,Information provision device,2019,9
Soh MASUKO,"Terminal device, control method for terminal device, program, and information storage medium",2017,9
Soh MASUKO,Interactive study of WallSHOP: multiuser connectivity between public digital advertising and private devices for personalized shopping,2015,9
Soh MASUKO,WallSHOP: Multiuser interaction with public digital signage using mobile devices for personalized shopping,2015,9
Soh MASUKO,Information provision device,2015,9
Soh MASUKO,"Device, method, and program for commercial product reliability evaluation based on image comparison",2023,8
Soh MASUKO,Effects of acoustic comfort and advertisement recallability on digital signage with on-demand pinpoint audio system,2021,8
Soh MASUKO,"Terminal device, control method for terminal device, program, and information storage medium",2018,8
Soh MASUKO,"Information processing system, control method for information processing system, information processing device, control method for information processing device, information …",2017,8
Soh MASUKO,"Information processing device, method for controlling information processing device, program, and information storage medium",2016,8
