Author Name,Title,Year,Citations
Nova eka diana,PERBANDINGAN RESILIENCE CONCEPT DAN RULE-BASED TERHADAP PENANGANAN JADWAL OPERASI BEDAH UNTUK EMERGENCY CASE DAN ELECTIVE SURGERY,2016,1
Nova eka diana,PENGUKURAN KOGNITIF DAN USER EXPERIENCE APLIKASI LATIHAN MOTORIK HALUS PADA UMUR BERESIKO DEMENSIA,2016,1
Nova eka diana,"Pilah Sampah Kunci Sukses Kurangi Sampah; Pelatihan Pengelolaan Sampah Rumah Tangga dan Pengenalan Bank Sampah bagi Ibu-ibu PKK RW 003 Kelurahan Lenteng Agung, Jakarta Selatan",2021,0
Nova eka diana,PEMANTAUAN KONDISI TUBUH BERBASIS ARDUINO DAN RASPBERRY PI UNTUK PENGENDALIAN KONDISI RUANGAN,2019,0
Nova eka diana,Kajian Penerapan Sistem e-Learning dalam Proses Pembelajaran di SLTA (Studi Kasus di SMAN 110 dan MAN 3 Jakarta),2014,0
Nova eka diana,Peningkatan Logika Algoritma dengan Memanfaatkan Robot LEGO sebagai Media Pembelajaran,N/A,0
Nova eka diana,Development of a Cost-Effective Haptic System for Laparoscopic Surgery Simulation,N/A,0
Mohammad Chegini,"Interactive labelling of a multivariate dataset for supervised machine learning using linked visualisations, clustering, and active learning",2019,62
Mohammad Chegini,Interactive Visual Labelling versus Active Learning: An Experimental Comparison,2020,19
Mohammad Chegini,Interactive Visual Exploration of Local Patterns in Large Scatterplot Spaces,2018,13
Mohammad Chegini,Multiple linked-view exploration on large displays facilitated by a secondary handheld device,2019,5
Mohammad Chegini,Interaction Concepts for Collaborative Visual Analysis of Scatterplots on Large Vertically-Mounted High-Resolution Multi-Touch Displays,2017,5
Mohammad Chegini,mVis in the Wild: Pre-Study of an Interactive Visual Machine Learning System for Labelling,2019,4
Mohammad Chegini,VisGIL: machine learning-based visual guidance for interactive labeling,2022,3
Mohammad Chegini,Eye-Tracking Based Adaptive Parallel Coordinates,2019,2
Mohammad Chegini,Toward Multimodal Interaction of Scatterplot Spaces Exploration,2018,2
Mohammad Chegini,Integrated Visualization of Structure and Attribute Similarity of Multivariate Graphs,2018,2
Mohammad Chegini,The Clutch: Two-Handed Mobile Multi-Touch 3D Object Translation and Manipulation,2015,1
Mohammad Chegini,"使用链接可视化, 聚类和主动学习对监督机器学习进行多变量数据集的交互式标记",2019,0
Mohammad Chegini,Visual Analytics for Investigative Analysis,2017,0
Vinh Nguyen,TIMMi: Finger-worn textile input device with multimodal sensing in mobile interaction,2015,52
Vinh Nguyen,Bendid: Flexible interface for localized deformation recognition,2014,21
Vinh Nguyen,SOFTii: soft tangible interface for continuous control of virtual objects with pressure-based input,2015,20
Vinh Nguyen,Transmit antenna selection for spatial modulation MIMO IoT networks with full-duplex relaying,2020,13
Vinh Nguyen,Temperature analysis of copper wire in a plasma annealing system at atmospheric pressure,2011,8
Vinh Nguyen,Vespidae: A Programming Framework for Developing Digital Fabrication Workflows,2023,3
Vinh Nguyen,FinePose: Fine-Grained Postural Muscle Profiling via Haptic Vibration Signals,2022,1
Vinh Nguyen,SA11 Data Visualization: A Tool to Enhance the Interpretability of Complex and Dense Data Sources,2022,0
Vinh Nguyen,Spinning Dust Emission from Circumstellar Disks and Its Role In Excess Microwave Emission,2019,0
Vinh Nguyen,Communications (AEÜ),2016,0
Vinh Nguyen,BendID,2014,0
Vinh Nguyen,Capture of interconnectivity data for multi-pin devices in the design of emulator circuit boards,2014,0
Vinh Nguyen,Soft tangible interface for continuous control of virtual objects with pressure based input,2014,0
Md Mahfuzul Haque,"Combating misinformation in Bangladesh: Roles and responsibilities as perceived by journalists, fact-checkers, and users",2020,63
Md Mahfuzul Haque,"Examining the roles of automation, crowds and professionals towards sustainable fact-checking",2019,28
Md Mahfuzul Haque,"Fact-checking initiatives in bangladesh, india, and nepal: a study of user engagement and challenges",2018,13
Md Mahfuzul Haque,Online niches of English-language newspapers in Bangladesh: Analyzing news stories and user engagement on Facebook,2019,6
Md Mahfuzul Haque,"Towards a sustainable model for fact-checking platforms: examining the roles of automation, crowds and professionals",2017,6
Md Mahfuzul Haque,Covering a Complicated Legacy with a Sledgehammer: Metajournalistic and Audience Discourse After Kobe Bryant’s Death,2022,2
Ibrahim A Tahmid,{T-Miner}: A generative approach to defend against trojan attacks on {DNN-based} text classification,2021,72
Ibrahim A Tahmid,CNN model with hilbert curve representation of DNA sequence for enhancer prediction,2019,11
Ibrahim A Tahmid,Evaluating the benefits of explicit and semi-automated clusters for immersive sensemaking,2022,9
Ibrahim A Tahmid,Mining Developer Questions about Major Web Frameworks.,2018,7
Ibrahim A Tahmid,Clean the ocean: An immersive vr experience proposing new modifications to go-go and wim techniques,2022,6
Ibrahim A Tahmid,Efficient association mapping from k-mers—an application in finding sex-specific sequences,2021,6
Ibrahim A Tahmid,Evaluation of pointing ray techniques for distant object referencing in model-free outdoor collaborative augmented reality,2022,2
Ibrahim A Tahmid,Fantastic voyage 2021: Using interactive VR storytelling to explain targeted COVID-19 vaccine delivery to antigen-presenting cells,2021,2
Ibrahim A Tahmid,Reference-free Association Mapping from Sequencing Reads Using k-mers,2020,2
Ibrahim A Tahmid,A faster implementation of association mapping from k-mers,2020,1
Ibrahim A Tahmid,Uncovering Best Practices in Immersive Space to Think,2023,0
Ibrahim A Tahmid,CoLT: Enhancing Collaborative Literature Review Tasks with Synchronous and Asynchronous Awareness Across the Reality-Virtuality Continuum,2023,0
Ibrahim A Tahmid,Evaluating the Feasibility of Predicting Information Relevance During Sensemaking with Eye Gaze Data,2023,0
Ibrahim A Tahmid,"Spaces to Think: A Comparison of Small, Large, and Immersive Displays for the Sensemaking Process",2023,0
Ibrahim A Tahmid,CLUE HOG: An Immersive Competitive Lock-Unlock Experience using Hook On Go-Go Technique for Authentication in the Metaverse,2023,0
Ibrahim A Tahmid,CANDIDATES’DECLARATION,2017,0
Mashael Yousef Almoqbel,Understanding Facebook news post comment reading and reacting behavior through political extremism and cultural orientation,2019,28
Mashael Yousef Almoqbel,Individual and collaborative behaviors of rideshare drivers in protecting their safety,2019,25
Mashael Yousef Almoqbel,Moderation Visibility: Mapping the Strategies of Volunteer Moderators in Live Streaming Micro Communities,2021,22
Mashael Yousef Almoqbel,Computational mining of social media to Curb terrorism,2019,21
Mashael Yousef Almoqbel,The metaverse: a systematic literature review to map scholarly definitions,2022,15
Mashael Yousef Almoqbel,Understanding safety concerns and protection behaviors of rideshare drivers,2019,4
Mashael Yousef Almoqbel,Do I Care Enough? Using a Prosocial Tendencies Measure to Understand Twitter Users Sharing Behavior for Minor Public Safety Incidents,2020,3
Mashael Yousef Almoqbel,AI-integrated communication: conceptualization and a critical review,2023,0
Mashael Yousef Almoqbel,Am I Safe? Understanding Saudi Women Rideshare Drivers Safety Perspectives,2023,0
Mashael Yousef Almoqbel,Perceptions of accuracy in online news during the COVID-19 pandemic,2023,0
Mashael Yousef Almoqbel,Research Anthology on Managing Crisis and Risk Communications,2023,0
Mashael Yousef Almoqbel,"Exploring, Understanding, Then Designing: Twitter Users’ Sharing Behavior for Minor Safety Incidents",2021,0
Mashael Yousef Almoqbel,Understanding Decisions to Share Minor Public Safety Incidents on Twitter Through a Collective Action Theory Lens,2021,0
Mashael Yousef Almoqbel,Do Uber drivers feel safe? A qualitative study to address the safety needs of Uber drivers through technology,2018,0
Francesco Cataldo,A Perspective on Client-Psychologist Relationships in Videoconferencing Psychotherapy: Literature Review,2021,98
Francesco Cataldo,"A perspective on client-psychologist relationships in videoconferencing psychotherapy: Literature review. JMIR Mental Health, 8 (2), e19004",2021,11
Francesco Cataldo,Videoconference in Psychotherapy: Understanding research and practical implications,2019,9
Francesco Cataldo,Enhancing Therapeutic Processes in Videoconferencing Psychotherapy: Interview Study of Psychologists’ Technological Perspective,2023,0
Francesco Cataldo,La famiglia resiliente,2015,0
Francesco Cataldo,Il piccolo gruppo ecologico come oggetto di ricerca intervento,2011,0
Francesco Cataldo,Tecnologie e Relazione,2011,0
Francesco Cataldo,Il Dado Imperfetto. Fattori di rischio e manifestazioni di disagio nel ciclo vitale,2010,0
Francesco Cataldo,La dipendenza tra prevenzione e sistemi cura,2010,0
Francesco Cataldo,Quando la danza si ferma,2008,0
Francesco Cataldo,La Peer Education Accademica. La prevenzione tra pari (The Academic Peer Education,2007,0
Jingya Chen,Multi-modal repairs of conversational breakdowns in task-oriented dialogs,2020,65
Jingya Chen,Field trial analysis of socially aware robot assistant,2018,36
Jingya Chen,Privacy-preserving script sharing in gui-based programming-by-demonstration systems,2020,12
Jingya Chen,Towards effective human-ai collaboration in gui-based interactive task learning agents,2020,4
Jingya Chen,Leveraging the twitch platform and gamification to generate home audio datasets,2021,1
Juan Carlos Ruiz-Garcia,Improving learner engagement in MOOCs using a learning intervention system: A research study in engineering education,2021,43
Juan Carlos Ruiz-Garcia,SVC-onGoing: Signature verification competition,2022,41
Juan Carlos Ruiz-Garcia,ICDAR 2021 Competition on On-Line Signature Verification,2021,18
Juan Carlos Ruiz-Garcia,"Child-Computer Interaction with Mobile Devices: Recent Works, New Dataset, and Age Detection",2022,12
Juan Carlos Ruiz-Garcia,ChildCI framework: Analysis of motor and cognitive development in children-computer interaction for age detection,2024,3
Juan Carlos Ruiz-Garcia,Children age group detection based on human–computer interaction and time series analysis,2024,1
Juan Carlos Ruiz-Garcia,CareFall: Automatic Fall Detection through Wearable Devices and AI Methods,2023,0
Juan Carlos Ruiz-Garcia,ChildCIdb_v2: A Longitudinal Database for Children-Computer Interaction on Mobile Devices,2023,0
Juan Carlos Ruiz-Garcia,Estudio y Propuesta de Nuevos Métodos de Aprendizaje Automático para la Detección de Grupos de Edad en Niños a través de la Interacción con los Dispositivos Móviles,2021,0
Fayyaz Ali,Facial expression recognition with histogram of oriented gradients using CNN,2019,34
Fayyaz Ali,Detection of real-time malicious intrusions and attacks in IoT empowered cybersecurity infrastructures,2023,23
Fayyaz Ali,Performance analysis of hyperparameters on a sentiment analysis model,2020,14
Fayyaz Ali,Roman-urdu news headline classification with ir models using machine learning algorithms,2019,10
Fayyaz Ali,Sentiment analysis of RSS feeds on sports news–a case study,2019,8
Fayyaz Ali,"Roman Urdu headline news text classification using RNN, LSTM and CNN",2020,7
Fayyaz Ali,Identifying Driver Behaviour Through Obd-Ii Using Android Application,2020,5
Fayyaz Ali,"Using eBus Services Solution, Book Anywhere to Save Time",2020,5
Fayyaz Ali,Predicting the Karachi Stock Price index with an Enhanced multi-layered Sequential Stacked Long-Short-Term Memory Model,2023,3
Fayyaz Ali,A comparative study of engineering students pedagogical progress,2018,3
Fayyaz Ali,Facial emotion identification based on local binary pattern feature detector,2019,2
Fayyaz Ali,Enhancing Contextualized GNNs for Multimodal Emotion Recognition: Improving Accuracy and Robustness,2023,1
Fayyaz Ali,Smart Health Monitoring System (SHMS) an Enabling Technology for Patient Care,2022,1
Fayyaz Ali,PSAT-Based Sentiment Analysis: For Text And Data Mining,2022,1
Fayyaz Ali,Sentences Prediction Based on Automatic Lip-Reading Detection with Deep Learning Convolutional Neural Networks Using Video-Based Features,2021,1
Fayyaz Ali,The Anti-Terrorism Role of city Karachi–An Unreal Based Role-Playing Game,2023,0
Fayyaz Ali,Safe and secure: an automated library management system for monitoring book rotation using face recognition,2023,0
Fayyaz Ali,Muscle Town the Health Fitness Prevention of Disease: Using a Mobile App to Improve Fitness and Health,2022,0
Fayyaz Ali,Index of non-invited papers,N/A,0
Fayyaz Ali,A Development of an E-Commerce Price Negotiation Application,N/A,0
Fayyaz Ali,Smart Health Monitoring System (SHMS) an Enabling Technology for Patient Care,N/A,0
Shalmoli Ghosh,Stance detection in web and social media: a comparative study,2019,92
Shalmoli Ghosh,Utilizing social media for identifying drug addiction and recovery intervention,2020,11
Shalmoli Ghosh,Identifying multi-dimensional information from microblogs during epidemics,2019,8
Shalmoli Ghosh,An unsupervised normalization algorithm for noisy text: a case study for information retrieval and stance detection,2021,7
Manoj Kumar Rajagopal,Study of short term rain forecasting using machine learning based approach,2021,28
Manoj Kumar Rajagopal,Detecting facial emotions using normalized minimal feature vectors and semi-supervised twin support vector machines classifier,2019,21
Manoj Kumar Rajagopal,Real-time particle filtering with heuristics for 3D motion capture by monocular vision,2010,13
Manoj Kumar Rajagopal,Iot based smart agriculture and plant disease prediction,2021,9
Manoj Kumar Rajagopal,Residual attention network for deep face recognition using micro-expression image analysis,2021,9
Manoj Kumar Rajagopal,Study of hand gesture recognition and classification,2017,8
Manoj Kumar Rajagopal,Hypersocial museum: Addressing the social interaction challenge with museum scenarios and attention-based approaches,2009,5
Manoj Kumar Rajagopal,Detecting happiness in human face using unsupervised twin-support vector machines,2018,4
Manoj Kumar Rajagopal,Artificial Intelligence based drone for early disease detection and precision pesticide management in cashew farming,2023,3
Manoj Kumar Rajagopal,Toward a model of computational attention based on expressive behavior: applications to cultural heritage scenarios,2009,3
Manoj Kumar Rajagopal,Human activity recognition using deep learning approaches and single frame cnn and convolutional lstm,2023,2
Manoj Kumar Rajagopal,Design of disaster management based on Artificial Neural Network and Logistic Regression,2019,2
Manoj Kumar Rajagopal,Internet of Things based Gateways: Applications and Challenges,2019,2
Manoj Kumar Rajagopal,Detecting happiness in human face using minimal feature vectors,2018,2
Manoj Kumar Rajagopal,A steganography framework for easy secret sharing through images,2013,2
Manoj Kumar Rajagopal,A modest IoT based smart parking system with business analytics integration,2021,1
Manoj Kumar Rajagopal,Facial emotion recognition system using entire feature vectors and supervised classifier,2021,1
Manoj Kumar Rajagopal,Review on Facial Micro - Expression Detection,2019,1
Manoj Kumar Rajagopal,Virtually cloning real human with motion style,2013,1
Manoj Kumar Rajagopal,Integrative Deep Learning Forecasting of Air Quality Index in India: A Fusion of Bidirectional LSTM and Sensor Data,2023,0
Manoj Kumar Rajagopal,Leveraging Deep Learning for Improving Real Time Stolen Vehicle Tracking in Smart Cities,2023,0
Manoj Kumar Rajagopal,AI-Enabled Dimming Streetlight with Energy Optimization,2023,0
Manoj Kumar Rajagopal,Comparative study on Judgment Text Classification for Transformer Based Models,2023,0
Manoj Kumar Rajagopal,Amity--A Hybrid Mental Health Application,2023,0
Manoj Kumar Rajagopal,Facial Expression Image Analysis to Classify High and Low Level ASD Kids using Attention Mechanism Embedded Deep Learning Technique,2020,0
Manoj Kumar Rajagopal,Attention residual network for micro-expression recognition using image analysis,2020,0
Manoj Kumar Rajagopal,Emotion Recognition - A Selected Review,2015,0
Manoj Kumar Rajagopal,Cloning with gesture expressivity,2012,0
Manoj Kumar Rajagopal,Animating a conversational agent with user expressivity,2011,0
Manoj Kumar Rajagopal,"K.,(2023). Identification of Autism Spectrum Disorder using Residual Attention Net-work for Facial Image Analysis",N/A,0
Alvi Syahrina,Perancangan Modul Landing Page Dan Pembayaran Pada Website Pahamee Tentang Kesehatan Mental Menggunakan Metode Extreme Programming,2021,22
Alvi Syahrina,Designing User Experience and User Interface of a B2B Textile e-Commerce using Five Planes Framework,2020,22
Alvi Syahrina,User Interface Design of P2P Lending Mobile Application Using Design Thinking,2020,11
Alvi Syahrina,"Design of e-Marketplace for Village-owned Small, Micro and Medium Enterprise using Rapid Application Development",2020,11
Alvi Syahrina,Perancangan Ulang User Interface Dan User Experience Pada Website Telkom University Open Library Menggunakan Metode User Centered Design,2021,7
Alvi Syahrina,Student Modeling using Case-Based Reasoning in Conventional Learning System,2012,7
Alvi Syahrina,Perancangan User Interface Pada Aplikasi Informasi Berbasis Website Untuk Tindakan Perbaikan Layanan Angkutan Umum Di Kota Bandung Menggunakan Metode User Centered Design,2020,5
Alvi Syahrina,"Bridging the Gaps in the HCI & UX World: Proceedings of CHIuXID 2016: Jakarta, Indonesia, 13-15 April 2016",2016,5
Alvi Syahrina,PERANCANGAN USER INTERFACE MITRA SEBAGAI PENERIMA PESANAN PADA APLIKASI EATAJA MITRA DENGAN METODE GOAL-DIRECTED DESIGN,2021,4
Alvi Syahrina,Perancangan ulang user interface dan user experience pada website telkom university open library dengan metode user centered design,2021,4
Alvi Syahrina,Integrasi Sistem Pengawasan Kesehatan Jembatan dengan Sistem Pengawasan Lalu Lintas,2020,4
Alvi Syahrina,Pengembangan Purwarupa Sistem Pengawasan Kondisi Kesehatan Jembatan Single Degree Of Freedom Menggunakan Respon Dinamik,2020,4
Alvi Syahrina,Online Machine Translator System and Result Comparison–Statistical Machine Translation vs. Hybrid Machine Translation,2011,3
Alvi Syahrina,Online Machine Translator System and Result Comparison,2011,3
Alvi Syahrina,Accessibility Evaluation of Telemedicine System in Older Adults User: A Case Study,2021,2
Alvi Syahrina,PERANCANGAN ARSITEKTUR PERANGKAT LUNAK MICROSERVICES PADA APLIKASI OPEN LIBRARY UNIVERSITAS TELKOM MENGGUNAKAN gRPC,2022,1
Alvi Syahrina,Perancangan Modul Konselor Pada Website Pahamee Tentang Kesehatan Mental Menggunakan Metode Extreme Programming,2021,1
Alvi Syahrina,"Perancangan User Interface Pada Aplikasi Customer Layanan Pemesanan Makanan"" eataja"" Menggunakan Metode User Centered Design",2021,1
Alvi Syahrina,Improving usability of Telkom university open library website using user-centered design method,2023,0
Alvi Syahrina,Designing of client module on Pahamee’s website about mental health using extreme programming method,2023,0
Alvi Syahrina,Perancangan Backend Dan Aplikasi Berbasis Website Untuk Startup Eataja Menggunakan Metode Iterative Incremental,2021,0
Alvi Syahrina,Pengembangan Sistem Dashboard Admin Sebagai Tools Tim Eataja Dengan Metode Agile Extreme Programming,2021,0
Alvi Syahrina,Analisis Dan Perancangan Prototipe Website Pt. Kai Menggunakan Inclusive Design Untuk Meningkatkan Aksesibilitas Bagi Penyandang Disabilitas Penglihatan Low Vision,2020,0
Alvi Syahrina,Perancangan Dan Evaluasi Visualisasi Informasi Interaktif Data Multidimensional Pada Studi Kasus Rumah Sakit Tiara Bekasi,2020,0
Alvi Syahrina,Pengembangan Aplikasi Berbasis Android Untuk Perbaikan Layanan Angkutan Umum Dengan Metode Extreme Programming Studi Kasus: Angkutan Umum Kota Bandung,2020,0
Alvi Syahrina,Analisis Dan Perancangan Prototipe Website Smb Telkom Menggunakan Metode Inclusive Design Untuk Meningkatkan Aksesibilitas Bagi Penyandang Disabilitas Penglihatan,2020,0
Alvi Syahrina,Perancangan Sistem Informasi Angkutan Umum Berbasis Website Di Kota Bandung Menggunakan Metode Extreme Programming Untuk Tindakan Perbaikan Layanan Angkutan Umum,2020,0
Alvi Syahrina,Membangun Desain Alternatif Menu Web Universitas Pada Studi Kasus I-gracias Telkom University,2020,0
Alvi Syahrina,Perancangan Weigh In Motion Untuk Sistem Pengukuran Kapasitas Jembatan Berbasis Perubahan Frekuensi Respon Struktur,2020,0
Alvi Syahrina,Perancangan Line Bot Layanan Pesan Antar Warung Makan â€ œdikampusâ€ Menggunakan Metode User Centered Design (studi Kasus Layanan Pesan Antar Makanan Untuk Wilayah Kampus …,2019,0
Alvi Syahrina,Analisis Perbaikan Sistem Informasi Akademik Menggunakan Pendekatan Web Usability Dan Importance Perfomance Analysis (studi Kasus: I-gracias Universitas Telkom Pada Mahasiswa …,2019,0
Alvi Syahrina,Listening and Interacting with Music Pattern through a Tangible Interface,2015,0
Lalit Agarwal,Do not embarrass: Re-examining user concerns for online tracking and advertising,2013,99
Lalit Agarwal,Ask me again but don't annoy me: Evaluating re-authentication strategies for smartphones,2016,10
Lalit Agarwal,Do not embarrass,2013,6
Lalit Agarwal,Evaluating Re-authentication Strategies for Smartphones,2016,1
Lalit Agarwal,Multilingual Plagiarism Detection,2014,1
Lalit Agarwal,A Research Study on User Concerns Regarding Online Advertising,2013,0
Lalit Agarwal,DEVELOPING A SELECTIVE AD-BLOCKING TOOL,N/A,0
Leesha Maliakal Shah,Agile research studios: Orchestrating communities of practice to advance research training,2017,49
Leesha Maliakal Shah,The design risks framework: Understanding metacognition for iteration,2020,27
Leesha Maliakal Shah,Planning to iterate: Supporting iterative practices for real-world ill-structured problem-solving,2018,25
Leesha Maliakal Shah,Defining and assessing risk analysis: The key to strategic iteration in real-world problem solving,2018,13
Leesha Maliakal Shah,MindYoga: Scaffolding the Metacognitive Reflection Process within Learning Ecosystems,2022,2
Leesha Maliakal Shah,CrowdCheer: Situational Crowdsourcing of Motivation for Runners,2015,1
Leesha Maliakal Shah,Agile Research Studios: Learning Ecosystems to Scale Effective Research Training,2023,0
Maxime Reynal,How neurophysiological measures can be used to enhance the evaluation of remote tower solutions,2019,29
Maxime Reynal,Pilot flying vs. pilot monitoring during the approach phase: An eye-tracking study,2016,26
Maxime Reynal,Human-machine interaction assessment by neurophysiological measures: a study on professional air traffic controllers,2018,21
Maxime Reynal,Investigating pilot’s decision making when facing an unstabilized approach: an eye-tracking study,2017,16
Maxime Reynal,Audio Focus: Interactive spatial sound coupled with haptics to improve sound source location in poor visibility,2019,11
Maxime Reynal,Investigating Multimodal Augmentations Contribution to Remote Control Tower Contexts for Air Traffic Management,2019,6
Maxime Reynal,Avoiding collisions when interacting with levitating particle displays,2020,5
Maxime Reynal,"Involving hearing, haptics and kinesthetics into non-visual interaction concepts for an augmented remote tower environment",2020,2
Maxime Reynal,"Non-visual interaction concepts: considering hearing, haptics and kinesthetics for an augmented remote tower environnment",2019,1
Maxime Reynal,Towards Adding Pseudo-Haptic Effects to Acoustic Levitation Displays,2021,0
Maxime Reynal,Method and apparatus monitoring a space,2019,0
Maxime Reynal,Virtual Reality platform to assess air traffic controllers’ performance in Control Tower Operations,2017,0
Wael Aboulsaadat,Multilingual compiler system and method,2006,49
Wael Aboulsaadat,A review of machine learning approaches for epileptic seizure prediction,2019,21
Wael Aboulsaadat,An empirical comparison of transparency on one and two layer displays,2005,15
Wael Aboulsaadat,Rules on wheels: A serious game for teaching traffic signs,2016,11
Wael Aboulsaadat,System and method for enhancing prayer and healing rituals,2014,11
Wael Aboulsaadat,Visual Craft: A Visual Integrated Development Environment,1997,6
Wael Aboulsaadat,AirDisplay: Experimenting with air flow as a communication medium,2015,4
Wael Aboulsaadat,Electronic Prayer Rug: Design and Evaluation,2012,0
Wael Aboulsaadat,Evaluation of a Transparent Two-layer Display,2004,0
Wael Aboulsaadat,Principles of Programming Languages VI,N/A,0
Wael Aboulsaadat,Joystick Keyboard: Physically Integrated Typing and Pointing,N/A,0
Eivind Flobak,Participatory design of VR scenarios for exposure therapy,2019,42
Eivind Flobak,Designing chatbots for guiding online peer support conversations for adults with ADHD,2019,19
Eivind Flobak,A Conversational Interface for Self-screening for ADHD in Adults,2019,18
Eivind Flobak,Designing videos with and for adults with ADHD for an online intervention: participatory design study and thematic analysis of evaluation,2021,11
Eivind Flobak,Development of a framework and the content for a psychoeducational internet-delivered intervention for women after treatment for gynecological cancer,2021,8
Eivind Flobak,Towards technology-based interventions for improving emotional and cognitive control,2018,8
Eivind Flobak,Designing data-driven interventions for mental health care,2017,5
Eivind Flobak,In Case of an Emergency: The Development and Effects of a Digital Intervention for Coping With Distress in Norway During the COVID-19 Pandemic,2021,3
Eivind Flobak,“This is the story of me”: Designing audiovisual narratives to support reflection on cancer journeys,2021,3
Eivind Flobak,"Meaningful Engagement with Digital Health Interventions: Experience, Participation and Design",2023,0
Ardam Dodokh,Impact of Social Media Usage on Organizational Performance in the Jordanian Dead Sea Cosmetic Sector,2019,65
