Author Name,Title,Year,Citations
Michael Xuelin Huang,Situation awareness enhancement of cockpit synthetic vision system: Visualization of tunnel-in-the-sky,2009,3
Michael Xuelin Huang,Towards real-time heart health monitoring in firefighting using convolutional neural networks,2023,2
Michael Xuelin Huang,Exploiting Security Dependence for Conditional Speculation Against Spectre Attacks,2020,2
Michael Xuelin Huang,"Mobile DJ: a tangible, mobile platform for active and collaborative music listening",2013,2
Michael Xuelin Huang,An improved algorithm for motion graph and its application in intelligent obstacle avoidance,2010,1
Michael Xuelin Huang,Smartphone Semi-unlock by Grip Authentication,2023,0
Michael Xuelin Huang,Aggregating Sensor Data from User Devices at a Fire Scene to Support Rescue Operations,2023,0
Michael Xuelin Huang,Group Activity Recognition in Restaurants to Address Underlying Needs: A Case Study,2022,0
Michael Xuelin Huang,TACTILE TEXTURES FOR BACK OF SCREEN GESTURE DETECTION USING MOTION SENSOR DATA AND MACHINE LEARNING,2019,0
Michael Xuelin Huang,DETECTING GESTURES UTILIZING MOTION SENSOR DATA AND MACHINE LEARNING,2019,0
Michael Xuelin Huang,DETECTING ATTRIBUTES OF USER INPUTS UTILIZING MOTION SENSOR DATA AND MACHINE LEARNING,2019,0
Michael Xuelin Huang,A Framework for Personal Emotion Categorization and Visual Attention Estimation,2016,0
Michael Xuelin Huang,Flight operation-oriented Tunnel-in-the-Sky design,2010,0
Michael Xuelin Huang,Response-based interactive motion generation,2010,0
Alex Sciuto,""" Hey Alexa, What's Up?"" A Mixed-Methods Studies of In-Home Conversational Agent Usage",2018,423
Alex Sciuto,Investigating how experienced UX designers effectively work with machine learning,2018,234
Alex Sciuto,State of the geotags: Motivations and recent changes,2017,66
Alex Sciuto,Curatorial agents: How systems shape our understanding of personal and familial digital information,2015,45
Alex Sciuto,Share and share alike? An exploration of secure behaviors in romantic relationships,2018,43
Alex Sciuto,"Our house, in the middle of our tweets",2016,15
Alex Sciuto,Better organization or a source of distraction? Introducing digital peer feedback to a paper-based classroom,2017,9
Alex Sciuto,A mixed-methods studies of in-home conversational agent usage,2018,5
Alex Sciuto,"“Hey Alexa, what's up?”: studies of in-home conversational agent usage,”",N/A,5
Alex Sciuto,Data Visualization for Medical Price Education and Transparency,2015,0
Nicolas d'Alessandro,Human-centred machine learning,2016,168
Nicolas d'Alessandro,A comparative study of pitch extraction algorithms on a large variety of singing sounds,2013,110
Nicolas d'Alessandro,Handsketch bi-manual controller: investigation on expressive control issues of an augmented tablet,2007,44
Nicolas d'Alessandro,Real-time calm synthesizer new approaches in hands-controlled voice synthesis,2006,44
Nicolas d'Alessandro,Reactive and continuous control of HMM-based speech synthesis,2012,36
Nicolas d'Alessandro,Reactive and continuous control of HMM-based speech synthesis,2012,36
Nicolas d'Alessandro,A quantitative comparison of glottal closure instant estimation algorithmson a large variety of singing sounds,2013,28
Nicolas d'Alessandro,Realtime and accurate musical control of expression in singing synthesis,2007,25
Nicolas d'Alessandro,The speech conductor: gestural control of speech synthesis,2005,22
Nicolas d'Alessandro,SQUEEZY: Extending a Multi-touch Screen with Force Sensing Objects for Controlling Articulatory Synthesis.,2011,20
Nicolas d'Alessandro,Audiocycle: Browsing musical loop libraries,2009,20
Nicolas d'Alessandro,An HMM-based speech-smile synthesis system: An approach for amusement synthesis,2015,19
Nicolas d'Alessandro,Designing speech and language interactions,2014,18
Nicolas d'Alessandro,Hidden Markov model based real-time motion recognition and following,2014,17
Nicolas d'Alessandro,Motion machine: A new framework for motion capture signal feature prototyping,2015,16
Nicolas d'Alessandro,A Digital Mobile Choir: Joining Two Interfaces towards Composing and Performing Collaborative Mobile Music.,2012,16
Nicolas d'Alessandro,MAGE-A Platform for Tangible Speech Synthesis.,2012,16
Nicolas d'Alessandro,Feature extraction and expertise analysis of pianists’ Motion-Captured Finger Gestures,2015,12
Nicolas d'Alessandro,pHTS for Max/MSP: A streaming architecture for statistical parametric speech synthesis,2011,12
Nicolas d'Alessandro,pHTS for Max/MSP: A streaming architecture for statistical parametric speech synthesis,2011,12
Nicolas d'Alessandro,MAGE 2.0: New Features and its Application in the Development of a Talking Guitar.,2013,11
Nicolas d'Alessandro,Voice source parameters estimation by fitting the glottal formant and the inverse filtering open phase,2008,11
Nicolas d'Alessandro,Airpiano: A multi-touch keyboard with hovering control,2015,10
Nicolas d'Alessandro,Vuzik: A painting graphic score interface for composing and control of sound generation,2012,10
Nicolas d'Alessandro,Vocal synthesis and graphical representation of the phonetic gestures underlying guitar timbre description,2005,10
Nicolas d'Alessandro,Glottal source estimation robustness,2008,9
Nicolas d'Alessandro,Reactive statistical mapping: Towards the sketching of performative control with data,2014,8
Nicolas d'Alessandro,Causal/anticausal decomposition for mixed-phase description of brass and bowed string sounds,2007,8
Nicolas d'Alessandro,Exploration of a stylistic motion space through realtime synthesis,2014,7
Nicolas d'Alessandro,Reactive accent interpolation through an interactive map application,2013,7
Nicolas d'Alessandro,Realtime and Accurate Musical Control of Expression in Voice Synthesis,2009,7
Nicolas d'Alessandro,MaxMBROLA: A Max/MSP MBROLA-based tool for real-time voice synthesis,2005,7
Nicolas d'Alessandro,Glottal source estimation robustness: A comparison of sensitivity of voice source estimation techniques,2020,6
Nicolas d'Alessandro,A novel tool for motion capture database factor statistical exploration,2016,6
Nicolas d'Alessandro,ROOM# 81-Agent-Based Instrument for Experiencing Architectural and Vocal Cues.,2011,6
Nicolas d'Alessandro,Audiocycle: A similarity-based visualization of musical libraries,2009,6
Nicolas d'Alessandro,Advanced Techniques for Vertical Tablet Playing A Overview of Two Years of Practicing the HandSketch 1. x.,2009,6
Nicolas d'Alessandro,RAMCESS/handsketch: a multi-representation framework for realtime and expressive singing synthesis.,2007,6
Nicolas d'Alessandro,Comparing time-domain and spectral-domain voice source models for gesture controlled vocal instruments,2006,6
Nicolas d'Alessandro,Synthèse de l’imitation vocale et representation graphique des gestes phonétiques sous-jacents à la description du timbre de la guitare classique,2005,6
Nicolas d'Alessandro,Investigation of Gesture Controlled Articulatory Vocal Synthesizer using a Bio-Mechanical Mapping Layer.,2012,5
Nicolas d'Alessandro,sHTS: A streaming architecture for statistical parametric speech synthesis,2011,5
Nicolas d'Alessandro,Pure Data External for Reactive HMM-based Speech and Singing Synthesis,2013,3
Nicolas d'Alessandro,L’ethnomusicologie et l’informatique: une rencontre nécessaire,2012,3
Nicolas d'Alessandro,Analysis-by-Performance: Gesturally-Controlled Voice Synthesis as an Input for Modelling of Vibrato in Singing,2011,3
Nicolas d'Alessandro,Ubiquitous voice synthesis: interactive manipulation of speech and singing on mobile distributed platforms,2011,3
Nicolas d'Alessandro,Handsketch: Bi-Manual Control of Voice Quality Dimensions and Long Term Practice Issues,2009,3
Nicolas d'Alessandro,Ramcess: Realtime and accurate musical control of expression in singing synthesis,2006,3
Nicolas d'Alessandro,Towards a Dynamic Model of the Palm Mute Guitar Technique Based on Capturing Pressure Profiles Between the Guitar Strings,2014,2
Nicolas d'Alessandro,MAGE: A Platform for Performative Speech Synthesis-New Approach in Exploring Applications Beyond Text-To-Speech,2012,2
Nicolas d'Alessandro,Performance: what does a body know?,2011,2
Nicolas d'Alessandro,Bringing Bio-Mechanical Modelling of the OPAL Complex as a Mapping Layer for Performative Speech Synthesis,2011,2
Nicolas d'Alessandro,RAMCESS framework 2.0 Realtime and Accurate Musical Control of Expression in Singing Synthesis,2007,2
Nicolas d'Alessandro,"Aura Pon, Johnty Wang, David Eagle, Ehud Sharlin, and Sidney Fels. 2012. A Digital Mobile Choir: Joining Two Interfaces towards Composing and Performing Collaborative Mobile Music",N/A,2
Nicolas d'Alessandro,Prototyping a New Audio-Visual Instrument Based on Extraction of High-Level Features on Full-Body Motion,2016,1
Nicolas d'Alessandro,Full-Body Gait Reconstruction Using Covariance-Based Mapping Within a Realtime HMM-Based Framework,2014,1
Nicolas d'Alessandro,PENny: An Extremely Low-Cost Pressure-Sensitive Stylus for Existing Capacitive Touchscreens.,2013,1
Nicolas d'Alessandro,Vox Tactum Meets Chorus Digitalis: Seven Years of Singing Surfaces,2013,1
Nicolas d'Alessandro,Mageface: Performative conversion of facial characteristics into speech synthesis parameters,2013,1
Nicolas d'Alessandro,Is This Guitar Talking or What!?,2012,1
Nicolas d'Alessandro,MageFaceOSC: Performative speech synthesis based on realtime face tracking,2012,1
Nicolas d'Alessandro,MAGE/pHTS in Collaborative Vocal Puppetry (CoVoP)-Multi-user performative HMM-based voice synthesis on distributed platforms,2011,1
Nicolas d'Alessandro,Mediablender: Interactive multimedia segmentation,2011,1
Nicolas d'Alessandro,TOuch ThE Music: Displaying Live Music into Vibration,2022,0
Nicolas d'Alessandro,Proceedings of eNTERFACE 2015 Workshop on Intelligent Interfaces,2018,0
Nicolas d'Alessandro,Designing for the Subtle: A Systematic Approach Toward Expressivity in New Musical Interfaces,2017,0
Nicolas d'Alessandro,"EMOSPACE 2015: Emotion representation, analysis and synthesis in continuous time and space",2015,0
Nicolas d'Alessandro,"Intelligent Technologies for Interactive Entertainment: 5th International ICST Conference, INTETAIN 2013, Mons, Belgium, July 3-5, 2013, Revised Selected Papers",2013,0
Nicolas d'Alessandro,MAGE:: A Platform For Reactive HMM-based Speech & Singing Synthesis,2013,0
Nicolas d'Alessandro,Actes des Journées de l'Informatique Musicale 2012,2012,0
Nicolas d'Alessandro,EGT}: Enriched Guitar Transcription},2012,0
Nicolas d'Alessandro,LoopJam: turning the dance floor into a collaborative instrumental map,2012,0
Nicolas d'Alessandro,CoVoP-Collaborative Vocal Puppetry Multi-User Performative Voice Synthesis on Distributed Platorms,2011,0
Nicolas d'Alessandro,First International Workshop on Performative Speech and Singing Synthesis,2011,0
Nicolas d'Alessandro,pHTS for Max/MSP: A Streaming Architecture for Statistical Parametric Speech Synthesis,2011,0
Nicolas d'Alessandro,ROOM# 81–An Architectural Instrument for Exploring Human Control of Primitive Vocal Cues,2011,0
Nicolas d'Alessandro,Project# 3.3: expressive violin synthesis: a study case in realtime manipulation of complex data structures,2008,0
Nicolas d'Alessandro,EXPRESSIVE VIOLIN SYNTHESIS: A STUDY CASE IN REALTIME MANIPULATION OF COMPLEX DATA STRUCTURES,2008,0
Nicolas d'Alessandro,Cent Voies,2008,0
Nicolas d'Alessandro,Improvisation for Guitar/Laptop and HandSketch,2008,0
Nicolas d'Alessandro,Project# 3.3: expressive violin synthesis: a study case in realtime manipulation of complex data structures,2008,0
Nicolas d'Alessandro,HTS-A HMM-based Speech Synthesis System,2007,0
Nicolas d'Alessandro,MAXMBROLA: A MAX/MSP MBROLA− BASED TOOL FOR REAL− TIME VOICE SYNTHESIS (ThuAmPO2),N/A,0
Nicolas d'Alessandro,ENTERFACE’09 COMPLETE PROJECT PROPOSAL: MULTIMODAL GUITAR: PERFORMANCE TOOLKIT AND/OR STUDY WORKBENCH,N/A,0
Nicolas d'Alessandro,Vox Tactum Mobile Device Choir Performance,N/A,0
Nicolas d'Alessandro,Expressive Control of Violin Sounds Based on Causal/Anticausal Decomposition,N/A,0
Nicolas d'Alessandro,AudioCycle: A similarity-based visualization of musical libraries,N/A,0
Nicolas d'Alessandro,Is this guitar talking or what!?,N/A,0
Nicolas d'Alessandro,TRANSVOICE TABLE,N/A,0
Nicolas d'Alessandro,Realtime Control of Mixed-Phase Representation of Voice and Instrumental Sounds,N/A,0
Angelo Cafaro,First impressions: users’ judgments of virtual agents’ personality and interpersonal attitude in first encounters,2012,140
Angelo Cafaro,First Impressions in Human--Agent Virtual Encounters,2016,123
Angelo Cafaro,The NoXi database: multimodal recordings of mediated novice-expert interactions,2017,104
Angelo Cafaro,The Effects of Interrupting Behavior on Interpersonal Attitude and Engagement in Dyadic Interactions,2016,56
Angelo Cafaro,Conversational behavior reflecting interpersonal attitudes in small group interactions,2015,46
Angelo Cafaro,Suggestions for extending saiba with the vib platform,2014,45
Angelo Cafaro,Analyzing first impressions of warmth and competence from observable nonverbal cues in expert-novice interactions,2017,40
Angelo Cafaro,The effects of interpersonal attitude of a group of agents on user’s presence and proxemics behavior,2016,39
Angelo Cafaro,The effects of interpersonal attitude of a group of agents on user’s presence and proxemics behavior,2016,39
Angelo Cafaro,Ask Alice: an artificial retrieval of information agent,2016,33
Angelo Cafaro,Animating idle gaze in public places,2009,33
Angelo Cafaro,Representing communicative functions in SAIBA with a unified function markup language,2014,31
Angelo Cafaro,Fostering user engagement in face-to-face human-agent interactions: a survey,2016,27
Angelo Cafaro,A Computational Model for Managing Impressions of an Embodied Conversational Agent in Real-Time,2019,19
Angelo Cafaro,Could a virtual agent be warm and competent? investigating user's impressions of agent's non-verbal behaviours,2017,18
Angelo Cafaro,First Impressions in User-Agent Encounters: The Impact of an Agent’s Nonverbal Behavior on Users’ Relational Decisions.,2013,15
Angelo Cafaro,"Addressing the need for safe, nutritious and sustainable food: Outcomes of the “ONE–Health, Environment & Society–Conference 2022 ″",2022,14
Angelo Cafaro,Evaluating Social Attitudes of a Virtual Tutor,2016,14
Angelo Cafaro,Selecting and Expressing Communicative Functions in a SAIBA-Compliant Agent Framework,2017,13
Angelo Cafaro,Interpersonal attitude of a speaking agent in simulated group conversations,2014,8
Angelo Cafaro,Exploiting evolutionary algorithms to model nonverbal reactions to conversational interruptions in user-agent interactions,2019,7
Angelo Cafaro,Perceiving attitudes expressed through nonverbal behaviors in immersive virtual environments,2016,7
Angelo Cafaro,Étude des effets de différents types de comportements non-verbaux sur la perception d’un agent virtuel,N/A,4
Angelo Cafaro,Impression Detection and Management Using an Embodied Conversational Agent,2020,3
Angelo Cafaro,Nonverbal behavior in multimodal performances,2019,3
Angelo Cafaro,Investigating user’s first impressions of a virtual agent’s warmth and competence traits.,N/A,2
Angelo Cafaro,[Complete volume]. Proceedings of the Workshop on Architectures and Standards for Intelligent Virtual Agents at IVA 2014,2014,0
Angelo Cafaro,Architectures and Standards for Intelligent Virtual Agents at IVA 2014,N/A,0
Angelo Cafaro,Simulating the Idle Gaze Behavior of Pedestrians in Motion,N/A,0
Bin Xu,Personality-targeted gamification: a survey study on personality traits and motivational affordances,2016,305
Bin Xu,Automatic archiving versus default deletion: what Snapchat tells us about ephemerality in design,2016,149
Bin Xu,"Who should I add as a"" friend""? A study of friend recommendations using proximity and homophily",2013,35
Bin Xu,Attention from afar: simulating the gazes of remote participants in hybrid meetings,2017,32
Bin Xu,Using proximity and homophily to connect conference attendees in a mobile social network,2012,31
Bin Xu,Two is better than one: improving multilingual collaboration by giving two machine translation outputs,2015,30
Bin Xu,Physical proximity and online user behaviour in an indoor mobile social networking application,2011,29
Bin Xu,Connecting people at a conference: A study of influence between offline and online using a mobile social application,2012,26
Bin Xu,Social linking and physical proximity in a mobile location-based service,2011,24
Bin Xu,Improving machine translation by showing two outputs,2014,23
Bin Xu,How beliefs about the presence of machine translation impact multilingual collaborations,2014,23
Bin Xu,Connecting people through physical proximity and physical resources at a conference,2013,23
Bin Xu,On how event size and interactivity affect social networks,2013,23
Bin Xu,Linking people through physical proximity in a conference,2012,21
Bin Xu,Using physical context in a mobile social networking application for improving friend recommendations,2011,16
Bin Xu,Connecting people in the workplace through ephemeral social networks,2011,14
Bin Xu,Sobot: Facilitating conversation using social media data and a social agent,2014,12
Bin Xu,Designing the Interplay between Anonymity and Publicity for Online Social Support,2017,8
Bin Xu,"De-emphasizing content to study the relationship between meaning, messages, and content in im systems",2017,7
Bin Xu,Connecting people through physical resources in an office environment,2011,5
Bin Xu,From offline to online: connecting people with a mobile social networking application at a conference,2014,3
Bin Xu,Displaying the simulated gazes of multiple remote participants to participants collocated in a meeting space,2018,2
Bin Xu,Raising awareness of conveyed personality in social media traces,2017,1
Bin Xu,"Designing Computer Mediated Communication Through Alternatives: Digital Ephemerality, Content De-Emphasis and Their Implications",2017,1
Bin Xu,Let me show you what i read: exploring referencing strategies for e-books,2013,1
Bin Xu,Tone optimization for digital content,2020,0
Bin Xu,Human-Agent Collaboration in Meetings,2017,0
Bin Xu,InsightMe: Raising Awareness of Conveyed Personality in Social Media Traces,2016,0
Bin Xu,Indoor spatial resource utilization analyzing system using mobile social network,2011,0
Bin Xu,Let Me Show You What I Read,N/A,0
Matthias Korn,Creating friction: Infrastructuring civic engagement in everyday life,2015,114
Matthias Korn,From facebook to the neighbourhood: Infrastructuring of hybrid community engagement,2017,104
Matthias Korn,Public deliberation in municipal planning: supporting action and reflection with mobile technology,2011,78
Matthias Korn,"Caring for IT security: Accountabilities, moralities, and oscillations in IT security practices",2018,47
Matthias Korn,Three gaps in opening science,2019,44
Matthias Korn,Situating Engagement: Ubiquitous Infrastructures for In-Situ Civic Engagement,2013,44
Matthias Korn,Grounded design. A research paradigm in practice-based computing,2018,41
Matthias Korn,Hacking as transgressive infrastructuring: Mobile phone networks and the German Chaos Computer Club,2016,38
Matthias Korn,Looking ahead how field trials can work in iterative and exploratory design of ubicomp systems,2012,37
Matthias Korn,(Infra) structures of volunteering,2015,32
Matthias Korn,WiFi proximity detection in mobile web applications,2014,28
Matthias Korn,Talking it further: from feelings and memories to civic discussions in and about places,2012,25
Matthias Korn,Participatory IT in semi-public spaces,2014,23
Matthias Korn,Infrastructuring publics: A research perspective,2019,21
Matthias Korn,Supporting everyday philanthropy: Care work in situ and at scale,2017,21
Matthias Korn,Infrastructuring publics,2019,18
Matthias Korn,From workshops to walkshops: Evaluating mobile location-based applications in realistic settings,2010,18
Matthias Korn,Designing against the status quo,2018,14
Matthias Korn,Local area artworks: collaborative art interpretation on-site,2013,14
Matthias Korn,Putting 'local' back into public Wifi hotspots,2012,12
Matthias Korn,"Friction in arenas of repair: Hacking, security research, and mobile phone infrastructure",2017,9
Matthias Korn,Designing against the status quo,2016,9
Matthias Korn,Learning support through scaffolding collaborative project work,2009,8
Matthias Korn,Experiences from a Real-Time Mobile Collaborative Writing System in an Art Gallery,2013,7
Matthias Korn,E-infrastructures for research collaboration: the case of the social sciences and humanities,2017,6
Matthias Korn,Understanding use situated in real-world mobile contexts,2010,6
Matthias Korn,Procs of the Communications and Technology (C&T) 2011 Workshop on Government and Citizen Engagement,2011,5
Matthias Korn,Untersuchungen zur Messung der Energie von Elektronen und geladenen Pionen mit dem Flüssigargon-Kalorimeter des Detektors H1,1994,5
Matthias Korn,Place and Situated Deliberation in Participatory Planning – A Research Proposal,2011,4
Matthias Korn,Collaborative Project Work in Intercultural Computer Clubs,2011,2
Matthias Korn,How come_IN computer clubs may foster collaboration in an intercultural neighborhood,2009,2
Matthias Korn,Splatch 2: Projektmanagement für gruppenorientierte Projektarbeit in interkulturellen Computerclubs,2009,2
Matthias Korn,Nomadic Culture in Academic Settings: Pervasive Commuting and Institutional Support as Defining Elements,2017,1
Matthias Korn,Hybrid wireless networks for neighborhood communities,2015,1
Matthias Korn,Surprise trips: A system to augment the natural experience of exploration,2010,1
Matthias Korn,Scaffolding collaborative project work in end-user development,2009,1
Matthias Korn,„Das Organizational Culture Profile “Theoriebasierte Analyse einer Kulturanalysetechnik,2007,1
Matthias Korn,ECSCW 2013 Adjunct Proceedings,2013,0
Matthias Korn,"ECSCW 2013 Adjunct Proceedings The 13th European Conference on Computer Supported Cooperative Work 21-25. September 2013, Paphos, Cyprus",2013,0
Matthias Korn,On the Degree of Participant Commitment in Non-Work Settings,2012,0
Matthias Korn,"International Reports on Socio-Informatics (IRSI): Special Issue. Vol. 8, Issue 2. Proceedings of the C&T 2011 Workshop on Government and Citizen Engagement",2011,0
Matthias Korn,Introduction to the Workshop on Government and Citizen Engagement,2011,0
Matthias Korn,Methodological Reflections on Working with Young Children,2009,0
Matthias Korn,Zitronen oder Trittbrettfahrer: Warum es unsichere Software gibt,2007,0
Kazutaka Kurihara,Optical motion capture system with pan-tilt camera tracking and real time data processing,2002,142
Kazutaka Kurihara,Presentation sensei: a presentation training system using speech and image processing,2007,99
Kazutaka Kurihara,Speech pen: predictive handwriting based on ambient multimodal recognition,2006,55
Kazutaka Kurihara,Method of processing passive optical motion capture data,2003,52
Kazutaka Kurihara,プレゼン先生: 音声情報処理と画像情報処理を用いたプレゼンテーションのトレーニングシステム,2006,40
Kazutaka Kurihara,編集と発表を電子ペンで統一的に行うプレゼンテーションツールとその教育現場への応用,2006,38
Kazutaka Kurihara,CinemaGazer: a system for watching videos at very high speed,2012,36
Kazutaka Kurihara,Dining Presenter: Augmented Reality system for a dining tabletop,2009,30
Kazutaka Kurihara,On-Air Forum: リアルタイムコンテンツ視聴中のコミュニケーション支援システムの設計とその実証実験,2011,22
Kazutaka Kurihara,"Body dynamics calculation method, body dynamics model and model data thereof, and body-model generation method",2009,17
Kazutaka Kurihara,Speechjammer: A system utilizing artificial speech disturbance with delayed auditory feedback,2012,16
Kazutaka Kurihara,Flexible timeline user interface using constraints,2005,15
Kazutaka Kurihara,シースルー型 HMD を用いた社会福祉学的アプローチに基づく “視線恐怖症的コミュ障” 支援システムの開発と検証,2016,12
Kazutaka Kurihara,拡張現実食卓における彩りと物語の調理システム,2008,12
Kazutaka Kurihara,Toolification of games: achieving non-game purposes in the redundant spaces of existing games,2015,11
Kazutaka Kurihara,いろどりん: 食卓の彩り支援システム (料理メディア研究会特別セッション),2008,11
Kazutaka Kurihara,A flexible presentation tool for diverse multi-display environments,2007,11
Kazutaka Kurihara,Toolification of games: 既存ゲームの余剰自由度の中で非ゲーム的目的を達成するゲーミフィケーション周辺概念の提案と検討,2017,9
Kazutaka Kurihara,SpeechJammer: 聴覚遅延フィードバックを利用した発話阻害の応用システム,2010,9
Kazutaka Kurihara,SlideChecker: プレゼンテーション資料の基礎的な定量的自動評価手法,2009,9
Kazutaka Kurihara,CinemaGazer: 動画の極限的な高速鑑賞のためのシステムの開発と評価,2012,8
Kazutaka Kurihara,音声ペン: 音声認識結果を手書き文字入力で利用できる新たなペン入力インタフェース,2006,8
Kazutaka Kurihara,ことだま: ペンベース電子プレゼンテーションの提案,2004,7
Kazutaka Kurihara,356 高速動力学計算法を用いた詳細人体モデルに基づく人間の力学計算,2002,7
Kazutaka Kurihara,Optical cockpit for humanoid tele-operation with realtime motion capture system,2002,7
Kazutaka Kurihara,動画共有サイトでの視線共有の試み,2012,6
Kazutaka Kurihara,What do Interactive Whiteboards and Tablet PCs bring to a classroom?,2011,6
Kazutaka Kurihara,スライド提示型プレゼンテーション方法論の拡張手法を定量的に評価する研究,2010,6
Kazutaka Kurihara,A system to enrich food color,2008,6
