Author Name,Title,Year,Citations
Vittorio Fuccella,The design and evaluation of a text editing technique for stylus-based tablets,2017,3
Vittorio Fuccella,Euler diagram codes: interpretation and generation,2013,3
Vittorio Fuccella,Identifying attachment areas on sketched symbols,2011,3
Vittorio Fuccella,Case Studies on the Support of Computer Managed Instruction Functionalities in e-Learning Systems,2006,3
Vittorio Fuccella,A Web-based Computer Aided Assessment Tool Supporting Question Quality Improvement,2005,3
Vittorio Fuccella,A technique to improve text editing on smartphones,2022,2
Vittorio Fuccella,Domus: a multi-user TUI game for multi-touch tables,2020,2
Vittorio Fuccella,ParVis: a visual tool for exploring parser execution traces,2020,2
Vittorio Fuccella,Curve-based diagram specification and construction,2013,2
Vittorio Fuccella,Full Formative Assessment based on Educational Video Games.,2010,2
Vittorio Fuccella,"An architecture for user-centric identity, profiling and reputation services",2009,2
Vittorio Fuccella,Methods and Tools for Computer Assisted Learning and Assessment,2007,2
Vittorio Fuccella,LOG4P: An innovative logger framework for web portals,2007,2
Vittorio Fuccella,A Framework for the Support of the SCORM Run-Time Environment,2004,2
Vittorio Fuccella,The Impact of the COVID-19 Pandemic on Human–Computer Interaction Empirical Research,2023,1
Vittorio Fuccella,Speech Recognition in Healthcare: A Comparison of Different Speech Recognition Input Interactions,2023,1
Vittorio Fuccella,Quality issues in co-authorship data of a national scientific community,2023,1
Vittorio Fuccella,Youcare: a cross-platform telehealth app for COVID-19,2021,1
Vittorio Fuccella,Using web scraping techniques to derive co-authorship data: insights from a case study,2018,1
Vittorio Fuccella,TEco: an integration model to augment the Web with a trust area for inter-pares interactions.,2015,1
Vittorio Fuccella,Fast prototyping of visual languages using local context-based specifications.,2015,1
Vittorio Fuccella,KeyScretch on android tablets and smartphones,2013,1
Vittorio Fuccella,A Sketch-Based System for Teaching Geometry.,2011,1
Vittorio Fuccella,eWorkbook: an On-Line Testing System with Test Visualization Functionalities,2009,1
Vittorio Fuccella,eWorkbook: a Web based tool for assessment and self-assessment,2004,1
Vittorio Fuccella,LLMs in HCI Data Work: Bridging the Gap Between Information Retrieval and Responsible Research Practices,2024,0
Vittorio Fuccella,LLMs in HCI Data Work: Bridging the Gap Between Information Retrieval and Responsible Research Practices,2024,0
Vittorio Fuccella,Gesture‐Based Computing,2023,0
Vittorio Fuccella,Arrow2edit: A Technique for Editing Text on Smartphones,2023,0
Vittorio Fuccella,Check for updates Speech Recognition in Healthcare: A Comparison of Different Speech Recognition Input Interactions,2023,0
Vittorio Fuccella,DrawSE2: an application for the visual definition of visual languages using the local context-based visual language specification,2022,0
Vittorio Fuccella,iFree: design and evaluation of a pointing method for disabled users on mobile devices,2020,0
Vittorio Fuccella,Web-based Data Collection and Quality Issues in Co-Authorship Network Analysis,2019,0
Vittorio Fuccella,Exploring co-authorship networks in Statistics: methodological issues and empirical results,2018,0
Vittorio Fuccella,A Software System in Support of Quality of Degree Programmes,2016,0
Vittorio Fuccella,Co-authorship networks and scientific performance. Evidences from a case study by using different bibliographic archives,2016,0
Vittorio Fuccella,Improving Co-authorship Network Structures by Combining Heterogeneous Data Sources,2016,0
Vittorio Fuccella,A graphical review of visual language research,2015,0
Vittorio Fuccella,Improving co-authorship network structure by combining different data sources: issues and practical considerations,2015,0
Vittorio Fuccella,Co-authorship Patterns of Italian Statisticians by Combining Different Data Sources,2014,0
Vittorio Fuccella,Analysis of scientific collaboration and academic performance. Evidence from the co-authorship network of the Italian statisticians,2014,0
Vittorio Fuccella,Co-autorship networks and scientific performance of Italian academic statisticians,2013,0
Vittorio Fuccella,Slide Test Maker An Educational Software Tool for Test Composition,2012,0
Vittorio Fuccella,A video game to learn KeyScretch,2012,0
Vittorio Fuccella,A Comparison of Gesture Interpretation TEchniques for KeyScretch Text Entry Method,2011,0
Vittorio Fuccella,Improving Accuracy of Gestural Text Entry Through Sketch Recognition Techniques,2010,0
Vittorio Fuccella,A visual system for analyzing user behaviour in web tasks,2009,0
Vittorio Fuccella,Methods and Tools for Online Objective Testing,2009,0
Vittorio Fuccella,Logging and Analyzing Learner Behavior in Web-Based E-testing,2007,0
Vittorio Fuccella,Java Portals and Java Portlet Specification and API,2007,0
Vittorio Fuccella,Un framework per il supporto delle funzionalità di Computer Managed Instruction nei Learning Management System,2005,0
Vittorio Fuccella,Question Selection from a Hierarchical Repository in a Computer Aided Assessment Tool,2004,0
Vittorio Fuccella,"IEEE Systems, Man, and Cybernetics Society",N/A,0
Vittorio Fuccella,Co-authorship Patterns of Italian Statisticians by Combining Different Data Sources,N/A,0
Vittorio Fuccella,Metodi e Strumenti per l’E-Testing,N/A,0
George E. Raptis,Effects of mixed-reality on players’ behaviour and immersion in a cultural tourism game: A cognitive processing perspective,2018,125
George E. Raptis,The Role of Eye Gaze in Security and Privacy Applications: Survey and Future HCI Research Directions,2020,118
George E. Raptis,Using eye gaze data and visual activities to infer human cognitive styles: method and feasibility studies,2017,117
George E. Raptis,Influences of Human Cognition and Visual Behavior on Password Security during Picture Password Composition,2018,62
George E. Raptis,A cognition-centered personalization framework for cultural-heritage content,2019,39
George E. Raptis,Do field dependence-independence differences of game players affect performance and behaviour in cultural heritage games?,2016,36
George E. Raptis,Using Eye Tracking to Identify Cognitive Differences: A Brief Literature Review,2016,34
George E. Raptis,Eye gaze-driven prediction of cognitive differences during graphical password composition,2018,30
George E. Raptis,"Better, Funner, Stronger: A Gameful Approach to Nudge People into Making Less Predictable Graphical Password Choices",2021,26
George E. Raptis,On implicit elicitation of cognitive strategies using gaze transition entropies in pattern recognition tasks,2017,25
George E. Raptis,Differences of field dependent/independent gamers on cultural heritage playing: Preliminary findings of an eye–tracking study,2016,23
George E. Raptis,Toward Understanding the Effects of Cognitive Styles on Collaboration in Multiplayer Games,2018,22
George E. Raptis,Do Game Designers’ Decisions Related to Visual Activities Affect Knowledge Acquisition in Cultural Heritage Games? An Evaluation From a Human Cognitive Processing Perspective,2019,21
George E. Raptis,Investigating the Effects of Individual Cognitive Styles on Collaborative Gameplay,2021,17
George E. Raptis,Towards gaze-based quantification of the security of graphical authentication schemes,2018,17
George E. Raptis,Cultural Heritage Gaming: Effects of Human Cognitive Styles on Players' Performance and Visual Behavior,2017,16
George E. Raptis,Does image grid visualization affect password strength and creation time in graphical authentication?,2018,15
George E. Raptis,MuMIA: Multimodal Interactions to Better Understand Art Contexts,2021,14
George E. Raptis,A Personalised Monitoring and Recommendation Framework for Kinetic Dysfunctions: The Trendelenburg Gait,2016,8
George E. Raptis,FoRePlan: Supporting Digital Forensics Readiness Planning for Internet of Vehicles,2021,7
George E. Raptis,On the Use of Persistent Spatial Points for Deploying Path Navigation in Augmented Reality: An Evaluation Study,2019,7
George E. Raptis,Towards a Cognition-Centered Personalization Framework for Cultural-Heritage Content,2018,7
George E. Raptis,A qualitative analysis of the effect of wholistic-analytic cognitive style dimension on the cultural heritage game playing,2016,7
George E. Raptis,Towards Automated Matching of Cyber Threat Intelligence Reports based on Cluster Analysis in an Internet-of-Vehicles Environment,2021,6
George E. Raptis,Visualization of Cultural-Heritage Content based on Individual Cognitive Differences.,2018,6
George E. Raptis,Supporting Designers in Creating Cognition-centered Personalized Cultural Heritage Activities,2019,5
George E. Raptis,UltraSonic Watch: Seamless Two-Factor Authentication through Ultrasound,2019,5
George E. Raptis,Do Cognitive Styles Influence Collective Sensemaking in Distributed Multiplayer Games?,2019,4
George E. Raptis,AVI-CH 2018: Advanced Visual Interfaces for Cultural Heritage,2018,4
George E. Raptis,CHISTA: cultural heritage information storage and reTrieval application,2018,4
George E. Raptis,Turn & Slide: Designing a Puzzle Game to Elicit the Visualizer-Verbalizer Cognitive Style,2023,3
George E. Raptis,"Special Issue on AI and HCI Methods and Techniques for Cultural Heritage Curation, Exploration and Fruition",2022,3
George E. Raptis,WhatShapeWhatColor: Designing a Puzzle Game to Elicit the Field Dependence-Independence Cognitive Style,2021,3
George E. Raptis,Analyzing Scanpaths From A Field Dependence-Independence Perspective When Playing A Visual Search Game,2021,3
George E. Raptis,"Effects of image-based rendering and reconstruction on game developers efficiency, game performance, and gaming experience",2017,3
George E. Raptis,CAVeCTIR: Matching Cyber Threat Intelligence Reports on Connected and Autonomous Vehicles Using Machine Learning,2022,2
George E. Raptis,Using Video-based Technology in Powerlifting Sport to Support Referees' Decision Making,2019,2
George E. Raptis,Towards Enhancing the Media Industry Through AI-Driven Image Recommendations,2023,1
George E. Raptis,Digital Forensic Readiness in Internet of Vehicles: The Denial-of-Service on CAN bus Case Study,2022,1
George E. Raptis,Introducing Privacy Preservation in Personalized Cultural Heritage Applications,2021,1
George E. Raptis,Eye-GUAna: Higher Gaze-Based Entropy and Increased Password Space in Graphical User Authentication Through Gamification,2021,1
George E. Raptis,AVI2CH 2020: Workshop on Advanced Visual Interfaces and Interactions in Cultural Heritage,2020,1
George E. Raptis,VirDO: A virtual workspace for research documents,2013,1
George E. Raptis,Towards Evaluating Image Recommendations in Digital News and Media Ecosystem,2023,0
George E. Raptis,Transforming Ideas into Code: A Novel Approach to Design-to-Development Workflow,2023,0
George E. Raptis,Exploring the Impact of Cognitive Styles on the Visualization of Privacy Policies,2023,0
George E. Raptis,Towards Run-Time Security Monitoring of Distributed Industrial Control Systems,2023,0
George E. Raptis,RePaLM: A Data-Driven AI Assistant for Making Stronger Pattern Choices,2023,0
George E. Raptis,14th International Workshop on Personalized Access to Cultural Heritage (PATCH 2023),2023,0
George E. Raptis,13th International Workshop on Personalized Access to Cultural Heritage (PATCH 2022)-Towards Hybrid CH Experience,2022,0
George E. Raptis,International Workshop on Personalized Access to Cultural Heritage,2021,0
George E. Raptis,Understanding and improving SIGCHI's volunteer experience,2020,0
George E. Raptis,Workshop on Personalized Access to Cultural Heritage: PATCH'20 Chairs' Welcome,2020,0
George E. Raptis,Workshop on Personalized Access to Cultural Heritage: PATCH'20,2020,0
George E. Raptis,A cognition-centered personalization framework for cultural-heritage applications,2020,0
George E. Raptis,DeCACHe: Supporting Designers in Creating Cognition-Centered Adaptive Cultural Heritage Activities,2019,0
George E. Raptis,Preface of 2nd workskhop on advanced visual interfaces for cultural heritage 2018 (AVI-CH 2018),2018,0
George E. Raptis,"Monitoring, Tracking, and Recording Pancreas-Related Health Issues in Real Time",2017,0
George E. Raptis,WHEAMO: A Wireless Health Platform for Monitoring Pancreas-Related Diseases,2017,0
George E. Raptis,ERMIS: Extracting Knowledge from Unstructured Big Data for Supporting Business Decision Making,2016,0
George E. Raptis,Design of a Mobile Computing System to Obtain Information From Cultural Heritage Sites,2015,0
Michiya Yamamoto,MobiGaze: Development of a gaze interface for handheld mobile devices,2010,75
Michiya Yamamoto,High temperature growth of ZnS and ZnMgS by molecular beam epitaxy under high sulfur beam pressure,2000,57
Michiya Yamamoto,Formation of size controlled Ge nanocrystals in SiO2 matrix by ion implantation and annealing,2000,46
Michiya Yamamoto,Gaze estimation method based on an aspherical model of the cornea: surface of revolution about the optical axis of the eye,2010,38
Michiya Yamamoto,Stroke and platelet glycoprotein Ibα polymorphisms,2001,38
Michiya Yamamoto,Timing control effects of utterance to communicative actions on embodied interaction with a robot,2004,26
Michiya Yamamoto,Time delay effects of utterance to communicative actions on greeting interaction by using a voice-driven embodied interaction system,2003,25
Michiya Yamamoto,"Gene trapping identifies chloride channel 4 as a novel inducer of colon cancer cell migration, invasion and metastases",2010,24
Michiya Yamamoto,Analysis by synthesis of embodied communication via virtualactor with a nodding response model,2008,21
Michiya Yamamoto,Time lag effects of utterance to communicative actions on CG character-human greeting interaction,2006,20
Michiya Yamamoto,Development of eye-tracking pen display based on stereo bright pupil technique,2010,18
Michiya Yamamoto,Effects of time lag of utterances to communicative actions on embodied interaction with robot and CG character,2008,18
Michiya Yamamoto,A NEW ULTRASONIC FLOWMETER FOR FLOWS IN LARGE CONDUITS AND OPEN CHANNELS.,1974,17
Michiya Yamamoto,Dynamic characteristics and seismic performance of traditional wooden structure by shaking table tests,2001,15
Michiya Yamamoto,Development of narrow gap hot-wire laser welding process for heat-resistant steel pipe for boiler,2012,13
Michiya Yamamoto,Development of an edutainment system with interactors of a teacher and a student in which a user plays a double role of them,2008,13
Michiya Yamamoto,Arginine vasopressin regulated ASCT1 expression in astrocytes from stroke-prone spontaneously hypertensive rats and congenic SHRpch1_18 rats,2014,12
Michiya Yamamoto,Gaze estimation method involving corneal reflection-based modeling of the eye as a general surface of revolution about the optical axis of the eye,2012,12
Michiya Yamamoto,Development of eye-tracking tabletop interface for media art works,2010,12
Michiya Yamamoto,Phase II study of 5'-DFUR (5'-deoxy-5-fluorouridine) by the Cooperative Study Group,1985,12
Michiya Yamamoto,A large cross-ancestry meta-analysis of genome-wide association studies identifies 69 novel risk loci for primary open-angle glaucoma and includes a genetic link with Alzheimer …,2020,11
Michiya Yamamoto,Feasability study of printed circuit board using flat plate heat pipes,1992,11
Michiya Yamamoto,Noctuidae (excluding Herminiinae),1987,11
Michiya Yamamoto,Effects of group size on performance and member satisfaction,2018,10
Michiya Yamamoto,A simple method of protoplast formation and protoplast regeneration from various fungi using an enzyme from Trichoderma harzianum,1988,10
Michiya Yamamoto,Hyakunin-eyesshu: A tabletop hyakunin-isshu game with computer opponent by the action prediction based on gaze detection,2011,9
Michiya Yamamoto,InterPointer: speech-driven embodied entrainment pointer system,2005,9
Michiya Yamamoto,"Mass rearing of the diamondback moth, Plutella xylostella L. with an improved artificial diet.",1992,9
Michiya Yamamoto,Mathematical model for wide range gaze tracking system based on corneal reflections and pupil using stereo cameras,2012,8
Michiya Yamamoto,Time Lag Effects of Utterance to Communicate Actions on Human-Robot Greeting Interaction,2004,8
Michiya Yamamoto,Genome-wide meta-analysis identifies 127 open-angle glaucoma loci with consistent effect across ancestries. Nat Commun. 2021; 12 (1): 1258,2019,7
Michiya Yamamoto,Implicit user calibration for gaze-tracking systems using an averaged saliency map around the optical axis of the eye,2018,7
Michiya Yamamoto,Detection of Philadelphia chromsome-positive acute lymphoblastic leukemia by polymerase chain reaction: possible eradication of minimal residual disease by bone marrow …,1992,7
Michiya Yamamoto,On-demand lectures that enable students to feel the sense of a classroom with students who learn together,2021,6
Michiya Yamamoto,Differences in customers’ interactions with expert/novice salesclerks in a bespoke tailoring situation: a case study on the utterances of salesclerks,2019,6
Michiya Yamamoto,Measurement of hand raising actions to support students’ active participation in class,2014,6
Michiya Yamamoto,Development of an embodied interaction system with InterActor by speech and hand motion input,2005,6
Michiya Yamamoto,Analysis by synthesis of the timing of utterance to communicative actions on greeting embodied interaction,2003,6
Michiya Yamamoto,GATA transcription factor expression parallels development of the embryonic chicken optic tectum,1994,6
Michiya Yamamoto,Suppressive effects by Serratia marcescens B2 against Botrytis fabae-induced chocolate spot disease of broad bean,1992,6
Michiya Yamamoto,"RELATION OF MITOCHONDRIAL REDOX POTENTIAL TO HEPATIC ENERGY-CHARGE IN ANIMALS WITH HEPATECTOMY, JAUNDICE, HEMORRHAGE AND SEPSIS AS WELL AS PATIENTS WITH MULTIPLE ORGAN FAILURE",1982,6
Michiya Yamamoto,"Molecular basis for the disruption of Keap1-Nrf2 interaction via Hinge & Latch mechanism, Commun. Biol. 4 (2021) 576",N/A,6
Michiya Yamamoto,The effects of group size in the furniture assembly task,2017,5
Michiya Yamamoto,Enter your PIN code securely! utilization of personal difference of angle kappa,2016,5
Michiya Yamamoto,Hand-raising robot for promoting active participation in classrooms,2015,5
Michiya Yamamoto,Monogatari no ukete niyoru serifu hatsuwa: Monogatari no soogo kooi teki tenkai [Serifu utterances by recipients of storytelling: Interactive developments of stories],2013,5
Michiya Yamamoto,Development of an embodied image telecasting method via a robot with speech-driven nodding response,2007,5
Michiya Yamamoto,Threshold odor concentrations of MTBE and other fuel oxygenates. Paper ENVR 216,1997,5
Michiya Yamamoto,Cooling system using heat pipes for circuit package of tele-communication equipment,1992,5
Michiya Yamamoto,Effect of the artificial liver support system in treatments of acute hepatic failure-on cases survived in patients with fulminant hepatitis and patients with acute fatty liver …,1982,5
Michiya Yamamoto,Transethnic Meta-Analysis of Genome-Wide Association Studies Identifies Three New Loci and Characterizes Population-Specific Differences for Coronary Artery Disease. Circ …,N/A,5
Michiya Yamamoto,"Nrf2 impacts cellular bioenergetics by controlling substrate availability for mitochondrial respiration, Biol Open 2 (2013) 761–770",N/A,5
Michiya Yamamoto,"Shimamoto,(1987), T. A new technique to efficiently entrap leuprolide acetate into microcapsules of polylactic acid or copoly (lactic/glycolic) acid",N/A,5
Michiya Yamamoto,Emotion Estimation Using Body Expression Types Based on LMA and Sensitivity Analysis,2019,4
Michiya Yamamoto,Application of classification method of emotional expression type based on laban movement analysis to design creation,2019,4
Michiya Yamamoto,An affect extraction method in personal fabrication based on Laban movement analysis,2016,4
Michiya Yamamoto,Framework for realizing a free-target eye-tracking system,2015,4
Michiya Yamamoto,Development of Corneal Reflection-based Gaze Tracking System for Public Use,2014,4
Michiya Yamamoto,Development of a mobile tablet pc with gaze-tracking function,2013,4
Michiya Yamamoto,Development of embodied visual effects which expand the presentation motion of emphasis and indication,2011,4
Michiya Yamamoto,Analysis by synthesis of an information presentation method of embodied agent based on the time lag effects of utterance to communicative actions,2007,4
Michiya Yamamoto,EFFECT OF ARTIFICIAL LIVER SUPPORT SYSTEM IN TREATMENT OF ACUTE HEPATIC-FAILURE,1984,4
Michiya Yamamoto,Estimation of emotional state in personal fabrication: analysis of emotional motion based on Laban movement analysis,2017,3
Michiya Yamamoto,Major Factors in Kansei Evaluation of 3D Objects,2016,3
Michiya Yamamoto,Development of a context-enhancing surface based on the entrainment of embodied rhythms and actions sharing via interaction,2012,3
Michiya Yamamoto,Relationships between the utterance of emphatic phrase and the following motions and actions for a speech-driven embodied interaction system,2005,3
Michiya Yamamoto,A case of vasospastic angina: development of transient collateral circulation lessen the degree of myocardial ischemia during coronary artery spasm,1991,3
Michiya Yamamoto,Subject Experiments About Shaking Response of Human Body using Earthquake experience vehicle,2022,2
Michiya Yamamoto,Construction of customers’ emotion model in the bespoke tailoring using evaluation grid method,2020,2
Michiya Yamamoto,VR system to simulate tightrope walking with a standalone VR headset and slack rails,2019,2
Michiya Yamamoto,Modeling corneal reflection for eye-tracking considering eyelid occlusion,2018,2
Michiya Yamamoto,Video-based performance recognition of assembly work in a practical training class for teaching material preparation,2016,2
Michiya Yamamoto,Analysis of hand raising actions for group interaction enhancement,2016,2
Michiya Yamamoto,Eye-tracking volume simulation method to configure hardware settings for tangible and multi-user tabletop interaction,2013,2
Michiya Yamamoto,Effects of a communication with make-believe play in a real-space sharing edutainment system,2013,2
Michiya Yamamoto,Development of a real-space sharing edutainment system based on communication support with make-believe play,2011,2
Michiya Yamamoto,An embodied entrainment character cell phone by speech and head motion inputs,2010,2
Michiya Yamamoto,Novel DNA extraction method unveiled the ancient hot deep biosphere concealed in terrestrial sedimentary rocks,2009,2
Michiya Yamamoto,Video content production support system with speech-driven embodied entrainment character by speech and hand motion inputs,2009,2
Michiya Yamamoto,Speech-driven embodied entrainment character system with hand motion input in mobile environment,2007,2
Michiya Yamamoto,"Erratum: Glutathione peroxidase 2, the major cigarette smoke-inducible isoform of GPX in lungs, is regulated by Nrf2 (American Journal of Respiratory Cell and Molecular Biology …",2007,2
Michiya Yamamoto,Development of an embodied interaction system with interactor by speech and hand motion input,2005,2
Michiya Yamamoto,Nrf2 activation by electrophiles is mediated by the inhibition of proteasomal degradation of Nrf2 protein in activated macrophages,2001,2
Michiya Yamamoto,Equivalent inductor composed of switched capacitor circuits or current-mode circuits,1999,2
Michiya Yamamoto,Study on distributed virtual environment with multimedia communication: introduction of flexible method for DVE expansion,1999,2
Michiya Yamamoto,An experimental study on distributed virtual environment for integrated training system on machine maintenance,1998,2
Michiya Yamamoto,Orange County Water District,1997,2
Michiya Yamamoto,Polymorphisms and differentiations of cytoplasmic genome in wild soybean growing in Korea,1997,2
Michiya Yamamoto,A procedure for recording cochlear potentials and auditory brain stem response in unrestrained rats,1984,2
Michiya Yamamoto,Energy response in the liver of diabetic rats to hemorrhagic shock: physiologic significance of decreased insulin response.,1979,2
Michiya Yamamoto,A Study on Eye-Region Expression as Naturally Expressed in a Situation of Spontaneously Evoked Emotions,2023,1
Michiya Yamamoto,"Analysis of Relationships among Body Movement, Eye Information, and Physiological Indices in Emotion Expressions during Video Watching",2022,1
Michiya Yamamoto,Development of a Vision Training System Using an Eye Tracker by Analyzing Users’ Eye Movements,2020,1
Michiya Yamamoto,A Long-Term Evaluation of Social Robot Impression,2020,1
Michiya Yamamoto,KiroPi: A life-log robot by installing embodied hardware on a tablet,2015,1
Michiya Yamamoto,Simulator for developing gaze sensitive environment using corneal reflection-based remote gaze tracker,2014,1
Michiya Yamamoto,Development of a life-log robot for supporting group interaction in everyday life,2013,1
Michiya Yamamoto,Analysis of pointing motions by introducing a joint model for supporting embodied large-surface presentation,2011,1
Michiya Yamamoto,Dimethyl fumarate suppresses inflammation in vitro via both Nrf2-dependent and Nrf2-independent pathways,2011,1
Michiya Yamamoto,Development of an eye-tracking pen display for analyzing embodied interaction,2011,1
Michiya Yamamoto,NEW TAXA,2009,1
Michiya Yamamoto,Parasitic specialization of Magnaporthe grisea 10. RFLP analysis of genomic DNA (4),1996,1
Michiya Yamamoto,Structure and function of GATA transcription factors; possible roles in cell differentiation,1994,1
Michiya Yamamoto,Electrical properties and orientations of dye molecules in LB films,1991,1
Michiya Yamamoto,SIS receiver development at Nobeyama Radio Observatory,1990,1
Michiya Yamamoto,Helicoverpa armigera (Hubner),1987,1
