Author Name,Title,Year,Citations
Ryota Sakamoto,A New Method To Generate Arene-Terminated Si (111) and Ge (111) Surfaces via a Palladium-Catalyzed Arylation Reaction,2012,0
Ryota Sakamoto,B102 食事支援ロボットによる弾性推定に基づく掬い制御 (B1-1 医療福祉工学・人間工学 1),2011,0
Ryota Sakamoto,B103 マスタースレーブ装置による液面崩れを考慮した揺動撹拌制御 (B1-1 医療福祉工学・人間工学 1),2011,0
Ryota Sakamoto,C311 手振れに対する位置補正フィルタを用いた描画支援システムの開発 (計測と推定),2011,0
Ryota Sakamoto,頸髄損傷者を対象とした上肢動作支援ロボットによる肘動作支援制御,2011,0
Ryota Sakamoto,J1601-1-1 頭部連携視点による身振り誘導情報表示システム ([J1601-1] メカニカルシステムシステムの知能化),2010,0
Ryota Sakamoto,J1602-1-1 指・手首運動筋の FES 運動点探索装置の開発 ([J1602-1] 機械の知能化と脳工学応用),2010,0
Ryota Sakamoto,高精細・低容量な講義映像配信に関する研究,2010,0
Ryota Sakamoto,"BIO-11 A Body Motion Instruction System Using Shape Memory Alloy Actuator (Bio-medical Equipments III, Technical Program of Oral Presentations)",2009,0
Ryota Sakamoto,"E-Learning System for English Education to emphasize Pronunciation, Word-for-Word Translation and Free Translation",2008,0
Ryota Sakamoto,High accuracy 2D sub-pixel matching method skillfully managing error characteristics,2007,0
Ryota Sakamoto,High accuracy 2D sub-pixel matching method skillfully managing error characteristics [6764-21],2007,0
Ryota Sakamoto,High-quality and small-capacity e-learning video featuring lecturer-superimposing PC screen images,2006,0
Ryota Sakamoto,"5613 板書型講義のための高精細低容量な映像生成方法 (J20-1 メカニカルシステムとその知能化 (1), J20 メカニカルシステムとその知能化)",2006,0
Ryota Sakamoto,"2301 低速インターネット配信可能な講義映像の意味符号化技術 (J23-1 メカニカルシステムとその知能化 (1), J23 メカニカルシステムとその知能化, 2005 年度年次大会)",2005,0
Ryota Sakamoto,Study on a High Compression Processing for Video-on-Demand e-learning System,2005,0
Ryota Sakamoto,Simplified LCA [life cycle asesment] evaluation for various processes of municipal waste treatment,2000,0
Ryota Sakamoto,Changes in contact factors in a cardiopulmonary bypass using hemofiltration for priming blood,1998,0
Ryota Sakamoto,Report on a Job-hunting Event for Medical Students-Career Support and Education under the State of Emergency Declared over COVID-19,N/A,0
Ryota Sakamoto,Behavior of the Fueling Pellet in the Guiding Tube,N/A,0
Ryota Sakamoto,Sliding Raised-Dots Perceptual Characteristics,N/A,0
Rajesh Kulkarni,Integration of artificial intelligence activities in software development processes and measuring effectiveness of integration,2017,37
Rajesh Kulkarni,Investigating Agile Adaptation for Project Development.,2017,19
Rajesh Kulkarni,Usability evaluation of PS using SUMI (software usability measurement inventory),2013,18
Rajesh Kulkarni,An Extensive Review on Data Mining Methods and Clustering Models for Intelligent Transportation System,2017,16
Rajesh Kulkarni,Critical review of extended waterfall model,2015,9
Rajesh Kulkarni,"Tree, mesh structure based and stateless multicast routing protocols in wireless networks",2013,8
Rajesh Kulkarni,TEIM-THE evolved integrated model of se and hci,2012,6
Rajesh Kulkarni,Landslide monitoring using wireless sensor networks-a case study,2020,2
Rajesh Kulkarni,Validating utility of TEIM: a comparative analysis,2013,2
Rajesh Kulkarni,Relevance- and Frequency-Enabled Trip Planning Model Based on Socio-economic Status,2016,1
Rajesh Kulkarni,Dissemination of xml data in wireless environment supporting twig pattern queries,2014,1
Rajesh Kulkarni,Coronavirus disease 2019 pneumonia with acute respiratory distress syndrome in a child requiring prolonged mechanical ventilation: A case report,2023,0
Rajesh Kulkarni,Transportation Planning and Optimal Roadway Configuration: A Review,2021,0
Rajesh Kulkarni,SUSTAINABLE MOBILITY THROUGH POLLUTION-AWARE MODELS AND POLICIES: A SYSTEMIC REVIEW,2021,0
Rajesh Kulkarni,SUSTAINABLE MOBILITY THROUGH POLLUTION-AWARE MODELS AND POLICIES: A SYSTEMIC REVIEW,2021,0
Rajesh Kulkarni,Transportation Planning and Optimal Roadway Configuration: A Review,2021,0
Rajesh Kulkarni,Redesigning of Home Appliance-Gas Stove Using Usability Engineering,2020,0
Rajesh Kulkarni,"Hadoop, HDFS and MapReduce: A Survey",2020,0
Rajesh Kulkarni,Outlier detection using weighted holoentropy with hyperbolic tangent function,2018,0
Rajesh Kulkarni,A New Approach to Broadcast XML Data in Wireless Environment Supporting Twig Pattern Queries,2017,0
Rajesh Kulkarni,A socio-economic status-dependent case study on relevance and frequency-enabled trip planning model,2017,0
Rajesh Kulkarni,PS redesign for Smartphone-using older adults,2016,0
Rajesh Kulkarni,Critical Review of Extended Agile Process Model,2015,0
Rajesh Kulkarni,Designing Secured Incremental Backup for Cloud,2015,0
Rajesh Kulkarni,A Fine Grained Framework for Selective Sharing of Composite EHRs in Clouds,2014,0
Rajesh Kulkarni,A Novel Encoding Technique of Broadcasting XML data using Twig patterns in wireless Environment,2013,0
Rajesh Kulkarni,Improving Software Quality Attributes of PS Using Stylecop,2013,0
Rajesh Kulkarni,A Process of Metaphor Generation for PS,2012,0
Rajesh Kulkarni,using contextual inquiry as a subset of requirement gathering process,2012,0
Rajesh Kulkarni,PS Redesign for Smartphone-Using Older Adults,N/A,0
Rajesh Kulkarni,Model for Advanced Sandwich Probe Topology Inference Scheme in Network Tomography,N/A,0
Martin Sperka,Face tracking in color video sequences,2003,41
Martin Sperka,Skin color segmentation method based on mixture of gaussians and its application in learning system for finger alphabet.,2004,19
Martin Sperka,Graphic design in the age of interactive media,2005,17
Martin Sperka,The Origins of Computer Graphics in the Czech and Slovak Republics,1994,8
Martin Sperka,Face tracking for expressions simulations,2003,6
Martin Sperka,Interactive visualization of abstract data,2010,5
Martin Sperka,Web 3D and new forms of human computer interaction,2004,5
Martin Sperka,Past and future of Human—Computer Interaction,2014,4
Martin Sperka,Exploring and understanding software behaviour using interactive 3d visualization,2010,4
Martin Sperka,Face expressions animation in e-learning,2008,4
Martin Sperka,INTERAKCIA ČLOVEK–POČÍTAČ,2009,2
Martin Sperka,Interactive Learning System for Sign Language Configurations and Finger Alphabet,2002,2
Martin Sperka,Face tracking for expressions simulations,2003,1
Martin Sperka,Augmented Reality and E-Training: Learning Finger Alphabet,N/A,1
Martin Sperka,The Role of Academy of Science in Creation of the Slovak Computer Industry,2020,0
Martin Sperka,THE ROLE OF ACADEMY OF SCIENCES IN CREATIONOF SLOVAK COMPUER INDUSTRY,2020,0
Martin Sperka,Trends in information visualization for software analysis and development,2014,0
Martin Sperka,TYPOGRAPHY IN MOTION,N/A,0
Martin Sperka,Human Face Expressions Animation and e-Learning,N/A,0
Martin Sperka,Visual Information Discovery in Software Systems,N/A,0
Gerwald Tschinkel,Discovery and visual analysis of linked data for humans,2014,35
Gerwald Tschinkel,Using Semantics for Interactive Visual Analysis of Linked Open Data.,2014,26
Gerwald Tschinkel,Suggesting visualisations for published data,2014,21
Gerwald Tschinkel,Automated Visualization Support for Linked Research Data.,2013,18
Gerwald Tschinkel,The recommendation dashboard: A system to visualise and organise recommendations,2015,8
Gerwald Tschinkel,Using micro-visualisations to support faceted filtering of recommender results,2016,7
Gerwald Tschinkel,Visual Recommendations for Scientific and Cultural Content.,2015,2
Gerwald Tschinkel,A recommendation dashboard utilising micro-filter visualisations: An evaluation and investigation of applicability on mobile devices,2020,1
Gerwald Tschinkel,Evaluating the Memorability and Readability of Micro-filter Visualisations,2017,1
Gerwald Tschinkel,D2. 6--Second Usability Evaluation Report,2016,0
Gerwald Tschinkel,D2. 5--Final Software Components for Presentation and Augmentation Interfaces,2016,0
Yoshiki Takeoka,Z-touch: an infrastructure for 3d gesture interaction in the proximity of tabletop surfaces,2010,111
Yoshiki Takeoka,Z-touch: a multi-touch system for detecting spatial gestures near the tabletop,2010,8
Dr. Abhijit Patil,"Analysis of multi-modal biometrics system for gender classification using face, iris and fingerprint images",2019,20
Dr. Abhijit Patil,Fingerprint based Gender Identification using Discrete Wavelet Transform and Gabor Filters,2016,20
Dr. Abhijit Patil,Fusion of Local Binary Pattern and Local Phase Quantization features set for Gender Classification using Fingerprints,2019,16
Dr. Abhijit Patil,Behavioral biometric data analysis for gender classification using feature fusion and machine learning,2021,14
Dr. Abhijit Patil,Automatic human gender identification using palmprint,2019,9
Dr. Abhijit Patil,Multimodal Biometrics Data Analysis for Gender Estimation Using Deep Learning,2020,7
Dr. Abhijit Patil,Fusion of features and synthesis classifiers for gender classification using fingerprints,2019,7
Dr. Abhijit Patil,Offline and online signature verification systems: A survey,2014,7
Dr. Abhijit Patil,Fusion Of Gabor Wavelet And Local Binary Patterns (LBP) Features Sets For Gender Identification Using Palmprints,1934,5
Dr. Abhijit Patil,Multimodal biometrics data based gender classification using machine vision,2019,4
Dr. Abhijit Patil,Palmprint biometric data analysis for gender classification using binarized statistical image feature set,2021,3
Dr. Abhijit Patil,Binarized Statistical Image Feature set for Palmprint based Gender Identification,2019,3
Dr. Abhijit Patil,Statistical Features Based Gender Identification Using SVM,2016,3
Dr. Abhijit Patil,Forensic Face Sketch Construction and Recognition,2020,1
Dr. Abhijit Patil,Binarized Statistical Image Feature Set for Palmprint based Gender Identification,N/A,0
Ding Ding,Simulated thoughts in virtual reality for negotiation training enhance self-efficacy and knowledge,2020,55
Ding Ding,Self-identification with a virtual experience and its moderating effect on self-efficacy and presence,2021,25
Ding Ding,Virtual reality negotiation training system with virtual cognitions,2017,13
Ding Ding,Two-phase online virtual machine placement in heterogeneous cloud data center,2015,10
Ding Ding,Multi-Q: multiple queries optimization based on MapReduce in cloud,2014,8
Ding Ding,Simulating the inner voice: A study of sound parameters,2018,2
Ding Ding,Persuasive self-experiences with virtual cognitions: Advanced social skills training simulator,2016,2
Ding Ding,SleepyFlora: Supporting Sleep Sharing and Augmentation over a Distance for Social Bonding across Time Zones,2023,1
Ding Ding,Extended VR: Exploring the Integration of VR Experiences and Real-world Engagement,2023,1
Ding Ding,"The Effect of an Adaptive Simulated Inner Voice on User’s Eye-gaze Behaviour, Ownership Perception and Plausibility Judgement in Virtual Reality",2020,1
Ding Ding,Public speaking training in front of an imaginary or virtual audience: A randomized controlled trial,2019,1
Ding Ding,Disentangled Cross-modal Transformer for RGB-D Salient Object Detection and Beyond,2024,0
Ding Ding,When you were old: Exploring a Virtual Reality Older Adults Experience Simulation System,2023,0
Ding Ding,IVRSandplay: An Immersive Virtual Reality Sandplay System Coupled with Hand Motion Capture and Eye Tracking,2023,0
Ding Ding,VRNavigSS: A Two-dimensionality Virtual Reality System for Depression Level Detection,2023,0
Ding Ding,Design and evaluation of simulated reflective thoughts in virtual reality exposure training,2020,0
Ding Ding,Virtual reality exposure with eye-gaze adaptive virtual cognitions,2019,0
Dr. Inam Ur Rehman,A Low-Cost InteractiveWriting Board for Primary Education using Distinct Augmented Reality Markers,2019,19
Dr. Inam Ur Rehman,Fingertip gestures recognition using leap motion and camera for interaction with virtual environment,2020,16
Dr. Inam Ur Rehman,The effect of semantic multi-modal aids using guided virtual assembly environment,2014,13
Dr. Inam Ur Rehman,Two hand gesture based 3d navigation in virtual environments,2019,12
Dr. Inam Ur Rehman,Gestures and marker based low-cost interactive writing board for primary education,2022,9
Dr. Inam Ur Rehman,"Navigation Aids in Collaborative Virtual Environments: Comparison of 3DML, Audio, Textual, Arrows-Casting",2019,8
Dr. Inam Ur Rehman,Measuring the student’s success rate using a constraint based multi-modal virtual assembly environment,2014,8
Dr. Inam Ur Rehman,A real-time multi view gait-based automatic gender classification system using kinect sensor,2023,7
Dr. Inam Ur Rehman,Digital twins-based Internet of Robotic Things for remote health monitoring of COVID-19 patients,2023,5
Dr. Inam Ur Rehman,Multi layered multi task marker based interaction in information rich virtual environments,2020,4
Dr. Inam Ur Rehman,The effect of constraint based multi-modal virtual assembly on student’s learning,2016,4
Dr. Inam Ur Rehman,Multi-Layered Hierarchical Bounding Box based interaction in virtual environments,2015,4
Dr. Inam Ur Rehman,Gesture-based guidance for navigation in virtual environments,2022,3
Dr. Inam Ur Rehman,"Thumb inclination-based manipulation and exploration, a machine learning based interaction technique for virtual environments",2021,3
Dr. Inam Ur Rehman,Systematic augmentation of artoolkit markers for indoor navigation and guidance: systematic augmentation of artoolkit markers for indoor navigation and guidance,2019,3
Dr. Inam Ur Rehman,FPSI-Fingertip pose and state-based natural interaction techniques in virtual environments,2023,1
Daniel J. Chen,Visually induced motion sickness: Effects of translational visual motion along different axes,2011,38
Daniel J. Chen,Visually induced motion sickness when viewing visual oscillations of different frequencies along the fore-and-aft axis: keeping velocity versus amplitude constant,2016,33
Daniel J. Chen,Correlations between individual susceptibility to visually induced motion sickness and decaying time constant of after-nystagmus,2017,22
Daniel J. Chen,Visually induced motion sickness after watching scenes oscillating at different frequencies and amplitudes,2012,14
Daniel J. Chen,"The relationship between spatial velocity, vection, and visually induced motion sickness: an experimental study",2011,9
Daniel J. Chen,Mining reported adverse events induced by potential opioid-drug interactions,2020,2
Daniel J. Chen,Vection provoked by visual oscillation: Is frequency the major determining factor?,2017,1
Daniel J. Chen,Solver Recommendation For Transport Problems in Slabs Using Machine Learning,2019,0
Daniel J. Chen,Speed judgments of background motion and illusion of self-motion when viewing sinusoidal visual stimuli along fore-and-aft axis with different frequencies and velocities,2014,0
Daniel J. Chen,Contemporary Ergonomics and Human Factors 2012,N/A,0
Ranko Petrovic,ISO/IEC 27043: 2015—Role and application,2016,21
Ranko Petrovic,Designing Laboratory for IoT Communication Infrastructure Environment for Remote Maritime Surveillance in Equatorial Areas Based on the Gulf of Guinea Field Experiences,2020,14
Ranko Petrovic,Fusion of visual and thermal imagery for illumination invariant face recognition system,2018,11
Ranko Petrovic,Thermal image degradation influence on R-CNN face detection performance,2019,10
Ranko Petrovic,Facial expression and lighting conditions influence on face recognition performance,2018,10
Ranko Petrovic,Man-in-the-middle attack based on ARP spoofing in IoT educational platform,2021,8
Ranko Petrovic,"Iot oth maritime surveillance service over satellite network in equatorial environment: Analysis, design and deployment",2021,8
Ranko Petrovic,A Review of Wazuh Tool Capabilities for Detecting Attacks Based on Log Analysis,2022,7
Ranko Petrovic,Blur and motion blur influence on face recognition performance,2018,7
Ranko Petrovic,Enhancement algorithms for low-light and low-contrast images,2020,6
Ranko Petrovic,Real-time multi-sensor infrared imagery enhancement,2018,4
Ranko Petrovic,Implementation Challenge and Analysis of Thermal Image Degradation on R-CNN Face Detection,2020,3
Ranko Petrovic,Thermal-to-Visible Face Recognition for Illumination Invariant Systems,2018,3
Ranko Petrovic,Distributed web hacking by adaptive consensus-based reinforcement learning,2023,2
Ranko Petrovic,Prepoznavanje emocija sa slika lica primenom multisenzorskih sistema,2020,2
Ranko Petrovic,Thermal Imagery Noise Influence on Face Recognition Performance,2019,2
Ranko Petrovic,Optimal HOG cell to image ratio for robust multi-sensor face recognition systems,2019,1
Ranko Petrovic,Educational Platform for Examining the Influence of the Simulated Satellite Link on Overall Communication inside of Different IoT Systems,2023,0
Ranko Petrovic,Implementation of GRE Tunelling on low cost SoM,2022,0
Ranko Petrovic,"IoT laboratory for supporting different types of secure communications with sensors, with the special emphasis on satellite link",2020,0
Ranko Petrovic,Educational platform for VoIP communication legal eavesdropping,2018,0
Ranko Petrovic,Uloga digitalne forenzike u detekciji copy-move napada na sliku,2017,0
Ranko Petrovic,Uloga forenzike u otkrivanju zloupotrebe digitalne slike,2017,0
Omar Shahid,Vision-based Action Understanding for Assistive Healthcare: A Short Review.,2019,61
Omar Shahid,UPIC: user and position independent classical approach for locomotion and transportation modes recognition,2020,18
Omar Shahid,Classifying eye-tracking data using saliency maps,2021,11
Omar Shahid,Cooking activity recognition with varying sampling rates using deep convolutional GRU framework,2021,7
Omar Shahid,A pragmatic signal processing approach for nurse care activity recognition using classical machine learning,2020,7
Omar Shahid,Contactless human activity analysis: An overview of different modalities,2021,6
Omar Shahid,Data-driven automated detection of autism spectrum disorder using activity analysis: A review,2020,5
Omar Shahid,Classical machine learning approach for human activity recognition using location data,2021,4
Omar Shahid,UPIC,2020,0
Juan Pablo Forero Cortes,Touch me gently: recreating the perception of touch using a shape-memory alloy matrix,2020,44
Juan Pablo Forero Cortes,M-Hair: Creating novel tactile feedback by augmenting the body hair to respond to magnetic field,2019,20
Juan Pablo Forero Cortes,Ad-hoc access to musical sound for deaf individuals,2016,11
Juan Pablo Forero Cortes,PhantomTouch: Creating an extended reality by the illusion of touch using a shape-memory alloy matrix,2019,10
Juan Pablo Forero Cortes,PostBits: using contextual locations for embedding cloud information in the home,2016,6
Juan Pablo Forero Cortes,Bward: An optical approach for reliable in-situ early blood leakage detection at catheter extraction points,2015,6
Juan Pablo Forero Cortes,Insight: a systematic approach to create dynamic human-controller-interactions,2017,5
Juan Pablo Forero Cortes,Primary school students programming with real-time environmental sensor data,2022,3
Juan Pablo Forero Cortes,Object detection and motion identification using electromagnetic radiation,2019,3
Juan Pablo Forero Cortes,M-Hair: Extended Reality by Stimulating the Body Hair,2019,3
Juan Pablo Forero Cortes,FootNote: designing a cost effective plantar pressure monitoring system for diabetic foot ulcer prevention,2015,3
Juan Pablo Forero Cortes,OM: A Comprehensive Tool to Elicit Subjective Vibrotactile Expressions Associated with Contextualised Meaning in Our Everyday Lives.,2021,2
Juan Pablo Forero Cortes,nZwarm: a swarm of luminous sea creatures that interact with passers-by,2014,2
Juan Pablo Forero Cortes,On-site device for detecting presence of a liquid,2020,1
Juan Pablo Forero Cortes,Striving for Authentic and Sustained Technology Use in the Classroom: Lessons Learned from a Longitudinal Evaluation of a Sensor-Based Science Education Platform,2023,0
Juan Pablo Forero Cortes,OM: A Comprehensive Tool to Elicit Subjective Vibrotactile Expressions Associated with Contextualised Meaning in Our Everyday Lives,2021,0
Daniel Immanuel Fink,Relive: Bridging in-situ and ex-situ visual analytics for analyzing mixed reality user studies,2022,52
Daniel Immanuel Fink,Memory in motion: The influence of gesture-and touch-based input modalities on spatial memory,2017,16
Daniel Immanuel Fink,Towards asynchronous hybrid user interfaces for cross-reality interaction,2021,15
Daniel Immanuel Fink,""" It's in my other hand!""–Studying the Interplay of Interaction Techniques and Multi-Tablet Activities",2020,15
Daniel Immanuel Fink,Re-locations: Augmenting Personal and Shared Workspaces to Support Remote Collaboration in Incongruent Spaces,2022,11
Daniel Immanuel Fink,"Blended Museum: The Interactive Exhibition"" Rebuild Palmyra?""",2018,8
Daniel Immanuel Fink,"BinocularsVR: A VR experience for the exhibition “From Lake Constance to Africa, a long distance travel with ICARUS”",2019,2
Daniel Immanuel Fink,""" It’s in my other hand!"": Studying the Interplay of Interaction Techniques and Multi-Tablet Activities",2020,0
Daniel Immanuel Fink,Hybride Exponate und deren Kontextualisierung im BLM Karlsruhe,2018,0
Daniel Immanuel Fink,Rebuild Palmyra?: Zukunft eines umkämpften Welterbes,2017,0
Daniel Immanuel Fink,Colibri: A Toolkit for Rapid Prototyping of Networking Across Realities,N/A,0
Chri Hübscher,Building an interaction design pattern language: A case study,2010,55
Chri Hübscher,Error prevention in online forms: Use color instead of asterisks to mark required-fields,2009,39
Chri Hübscher,The organization of interaction design pattern languages alongside the design process,2011,19
Chri Hübscher,Entwicklung der Menüforschung in Human Computer Interaction,2002,2
Chri Hübscher,Opwis Klaus.(2010),N/A,2
Chri Hübscher,Aufgabenanalyse im Usability Engineering–Fragen zur Durchführung im realen Kontext,2002,1
Chri Hübscher,Structured approaches to interaction design: a way to bridge the gap between the results of foundational user research and the final design of a user interface,2017,0
Chri Hübscher,Aufbau einer Interaction Design Pattern Library,2014,0
Chri Hübscher,Autonomous Agents als Ausbildungsinstrument für Psychologie,2003,0
Chri Hübscher,Implementierung eines Lernvorganges für einen Roboterarm œ ein Erfahrungsbericht,2000,0
Chri Hübscher,Vergleich verschiedener computergestützter Item-Präsentationsarten von Ratingskalen,1999,0
Ji Hyun Park Ph.D.,A framework for designing assistive technologies for teaching children with ASDs emotions,2012,67
Ji Hyun Park Ph.D.,Understanding user needs for serious games for teaching children with autism spectrum disorders emotions,2012,44
Ji Hyun Park Ph.D.,Understanding user needs for serious games for teaching children with autism spectrum disorders emotions,2012,44
Ji Hyun Park Ph.D.,"Flow in multitasking: the effects of motivation, artifact, and task factors",2014,3
Ji Hyun Park Ph.D.,A Study of Design That Understands the Influences on the Changes of Information Processing Ability of Users,2009,3
Ji Hyun Park Ph.D.,Multitasking in e-learning environments: users' multitasking strategies and design implications,2012,1
Nova eka diana,Measuring performance of n-gram and Jaccard-similarity metrics in document plagiarism application,2019,17
Nova eka diana,IBM PELATIHAN DECOUPAGE DAN E-COMMERCE UNTUK MENINGKATKAN EKONOMI IBU RUMAH TANGGA,N/A,13
Nova eka diana,PROTOTIPE LITERASI INFORMASI BERBASIS WEB SEBAGAI UPAYA PENINGKATAN KEMAMPUAN LITERASI SISWA MAN INSAN CENDEKIA,2017,12
Nova eka diana,Comparing windowing methods on finite impulse response (FIR) filter algorithm in electroencephalography (EEG) data processing,2016,12
Nova eka diana,Aplikasi Diagnosis Penyakit Ikan Arwana Menggunakan Aturan Inferensi Fuzzy Berbasis Web,2014,9
Nova eka diana,Cognitive-Affective Emotion Classification: Comparing Features Extraction Algorithm Classified by Multi-class Support Vector Machine,2016,8
Nova eka diana,Evaluasi Pelatihan Pivot Tabel untuk Analisis Worksheet Data bagi Pelajar MAN 21 Jakarta,2019,6
Nova eka diana,Identifikasi Emosi Berdasarkan Action Unit Menggunakan Metode Bézier Curve,2016,6
Nova eka diana,Measuring user experience of a potential shipment tracking application,2015,6
Nova eka diana,The first modular database of Indonesian genes-associated diseases information,2017,5
Nova eka diana,Pelatihan Internet Sehat Dan Desain Web Untuk Ibu-Ibu PKK Di Depok,2019,3
Nova eka diana,Understanding student emotion in video-based learning: Case study-programming course,2016,3
Nova eka diana,Visualization of ontology-based data warehouse for malaria spread incidences using Protégé,2016,3
Nova eka diana,Comprehensive Centralized-Data Warehouse for Managing Malaria Cases,2015,3
Nova eka diana,Sistem Temu Kembali Citra Wajah Berbasis Eigenface,2007,3
Nova eka diana,Studi Literatur Pemanfaatan High Performance Computing dalam Bidang Bioinformatics,2017,2
Nova eka diana,Expert E-Prescription Application (EEPA) Using Forward Chaining Method,2015,2
Nova eka diana,Preliminary study of AR navigation-guided core-needle breast biopsy,2022,1
Nova eka diana,Would It Be The Same? Measuring Mental Health Status in Conventional Vs. Digital Way,2022,1
Nova eka diana,Investigating the optimal parameterization of deep neural network and synthetic data workflow for imbalance liver disorder dataset classification,2020,1
